Title,IMDB_Rating,Reelgood_Rating,Genres,Year,Tags,Country,Source,Rated,Duration,Description,Director,Employees
Under the Shadow,6.8,,"['Horror', 'Thriller']",2016,"['Ghost', 'Supernatural']",Jordan,Kanopy,13+ (PG-13),PT1H24M,"After Shideh's building is hit by a missile during the Iran-Iraq War, a superstitious neighbor suggests that the missile was cursed and might be carrying malevolent Middle-Eastern spirits. She becomes convinced a supernatural force within the building is attempting to possess her daughter Dorsa, and she has no choice but to confront these forces if she is to save her daughter and herself.Under the Shadow featuring Narges Rashidi and Avin Manshadi is streaming with subscription on Netflix, streaming with subscription on Kanopy, available for rent or purchase on iTunes, and 2 others. It's a horror and thriller movie with a better than average IMDb audience rating of 6.8 (27,192 votes).",Babak Anvari,"['Narges Rashidi', 'Avin Manshadi', 'Bobby Naderi', 'Ray Haratian', 'Hamid Djavadan', 'Bijan Daneshmand', 'Behi Djanati Atai', 'Aram Ghasemy', 'Soussan Farrokhnia', 'Arash Marandi', 'Nabil Koni', 'Sajjad Delafrooz', 'Houshang Ranjbar', 'Amir Ranjbar', 'Emily Leo', 'Lucan Toh', 'Oliver Roskill', 'Babak Anvari']"
Nate Bargatze: The Tennessee Kid,7.6,,[],2019,[],America,Netflix,,PT1H0M,"A Nate Bargatze stand up comedy show for Netflix.Nate Bargatze: The Tennessee Kid featuring Nate Bargatze is streaming with subscription on Netflix. It has a high IMDb audience rating of 7.6 (1,815 votes).",Ryan Polito,"['Nate Bargatze', 'Nate Bargatze']"
Bad Seeds,7.3,,"['Drama', 'Comedy']",2018,['Feel-good'],France,Netflix,18+ (R),PT1H40M,"Wael, a former street child, makes a living from small scams with his adoptive mother and partner-in-crime Monique. When this unconventional duo swindles the wrong guy, Victor, an old acquaintance of Monique now in charge of a support organization for troubled teens, they have no choice but to become his interim secretary and educator in order to redeem themselves.Bad Seeds featuring Kheiron and Catherine Deneuve is streaming with subscription on Netflix. It's a comedy and drama movie with a better than average IMDb audience rating of 7.3 (5,444 votes).",Kheiron,"['Kheiron', 'Catherine Deneuve', 'André Dussollier', 'Hakou Benosmane', 'Leila Boumedjane', 'Alban Lenoir', 'Louison Blivet', 'Adil Dehbi', 'Youssouf Wague', 'Ouassima Zrouki', 'Joseph Jovanovic', 'Sofiane Zermani', 'Ingrid Donnadieu', 'Leyla Doriane', 'Marion Christmann', 'Françoise Remont', 'Marc David', 'Alexandre Aubry', 'Maxime Nourrichard', 'Killian Taillasson', 'Yanis Bouregba', 'Simon Istolainen', 'Kheiron']"
A Love Story,6.4,,"['Romance', 'Drama']",2007,[],Philippines,Netflix,,PT1H57M,"Ian Montes is a picture of success. Despite being a son of a shipping tycoon, Ian refused to just ride in his father's empire. He built his own real estate company and earned his first million at a very young age. He never looked back since then. Driven by his ambition to become better, if not as good as his father, Ian managed to make it on his own. But behind all the glory is a man yearning for love and recognition.A Love Story featuring Maricel Soriano and Aga Muhlach is streaming with subscription on Netflix, and available for rent or purchase on Prime Video. It's a drama and romance movie with an average IMDb audience rating of 6.4 (142 votes).",Maryo J. de los Reyes,"['Maricel Soriano', 'Aga Muhlach', 'Angelica Panganiban', 'Dante Rivero', 'Chin Chin Gutierrez', 'Bobby Andrews', 'TJ Trinidad', 'Baron Geisler', 'John Arcilla', 'Gerald Madrid', 'Mark Acueza', 'Bart Guingona', 'R.S. Francisco', 'Anita Linda', 'Eva Darren', 'Gilleth Sandico', 'Jaymee Joaquin', 'Mark Gil', 'Madeleine Humphries', 'Liza Diño', 'Sophia Baars', 'Charo Santos-Concio', 'Malou N. Santos', 'Vanessa Valdez']"
Joan Didion: The Center Will Not Hold,7.4,,['Documentary'],2017,[],America,Netflix,,PT1H32M,"Griffin Dunne’s years-in-the-making documentary portrait of his aunt Joan Didion moves with the spirit of her uncannily lucid writing: the film simultaneously expands and zeroes in, covering a vast stretch of turbulent cultural history with elegance and candor.Joan Didion: The Center Will Not Hold featuring Joan Didion and Griffin Dunne is streaming with subscription on Netflix. It's a documentary movie with a better than average IMDb audience rating of 7.4 (2,614 votes) and was very well received by critics.",Griffin Dunne,"['Joan Didion', 'Griffin Dunne', 'Hilton Als', 'David Hare', 'Phyllis Rifield', 'Amy Robinson', 'Shelley Wanger', 'Tom Brokaw', 'Harrison Ford', 'Susanna Moore', 'Vanessa Redgrave', 'Robert Silvers', 'Calvin Trillin', 'Anna Wintour', 'Patricia Krenwinkel', 'Patricia Hearst', 'Charles Manson', 'Linda Kasabian', 'Leslie Van Houten', 'Janis Joplin', 'Tuesday Weld', 'Nathan Halpern']"
Burn Out,6.2,,"['Mystery', 'Thriller']",2018,"['Drug', 'Adaptation', 'Based on Books']",France,Netflix,18+ (R),PT1H47M,"Tony, a promising young motorcycle racer, is forced to do perilous drug runs to save the mother of his child from a dangerous mobster.Burn Out featuring François Civil and Olivier Rabourdin is streaming with subscription on Netflix, and available for rent or purchase on Microsoft Store. It's a mystery and thriller movie with an average IMDb audience rating of 6.2 (3,748 votes).",Yann Gozlan,"['François Civil', 'Olivier Rabourdin', 'Manon Azem', 'Samuel Jouy', 'Narcisse Mame', 'Sam Louwyck', 'Luc Schwarz', 'Naël Rabia', 'Marc-Antoine Duquenne', 'Mario Magalhaes', 'Walid Afkir', 'Ismaëla Koita', 'Kaourou Camara', 'Denis Leluc', 'Dimitri Boetto', 'Alain Bellot', 'Margaux Guillosou', 'Soufiane Guerrab', 'Sébastien Lozach', 'Matthias Weber', 'Thibault Gast', 'Wassim Béji', 'Guillaume Lemans', 'Jérémie Guez', 'Yann Gozlan', 'Grégoire Auger']"
Kodachrome,6.8,,"['Comedy', 'Drama']",2017,['Technology'],America,Netflix,18+ (R),PT1H45M,"Matt Ryder is convinced to drive his estranged and dying father Benjamin Ryder cross country to deliver four old rolls of Kodachrome film to the last lab in the world that can develop them before it shuts down for good. Along with Ben's nurse Zooey, the three navigate a world changing from analogue to digital while trying to put the past behind them.Kodachrome featuring Ed Harris and Jason Sudeikis is streaming with subscription on Netflix. It's a comedy and drama movie with a better than average IMDb audience rating of 6.8 (16,593 votes).",Mark Raso,"['Ed Harris', 'Jason Sudeikis', 'Elizabeth Olsen', 'Bruce Greenwood', 'Wendy Crewson', 'Dennis Haysbert', 'Gethin Anthony', 'Bill Lake', 'Rob Stewart', 'Vladimir Jon Cubrt', 'Al Mukaddam', 'Sebastian Pigott', 'Sebastian MacLean', 'Paolo Mancini', 'Elena Juatco', 'Humberly Gonzalez', 'Isaak Bailey', 'Morgan Lever', 'James Collins', 'Lisa Andry-Dargel', 'Bea Santos', 'Daniel S. Levine', 'Ellen Goldsmith-Vein', 'Eric Robinson', 'Jonathan Tropper', 'Leon Clarance', 'Shawn Levy', 'Dan Cohen', 'Jo Monk', 'Laure Vaysse', 'Lisa Wilson', 'Mary Anne Waterhouse', 'Myles Nestel', 'Jonathan Tropper', 'Agatha Kaspar']"
Adhugo,5.9,,['Drama'],2018,[],,Netflix,,PT1H50M,"Bunty, the little pink piglet is the apple of Chanti’s (Sathwik) eye. But what happens when this innocent little creature is embroiled with people who each have their own agenda to seek?Adhugo featuring Ravi Babu and Nabha Natesh is streaming with subscription on Netflix. It's a drama movie with an average IMDb audience rating of 5.9 (67 votes).",Ravi Babu,"['Ravi Babu', 'Nabha Natesh', 'Kanal Kannan', 'Shamna Kasim', 'Abhishek Verma', 'Satyanand']"
Russell Peters: Almost Famous,6.6,,"['Stand-up & Talk', 'Comedy']",2016,[],,Netflix,,PT1H13M,"The comic comes home to Toronto to sound off on cultural quirks, furniture building and bathroom visits, reveling in all things ridiculously human.Russell Peters: Almost Famous featuring Russell Peters is streaming with subscription on Netflix. It's a Comedy and Stand up & Talk movie with an average IMDb audience rating of 6.6 (1,895 votes).",David Higby,"['Russell Peters', 'Russell Peters']"
A Futile and Stupid Gesture,6.7,,"['Biography', 'Comedy']",2018,"['Revenge', 'Parody']",America,Netflix,18+ (R),PT1H41M,"The National Lampoon name became globally recognized after the monumental success of Animal House—but before the glory days, it was a scrappy yet divinely subversive magazine and radio show that introduced the world to comedic geniuses like Bill Murray, Chevy Chase, John Belushi, and Gilda Radner. The driving force behind National Lampoon was Doug Kenney (Will Forte), and his truly wild and crazy story unfolds in A Futile and Stupid Gesture from Harvard to Hollywood to Caddyshack and beyond.A Futile and Stupid Gesture featuring Will Forte and Domhnall Gleeson is streaming with subscription on Netflix. It's a biography and comedy movie with a better than average IMDb audience rating of 6.7 (16,011 votes) and was met with mixed reviews by critics.",David Wain,"['Will Forte', 'Domhnall Gleeson', 'Martin Mull', 'Thomas Lennon', 'Joel McHale', 'John Gemberling', 'Matt Walsh', 'Rick Glassman', 'Jon Daly', 'Seth Green', 'Matt Lucas', 'Paul Scheer', 'Lonny Ross', 'Neil Casey', 'Armen Weitzman', 'Jackie Tohn', 'Natasha Lyonne', 'Emmy Rossum', 'Camille Guaty', 'Elvy', 'Meera Rohit Kumbhani', 'Jonathan Stern', 'Peter Principato', 'Ben Ormand', 'David Wain', 'Ed Helms', 'Edward H. Hamm Jr.', 'John Aboud', 'Michael Colton', 'Sean McKittrick', 'John Aboud', 'Michael Colton', 'Craig Wedren']"
Furie,6.3,,"['Thriller', 'Drama']",2019,"['Martial Arts', 'Kidnapping']",Vietnam,Hoopla,18+ (R),PT1H38M,"When a little girl is kidnapped by a trafficking ring, they soon find they messed with the wrong child. Her mother, a notorious former gang leader, is close on their trail and will go to any lengths to bring her child home.Furie featuring Ngô Thanh Vân and Phan Thanh Nhiên is streaming with subscription on Netflix, streaming with subscription on Hoopla, available for rent or purchase on iTunes, and 3 others. It's a drama and thriller movie with an average IMDb audience rating of 6.3 (4,708 votes) and was very well received by critics.",Lê Văn Kiệt,"['Ngô Thanh Vân', 'Phan Thanh Nhiên', 'Phạm Anh Khoa', 'Thanh Hoa', 'Mai Cát Vi', 'Lê Trang', 'Ngô Thanh Vân', 'Lê Văn Kiệt', 'Nguyen Truong Nhan']"
Nathicharami,7.1,,"['Action & Adventure', 'Drama']",2018,[],India,Netflix,,PT1H56M,"A widow struggles with the dilemma of her own growing sexual needs, and her desire to remain faithful to the memory of her late husband.Nathicharami featuring Sruthi Hariharan and Balaji Manohar is streaming with subscription on Netflix. It's an action & adventure and drama movie with a better than average IMDb audience rating of 7.1 (320 votes).",Mansore,"['Sruthi Hariharan', 'Balaji Manohar', 'Sanchari Vijay', 'Poornachandra Mysore', 'Jagan Mohan Reddy', 'M Ramesh', 'Shiva Kumar Reddy', 'Sandhya Rani', 'Bindhu Malini']"
Hampstead,6,,"['Romance', 'Comedy']",2017,['Friendship'],United Kingdom,Netflix,13+ (PG-13),PT1H42M,"Emily Walters is an American widow living a peaceful, uneventful existence in the idyllic Hampstead Village of London, when she meets local recluse, Donald Horner. For 17 years, Donald has lived—wildly yet peacefully—in a ramshackle hut near the edge of the forest. When Emily learns his home is the target of developers who will stop at nothing to remove him, saving Donald and his property becomes her personal mission. Despite his gruff exterior and polite refusals for help, Emily is drawn to him—as he is to her—and what begins as a charitable cause evolves into a relationship that will grow even as the bulldozers close in.Hampstead featuring Diane Keaton and Brendan Gleeson is streaming with subscription on Netflix, streaming with subscription on AMC+ (Via Prime Video), available for purchase on iTunes, and 2 others. It's a comedy and romance movie with an average IMDb audience rating of 6.0 (6,375 votes) and was not well received by critics.",Joel Hopkins,"['Diane Keaton', 'Brendan Gleeson', 'James Norton', 'Lesley Manville', 'Jason Watkins', 'Simon Callow', 'Alistair Petrie', 'Phil Davis', 'Hugh Skinner', 'Adeel Akhtar', 'Rosalind Ayres', 'Deborah Findlay', 'William Smith', 'Brian Protheroe', 'Peter Singh', 'Jo Wheatley', 'Douglas Rae', 'Robert Bernstein', 'Alison Thompson', 'David Glasser', 'Deepak Nayar', 'Harvey Weinstein', 'Ian Hutchinson', 'Jo Monk', 'Laure Vaysse', 'Mark Gooder', 'Mark Woolley', 'Robert Festinger', 'Stephen Warbeck']"
Killing Hasselhoff,4.4,,"['Thriller', 'Comedy']",2017,[],America,Netflix,18+ (R),PT1H20M,"A man in a high stakes celebrity death pool quickly loses everything - his business, his bank account, his home, his fiancé. He snaps, then realizes the only way to get his life back on track. He'll have to murder his own celebrity. He'll have to kill Hasselhoff.Killing Hasselhoff featuring Ken Jeong and David Hasselhoff is streaming with subscription on Netflix, available for rent or purchase on iTunes, available for rent or purchase on Google Play, and 3 others. It's a comedy and thriller movie with a less than average IMDb audience rating of 4.4 (2,664 votes).",Darren Grant,"['Ken Jeong', 'David Hasselhoff', 'Justin Bieber', 'Mel B', 'Michael Winslow', 'Rebecca Olejniczak', 'Howie Mandel', 'Kid Cudi', 'Carlos PenaVega', 'Jon Lovitz', 'Rhys Darby', 'Flula Borg', 'Will Sasso', 'Jim Jefferies', 'Ron Funches', 'Irina Voronina', 'Colton Dunn', 'Rick Fox', 'Dan Bakkedahl', 'Gena Lee Nolin', ""Chelsea O'Toole"", 'Abhishek Devalla', 'Ashok Amritraj', 'David Hasselhoff', 'Michael J. Luisi', 'Michele Berk', 'Patrick Hughes', 'Warren Zide', 'Brett Carducci', 'Eric Gardner', 'Manu Gargi', 'Peter Hoare', 'Peter Hoare', 'Nathan Whitehead']"
Spyder,6.3,,"['Thriller', 'Action & Adventure']",2017,['Disaster'],India,Netflix,,PT2H25M,"A surveillance expert who wants to help people comes across a foe who is the very definition of evil. Can he stop the man before he destroys everything?Spyder featuring Mahesh Babu and Rakul Preet Singh is streaming with subscription on Netflix. It's an action & adventure and thriller movie with an average IMDb audience rating of 6.3 (10,301 votes).",A.R. Murugadoss,"['Mahesh Babu', 'Rakul Preet Singh', 'S. J. Suryah', 'Bharath Srinivasan', 'Balaji Patturaj', 'Nagineedu Vellanki', 'Hareesh Peradi', 'Jayaprakash', 'Shaji Chen', 'Priyadarshi Pullikonda', 'Sayaji Shinde', 'Dheepa Ramanujam', 'Ajay Rathnam', 'Sentrayan', 'Kani Kusruti', 'Himaja', 'N.V. Prasad', 'Tagore Madhu', 'Harris Jayaraj']"
Justin Timberlake + The Tennessee Kids,7.6,,['Documentary'],2016,['Music'],America,Netflix,,PT1H30M,"For Justin Timberlake it's the final two dates of his 20/20 Experience World Tour at the MGM Grand Garden Arena in Las Vegas. Surrounded by the 25 band members of The Tennessee Kids and featuring show-stopping performances from one of the highest-grossing tours of the decade, the film is a culmination of the singer’s 134 shows and 2 years on the road.Justin Timberlake + The Tennessee Kids featuring Justin Timberlake is streaming with subscription on Netflix. It's a documentary movie with a high IMDb audience rating of 7.6 (2,191 votes).",Jonathan Demme,"['Justin Timberlake', 'Gary Goetzman']"
Quiet Victory: The Charlie Wedemeyer Story,7.1,,"['Comedy', 'Drama']",1988,"['Doctor', 'High School', 'Sports']",America,Netflix,,PT1H40M,"Film that tells the story of Los Gatos (California) high school football coach Charlie Wedemeyer. At 31, onetime football pro Wedemeyer is living the American dream; a winning team, a happy marriage and public adulation.Quiet Victory: The Charlie Wedemeyer Story featuring Pam Dawber and Michael Nouri is streaming with subscription on Netflix, and available for purchase on Prime Video. It's a comedy and drama movie with a better than average IMDb audience rating of 7.1 (143 votes).",Roy Campanella II,"['Pam Dawber', 'Michael Nouri', 'Bess Meyer', 'Peter Berg', 'James Handy', 'Dan Lauria', 'Kyle Chandler', 'Reginald VelJohnson', 'Noble Willingham', 'Stephen Dorff', 'Betty Carvalho', 'Mark Joy', 'Jim Grimshaw', 'Jennifer Lanier', 'Howard Kingkade', 'Richard K. Olsen', 'Barry Morrow']"
Sebastian Maniscalco: Stay Hungry,7.1,,"['Stand-up & Talk', 'Comedy']",2019,[],America,Netflix,18+ (R),PT1H5M,"Sebastian Maniscalco brings an acerbically unique approach to peacocks on planes, life hacks, rich in-laws and life's annoyances in this comedy special.Sebastian Maniscalco: Stay Hungry featuring Sebastian Maniscalco is streaming with subscription on Netflix. It's a Comedy and Stand up & Talk movie with a better than average IMDb audience rating of 7.1 (1,303 votes).",Rik Reinholdtsen,"['Sebastian Maniscalco', 'Sebastian Maniscalco']"
Long Shot,7.4,,"['Sport', 'Documentary']",2017,['Short'],America,Netflix,16+,PT40M,"When Juan Catalan is arrested for a murder he insists he didn't commit, he builds his case for innocence around unexpected raw footage.Long Shot featuring Juan Catalan and Todd Melnik is streaming with subscription on Netflix. It's a documentary and sport movie with a better than average IMDb audience rating of 7.4 (7,773 votes).",Jacob LaMendola,"['Juan Catalan', 'Todd Melnik', 'Tim Gibbons', 'Robert Gajic', 'Larry David', 'Kym Whitley', 'Tasha Boggs', 'Melissa Catalan', 'Miguel Catalan', 'Leslie Dunn', 'Sam Fernández', 'Éric Gagné', 'Marcus Giles', 'Alma Oseguera', 'Martin Pinner', 'Juan Rodríguez', 'Beth Silverman', 'Deborah Wong Yang', 'Jacob LaMendola', 'Liz F. Mason', 'Mary Beth Minthorn', 'Milos Silber', 'Todd Wiseman Jr.', 'Abby Davis', 'Jason Spingarn-Koff', 'Kevin Iwashina', 'Lisa Nishimura']"
What the Health,7.2,,['Documentary'],2017,['Doctor'],America,Netflix,,PT1H37M,"Filmmaker Kip Andersen uncovers the secret to preventing and even reversing chronic diseases, and he investigates why the nation's leading health organizations doesn't want people to know about it.What the Health featuring Kip Andersen and Larry Baldwin is streaming with subscription on Netflix, available for rent or purchase on Google Play, and available for rent or purchase on Prime Video. It's a documentary movie with a better than average IMDb audience rating of 7.2 (29,158 votes).",Keegan Kuhn,"['Kip Andersen', 'Kip Andersen', 'Larry Baldwin', 'Neal Barnard', 'Tia Blanco', 'David Carter', 'Jake Conroy', 'Garth Davis', 'Caldwell Esselstyn Jr.', 'Mike Ewall', 'Alan Goldhamer', 'Michael Greger', 'Mu Jin Han', 'Jaydee Hanson', 'Joel Kahn', 'Mark Kennedy', 'Steve-O', 'Keegan Kuhn', 'Kip Andersen', 'Jim Greenbaum', 'Joaquin Phoenix', 'Sheryl Greenberg', 'Keegan Kuhn', 'Kip Andersen', 'Fernando Arce', 'Keegan Kuhn', 'Kip Andersen']"
White Fang,6.9,,"['Animation', 'Drama']",2018,"['Animal', 'Dog', 'Adaptation']",France,Netflix,7+ (PG),PT1H27M,"A loyal wolfdog’s curiosity leads him on the adventure of a lifetime while serving a series of three distinctly different masters.White Fang featuring Raphaël Personnaz and Virginie Efira is streaming with subscription on Netflix. It's an animation and drama movie with a better than average IMDb audience rating of 6.9 (3,675 votes).",Alexandre Espigares,"['Raphaël Personnaz', 'Virginie Efira', 'Dominique Pinon', 'Frantz Confiac', 'Gilles Morvan', 'Christel Henon', 'Clément Calvet', 'Jérémie Fajner', 'Lilian Eche', 'Marc Turtletaub', 'Peter Saraf', 'Joshua M. Cohen', 'Leah Holzer', 'Jack London', 'Bruno Coulais']"
"Oh, Ramona!",4.8,,"['Romance', 'Comedy']",2019,['Coming of Age'],Romania,Netflix,18+ (R),PT1H49M,"Oh, Ramona! seeks the transformation of Andrew from a teenager into an adult who lives candidly and selflessly his first love story, innocent and uninvolved, alternating with the second, intense and insane story, incapable of making a choice. Oh, Ramona! is the cinematic rewriting of Andrei Ciobanu's book ""Suge-o, Ramona!"".Oh, Ramona! featuring Bogdan Iancu and Aggy K. Adams is streaming with subscription on Netflix. It's a comedy and romance movie with a less than average IMDb audience rating of 4.8 (8,873 votes).",Cristina Jacob,"['Bogdan Iancu', 'Aggy K. Adams', 'Basil Eidenbenz', 'Holly Horne', 'Adina Stetcu', 'Mihaela Mihut', 'Ioachim Ciobanu', 'Smiley', 'Howard Dell', 'Andromeda Godfrey', 'Melanie Ebanks', 'Leonardo Boudreau', 'Ela Prodan', 'Andrei Ciobanu', 'Cristina Ich', 'Alfredo Minea', 'Adrian Sarbu', 'Daniel Iacob', 'Alex Cotet', 'Andrei Ciobanu', 'Cristina Jacob']"
Show Dogs,3.8,,"['Family', 'Comedy']",2018,"['Animal', 'Dog']",United Kingdom,Netflix,7+ (PG),PT1H32M,"Max, a macho, solitary Rottweiler police dog is ordered to go undercover as a primped show dog in a prestigious Dog Show, along with his human partner, to avert a disaster from happening.Show Dogs featuring Will Arnett and Ludacris is streaming with subscription on Netflix, available for rent or purchase on iTunes, available for rent or purchase on Prime Video, and 2 others. It's a comedy and family movie with a low IMDb audience rating of 3.8 (4,695 votes).",Raja Gosnell,"['Will Arnett', 'Ludacris', 'Natasha Lyonne', 'Jordin Sparks', 'Gabriel Iglesias', ""Shaquille O'Neal"", 'Omar Chaparro', 'Stanley Tucci', 'Oliver Tompsett', 'Andy Beckwith', 'RuPaul', 'Alan Cumming', 'Anders Holm', 'Blake Anderson', 'Delia Sheppard', 'Kate Micucci', 'Bern Collaco', 'Kerry Shale', 'Cristina Dohmen', 'Daniel Eghan', 'Clem So', 'Marc Hyman', 'Max Botkin']"
Extremis,7.3,,['Documentary'],2016,[],America,Netflix,7+ (PG),PT24M,"A purely observational non-fiction film that takes viewers into the ethically murky world of end-of-life decision making in a public hospital.Extremis featuring Monica Bhargava and Jessica Zitter is streaming with subscription on Netflix. It's a documentary movie with a better than average IMDb audience rating of 7.3 (2,392 votes).",Dan Krauss,"['Monica Bhargava', 'Jessica Zitter', 'Dan Krauss']"
MFKZ,6.7,,"['Animation', 'Science-Fiction']",2018,[],France,Netflix,18+ (R),PT1H35M,"Angelino is just one of thousands of deadbeats living in Dark Meat City. But an otherwise unremarkable scooter accident caused by a beautiful, mysterious stranger is about to transform his life... into a waking nightmare! He starts seeing monstrous forms prowling around all over the city... Is Angelino losing his mind, or could an alien invasion really be happening this quietly...?MFKZ featuring Orelsan and Gringe is streaming with subscription on Netflix, available for rent or purchase on iTunes, available for rent or purchase on Prime Video, and 2 others. It's an Animation and Science Fiction movie with a better than average IMDb audience rating of 6.7 (4,349 votes) and was not well received by critics.",Guillaume Renard,"['Shōjirō Nishimi', 'Orelsan', 'Gringe', 'Redouanne Harjane', 'Féodor Atkine', 'Kelly Marot', 'Julien Kramer', 'Emmanuel Karsen', 'Gilbert Levy', 'Jérémie Covillault', 'Alain Dorval', 'Frantz Confiac', 'Edgar Givry', 'Pauline Moingeon Vallès', 'Fouzia Youssef', 'Guillaume Renard', 'Anthony Roux', 'Eiko Tanaka', 'Frédéric Puech', 'Amanda Celine Miller', 'Guillaume Renard']"
K. D.,8.4,,['Drama'],2019,[],India,Netflix,,PT1H59M,"Karuppudurai runs away from his house and befriends a little child who motivates him to live his life to the fullest.K. D. featuring Mu Ramaswamy and Nagavishal is streaming with subscription on Netflix. It's a drama movie with a high IMDb audience rating of 8.4 (1,760 votes).",Madhumita,"['Mu Ramaswamy', 'Nagavishal', 'Yoge Jappie', 'Badava Gopi', 'Siddharth Anand Kumar', 'Vikram Mehra', 'Gaurav Sharma', 'Sahil Sharma', 'Shoaib Lokhandwala', 'Madhumita']"
Blind Detective,6.4,,"['Comedy', 'Crime']",2013,['Serial Killer'],China,Netflix,,PT2H10M,"A blind detective, former cop, teams up with a policewoman who admires him to solve the disappearance of a girl friend of hers, years ago. Besides, he helps her to improve her skills as an investigator.Blind Detective featuring Andy Lau and 郑秀文 is streaming with subscription on Netflix. It's a comedy and crime movie with an average IMDb audience rating of 6.4 (3,271 votes).",Johnnie To,"['Andy Lau', '郑秀文', '郭涛', 'Gao Yuanyuan', 'Lo Hoi-Pang', 'Bonnie Wong', 'Lam Suet', 'Philip Keung', 'Wang Ziyi', 'Lang Yueting', 'Lo Fan', 'Celine Ma Tai-Lau', 'Chun Wong', 'Terence Tsui Chi-Hung', 'Mimi Chu', 'Lee Shing-Cheong', 'Stephanie Che', 'Raymond Tsang Chau Ming', 'Ben Ting', 'Bonnie Xian', 'Johnnie To', 'Wai Ka-Fai', 'Ryker Chan', 'Wai Ka-Fai', 'Yau Nai-Hoi', 'Yu Xi', 'Hal Beckett', 'Marc Baril']"
The Players,5.3,,"['Drama', 'Comedy']",2012,['Female Director'],France,Netflix,18+ (R),PT1H49M,"Eight short films explore the subject of male infidelity. Serial cheaters, Fred and Greg, spend a night on the town doing what they do best, and with absolutely no regrets. The duo play various characters in assorted extracurricular situations, ranging from sexist to the darker sides of carnal desires.The Players featuring Jean Dujardin and Gilles Lellouche is streaming with subscription on Netflix. It's a comedy and drama movie with a less than average IMDb audience rating of 5.3 (8,218 votes).",Alexandre Courtes,"['Emmanuelle Bercot', 'Eric Lartigau', 'Fred Cavayé', 'Gilles Lellouche', 'Jean Dujardin', 'Michel Hazanavicius', 'Jean Dujardin', 'Gilles Lellouche', 'Géraldine Nakache', 'Alexandra Lamy', 'Priscilla de Laforcade', 'Florine Delobel', 'Guillaume Canet', 'Sandrine Kiberlain', 'Isabelle Nanty', 'Manu Payet', 'Mathilda May', 'Aina Clotet', 'Charles Gérard', 'Rebecca Jameson', 'Clara Ponsot', 'Lionel Abelanski', 'Bastien Bouillon', 'Guillaume Delaunay', 'Violette Blanckaert', 'Julie Nicolet', 'Karine Ventalon', 'Éric Hannezo', 'Guillaume Lacroix', 'Jean Dujardin', 'Marc Dujardin', 'Gilles Lellouche', 'Jean Dujardin', 'Nicolas Bedos', 'Philippe Caverivière', 'Stéphane Joly', 'Evgueni Galperine', ""Pino D'Angiò""]"
