Title,IMDB_Rating,Reelgood_Rating,Genres,Year,Tags,Country,Source,Rated,Duration,Description,Director,Employees
Nightcrawler,7.8,,"['Crime', 'Thriller']",2014,"['Suspense', 'Psychology', 'Car']",America,AMC,18+ (R),PT1H58M,"When Lou Bloom, desperate for work, muscles into the world of L.A. crime journalism, he blurs the line between observer and participant to become the star of his own story. Aiding him in his effort is Nina, a TV-news veteran.Nightcrawler featuring Jake Gyllenhaal and Rene Russo is streaming with subscription on Netflix, streaming via tv everywhere with AMC, available for rent or purchase on iTunes, and 5 others. It's a crime and drama movie with a high IMDb audience rating of 7.8 (524,912 votes).",Dan Gilroy,"['Jake Gyllenhaal', 'Rene Russo', 'Riz Ahmed', 'Bill Paxton', 'Kevin Rahm', 'Michael Hyatt', 'Price Carson', 'Kent Shocknek', 'Sharon Tay', 'Ann Cusack', 'Carolyn Gilroy', 'Marco Rodríguez', 'Michael Papajohn', 'Jonny Coyne', 'Rick Chambers', 'Pat Harvey', 'Rick Garcia', 'James Huang', 'Leah Fredkin', 'Bill Seward', 'Holly Hannula', 'David Lancaster', 'Jake Gyllenhaal', 'Jennifer Fox', 'Michel Litvak', 'Tony Gilroy', 'Betsy Danbury', 'Gary Michael Walters', 'Dan Gilroy', 'James Newton Howard']"
Gangubai Kathiawadi,7,,"['Biography', 'Drama']",2022,"['Adaptation', 'Based on Books']",India,Netflix,,PT2H37M,"Young Ganga is sold to a brothel in Mumbai in the garb of becoming an actor by her lover in the 1950s. She goes on to become the feared Gangubai - the Matriarch of Kamathipura - the champion of female emancipation and advocate of rights for sex workers in a chauvinist and narrow-minded society.Gangubai Kathiawadi featuring Alia Bhatt and Ajay Devgn is streaming with subscription on Netflix. It's a biography and drama movie with a better than average IMDb audience rating of 7.0 (46,364 votes).",Sanjay Leela Bhansali,"['Alia Bhatt', 'Ajay Devgn', 'Shantanu Maheshwari', 'Indira Tiwari', 'Seema Pahwa', 'Vijay Raaz', 'Jim Sarbh', 'Chhaya Kadam', 'Anmol Kajani', 'Rahul Vohra', 'Huma Qureshi', 'Varun Kapoor', 'Chum Darang', 'Raza Murad', 'Prashant Kumar', 'Mitali Jagtap', 'Pallavi Jadhav', 'Kruti Saxena', 'Sonal Sagore', 'Baldev Trehan', 'Jahangir Khan', 'Dhaval Jayantilal Gada', 'Sanjay Leela Bhansali', 'Arvinder Shagmer Gill', 'Hussain Zaidi', 'Sanjay Leela Bhansali', 'Utkarshini Vashishtha', 'Ankit Balhara', 'Sanchit Balhara', 'Sanjay Leela Bhansali']"
Sherlock Holmes: A Game of Shadows,7.4,,"['Mystery', 'Thriller']",2011,['Superhero'],United Kingdom,HBO MAX,13+ (PG-13),PT2H9M,"There is a new criminal mastermind at large (Professor Moriarty) and not only is he Holmes’ intellectual equal, but his capacity for evil and lack of conscience may give him an advantage over the detective.Sherlock Holmes: A Game of Shadows featuring Robert Downey Jr. and Jude Law is streaming with subscription on Netflix, streaming with subscription on HBO MAX, available for rent or purchase on iTunes, and 3 others. It's an action & adventure and mystery movie with a better than average IMDb audience rating of 7.4 (447,113 votes).",Guy Ritchie,"['Robert Downey Jr.', 'Jude Law', 'Noomi Rapace', 'Jared Harris', 'Rachel McAdams', 'Eddie Marsan', 'Kelly Reilly', 'Stephen Fry', 'Paul Anderson', 'Geraldine James', 'William Houston', 'Wolf Kahler', 'Iain Mitchell', 'Jack Laskey', 'Patricia Slater', 'Karima McAdams', 'Richard Cunningham', 'Marcus Shakesheff', 'Mark Sheals', 'George Taylor', 'Michael Webber', 'Dan Lin', 'Joel Silver', 'Lionel Wigram', 'Susan Downey', 'Bruce Berman', 'Steve Clark-Hall', 'Kieran Mulroney', 'Michele Mulroney', 'Hans Zimmer']"
Oldboy,5.7,,"['Action & Adventure', 'Mystery']",2013,"['Revenge', 'Dystopia']",America,Netflix,18+ (R),PT1H44M,"An everyday man has only three and a half days and limited resources to discover why he was imprisoned in a nondescript room for 20 years without any explanation.Oldboy featuring Josh Brolin and Elizabeth Olsen is streaming with subscription on Netflix, available for rent or purchase on iTunes, available for rent or purchase on Prime Video, and 2 others. It's an action & adventure and drama movie with an average IMDb audience rating of 5.7 (75,223 votes).",Spike Lee,"['Josh Brolin', 'Elizabeth Olsen', 'Sharlto Copley', 'Samuel L. Jackson', 'Michael Imperioli', 'Pom Klementieff', 'James Ransone', 'Max Casella', 'Linda Emond', 'Elvis Nolasco', 'Rami Malek', 'Lance Reddick', 'Hannah Ware', 'Richard Portnow', 'Hannah Simone', 'Ciera Payton', 'Cinqué Lee', 'Steven Hauck', 'Caitlin Dulany', 'Ilfenesh Hadera', 'Phyllis Montana LeBlanc', 'Doug Davison', 'Roy Lee', 'Spike Lee', 'John Powers Middleton', 'Kim Dong-joo', 'Nathan Kahane', 'Peter Schlessel', 'Mark Protosevich', 'Roque Baños']"
Molly's Game,7.4,,"['Crime', 'Drama']",2017,"['Based On True Story', 'Video Games', 'New York']",Canada,Netflix,18+ (R),PT2H20M,"Molly Bloom, a young skier and former Olympic hopeful becomes a successful entrepreneur (and a target of an FBI investigation) when she establishes a high-stakes, international poker game.Molly's Game featuring Jessica Chastain and Idris Elba is streaming with subscription on Netflix, streaming via tv everywhere with Freeform, available for rent or purchase on iTunes, and 3 others. It's a crime and drama movie with a better than average IMDb audience rating of 7.4 (166,538 votes).",Aaron Sorkin,"['Jessica Chastain', 'Idris Elba', 'Kevin Costner', 'Michael Cera', 'Jeremy Strong', ""Chris O'Dowd"", 'J. C. MacKenzie', ""Brian d'Arcy James"", 'Bill Camp', 'Graham Greene', 'Justin Kirk', 'Angela Gots', 'Natalie Krill', 'Stephanie Herfield', 'Madison McKinley', 'Joe Keery', 'Michael Kostroff', 'Claire Rankin', 'Victor Serfaty', 'Whitney Peak', 'Jon Bass', 'Amy Pascal', 'Mark Gordon', 'Matt Jackson', 'Adam Fogelson', 'Donald Tang', 'Felice Bee', 'Leopoldo Gout', 'Oren Aviv', 'Robert Simonds', 'Stuart M. Besser', 'Wang Zhongjun', 'Wang Zhonglei', 'Aaron Sorkin', 'Daniel Pemberton']"
Black Crab,5.6,,"['Thriller', 'Drama']",2022,"['War', 'Military', 'Adaptation']",Sweden,Netflix,18+ (R),PT1H49M,"In a post-apocalyptic world, six soldiers on a covert mission must transport a mysterious package across a frozen archipelago. Noomi Rapace stars.Black Crab featuring Noomi Rapace and Jakob Oftebro is streaming with subscription on Netflix. It's a drama and thriller movie with an average IMDb audience rating of 5.6 (17,551 votes).",Adam Berg,"['Noomi Rapace', 'Jakob Oftebro', 'Dar Salim', 'Erik Enge', 'Ardalan Esmaili', 'Aliette Opheim', 'Stella Marcimain Klintberg', 'Susan Taslimi', 'David Dencik', 'Nora Rios', 'Peter Edding', 'Gunilla Abrahamsson', 'Joachim Sällquist', 'Ilir Latifi', 'Cecilia Säverman', 'Mikail Akalin', 'Matar Samba', 'Robin Keller', 'Sanna Krepper', 'Marcel Khouri', 'Mostafa Alshawi', 'Adam Berg', 'Jerker Virdborg', 'Pelle Rådström']"
The Girl with the Dragon Tattoo,7.8,,"['Thriller', 'Drama']",2011,"['Revenge', 'Suspense', 'Adaptation']",Norway,Netflix,18+ (R),PT2H38M,"This English-language adaptation of the Swedish novel by Stieg Larsson follows a disgraced journalist, Mikael Blomkvist, as he investigates the disappearance of a weary patriarch's niece from 40 years ago. He is aided by the pierced, tattooed, punk computer hacker named Lisbeth Salander. As they work together in the investigation, Blomkvist and Salander uncover immense corruption beyond anything they have ever imagined.The Girl with the Dragon Tattoo featuring Daniel Craig and Rooney Mara is streaming with subscription on Netflix, available for rent or purchase on iTunes, available for rent or purchase on Google Play, and 3 others. It's a drama and thriller movie with a high IMDb audience rating of 7.8 (455,771 votes).",David Fincher,"['Daniel Craig', 'Rooney Mara', 'Christopher Plummer', 'Stellan Skarsgård', 'Steven Berkoff', 'Robin Wright', 'Yorick van Wageningen', 'Joely Richardson', 'Geraldine James', 'Goran Visnjic', 'Donald Sumpter', 'Ulf Friberg', 'Bengt C.W. Carlsson', 'Tony Way', 'Per Myrberg', 'Josefin Asplund', 'Eva Fritjofson', 'Moa Garpendal', 'Maya Hansson-Bergqvist', 'Sarah Appelberg', 'Julian Sands', 'Ceán Chaffin', 'Ole Søndberg', 'Scott Rudin', 'Søren Stærmose', 'Mikael Wallen', 'Steven Zaillian', 'Steven Zaillian', 'Stieg Larsson']"
The Invisible Guest,8,,"['Crime', 'Thriller']",2017,[],Spain,Netflix,18+ (R),PT1H47M,"Barcelona, Spain. Adrián Doria, a young and successful businessman accused of murder, meets one night with Virginia Goodman, an expert interrogation lawyer, in order to devise a defense strategy.The Invisible Guest featuring Mario Casas and Ana Wagener is streaming with subscription on Netflix. It's a crime and thriller movie with a high IMDb audience rating of 8.0 (170,691 votes).",Oriol Paulo,"['Mario Casas', 'Ana Wagener', 'José Coronado', 'Bárbara Lennie', 'Francesc Orella', 'Paco Tous', 'David Selvas', 'Iñigo Gastesi', 'San Yélamos', 'Manel Dueso', 'Blanca Martínez', 'Pere Brasó', 'Jordi Brunet', 'Robert González', 'Martina Hurtado', 'Ruth Llopis', 'Jordi Llordella', 'Annick Weerts', 'Laia Alberch', 'Cristian Valencia', 'Betsy Túrnez', 'Eneko Lizarraga', 'Mercedes Gamero', 'Mikel Lejarza', 'Adrián Guerra', 'Eneko Lizarraga', 'Núria Valls', 'Sandra Hermida', 'Sofía Fábregas', 'Oriol Paulo', 'Fernando Velázquez']"
Blade,7.1,,"['Horror', 'Action & Adventure']",1998,"['Superhero', 'Vampire', 'Doctor']",America,Netflix,18+ (R),PT2H0M,"The Daywalker known as ""Blade"" - a half-vampire, half-mortal man - becomes the protector of humanity against an underground army of vampires.Blade featuring Wesley Snipes and Stephen Dorff is streaming with subscription on Netflix, available for rent or purchase on iTunes, available for rent or purchase on Prime Video, and 2 others. It's an action & adventure and horror movie with a better than average IMDb audience rating of 7.1 (267,616 votes).",Stephen Norrington,"['Wesley Snipes', 'Stephen Dorff', 'Kris Kristofferson', ""N'Bushe Wright"", 'Donal Logue', 'Udo Kier', 'Arly Jover', 'Traci Lords', 'Kevin Patrick Walls', 'Tim Guinee', 'Sanaa Lathan', 'Eric Edwards', 'Donna Wong', 'Carmen Thomas', 'Shannon Lee', 'Kenny Johnson', 'Clint Curtis', 'Judson Scott', 'Sidney S. Liufau', 'Keith Leon Williams', 'Andray Johnson', 'Peter Frankfurt', 'Robert Engelman', 'Wesley Snipes', 'Avi Arad', 'Joseph Calamari', 'Lynn Harris', 'Michael De Luca', 'Stan Lee', 'David S. Goyer', 'Mark Isham']"
The Alpinist,8,,"['Drama', 'Documentary']",2021,['Sports'],Austria,Netflix,13+ (PG-13),PT1H32M,"When filmmaker Peter Mortimer encounters an elusive young climber named Marc-André Leclerc, an evolution in free solo mountaineering unfolds. Along the two-year journey up high alpine peaks and steep frozen waterfalls, Peter explores Marc’s connection to nature, his uncompromising quest for adventure, and the risks he takes to pursue his passion.The Alpinist featuring Marc-André Leclerc and Brette Harrington is streaming with subscription on Netflix, available for rent or purchase on iTunes, available for rent or purchase on Google Play, and 3 others. It's a documentary and drama movie with a high IMDb audience rating of 8.0 (7,465 votes).",Nick Rosen,"['Peter Mortimer', 'Marc-André Leclerc', 'Brette Harrington', 'Alex Honnold', 'Reinhold Messner', 'Barry Blanchard', 'Michelle Kuipers']"
Terminator Salvation,6.5,,"['Science-Fiction', 'Thriller']",2009,"['Science', 'Robot', 'Apocalypse']",Germany,HBO MAX,13+ (PG-13),PT1H57M,"All grown up in post-apocalyptic 2018, John Connor must lead the resistance of humans against the increasingly dominating militaristic robots. But when Marcus Wright appears, his existence confuses the mission as Connor tries to determine whether Wright has come from the future or the past -- and whether he's friend or foe.Terminator Salvation featuring Christian Bale and Sam Worthington is streaming with subscription on Netflix, streaming with subscription on HBO MAX, free on YouTube, and 5 others. It's an Action & Adventure and Science Fiction movie with an average IMDb audience rating of 6.5 (357,853 votes).",McG,"['Christian Bale', 'Sam Worthington', 'Moon Bloodgood', 'Helena Bonham Carter', 'Anton Yelchin', 'Lonnie Rashid Lynn Jr.', 'Zach McGowan', 'Bryce Dallas Howard', 'Jane Alexander', 'Michael Ironside', ""Ivan G'Vera"", 'Dorian Nkono', 'Chris Browning', 'Beth Bailey', 'Victor J. Ho', 'Buster Reeves', 'Jadagrace', 'Kevin Wiggins', 'Greg Serano', 'Bruce McIntosh', 'Po Chan', 'Derek Anderson', 'Jeffrey Silver', 'Moritz Borman', 'Victor Kubicek', 'Andrew G. Vajna', 'Dan Lin', 'Jeanne Allgood', 'Joel B. Michaels', 'Mario Kassar', 'Peter D. Graves', 'John D. Brancato', 'Michael Ferris', 'Danny Elfman']"
Sherlock Holmes,7.6,,"['Crime', 'Mystery']",2009,"['Serial Killer', 'Adaptation', 'Based on Books']",Australia,HBO MAX,13+ (PG-13),PT2H9M,"Eccentric consulting detective Sherlock Holmes and Doctor John Watson battle to bring down a new nemesis and unravel a deadly plot that could destroy England.Sherlock Holmes featuring Robert Downey Jr. and Jude Law is streaming with subscription on Netflix, streaming with subscription on HBO MAX, available for rent or purchase on iTunes, and 3 others. It's an action & adventure and crime movie with a high IMDb audience rating of 7.6 (621,591 votes).",Guy Ritchie,"['Robert Downey Jr.', 'Jude Law', 'Rachel McAdams', 'Mark Strong', 'Eddie Marsan', 'Robert Maillet', 'Geraldine James', 'Kelly Reilly', 'William Houston', 'Hans Matheson', 'James Fox', 'William Hope', 'Clive Russell', 'Oran Gurel', 'David Garrick', 'Ky Discala', 'Andrew Brooke', 'Tom Watt', 'John Kearney', 'Sebastian Abineri', 'Jonathan Gabriel Robbins', 'Dan Lin', 'Joel Silver', 'Lionel Wigram', 'Peter Eskelsen', 'Steve Clark-Hall', 'Susan Downey', 'Bruce Berman', 'Dana Goldberg', 'Michael Tadross', 'Anthony Peckham', 'Michael Robert Johnson', 'Simon Kinberg']"
Looper,7.4,,"['Crime', 'Science-Fiction']",2012,"['Futuristic', 'Dystopia', 'Suspense']",America,Hulu,18+ (R),PT1H58M,"In the futuristic action thriller Looper, time travel will be invented but it will be illegal and only available on the black market. When the mob wants to get rid of someone, they will send their target 30 years into the past where a looper, a hired gun, like Joe is waiting to mop up. Joe is getting rich and life is good until the day the mob decides to close the loop, sending back Joe's future self for assassination.Looper featuring Joseph Gordon-Levitt and Bruce Willis is streaming with subscription on Netflix, streaming with subscription on Hulu, available for rent or purchase on iTunes, and 3 others. It's an action & adventure and crime movie with a better than average IMDb audience rating of 7.4 (567,403 votes).",Rian Johnson,"['Joseph Gordon-Levitt', 'Bruce Willis', 'Emily Blunt', 'Piper Perabo', 'Noah Segan', 'Jeff Daniels', 'Garret Dillahunt', 'Paul Dano', 'Nick Gomez', 'Tracie Thoms', 'James Landry Hébert', 'Pierce Gagnon', 'Xu Qing', 'Frank Brennan', 'Marcus Hester', 'Jon Eyez', 'Kevin Stillwell', 'Thirl Haston', 'Kenneth Brown Jr.', 'Cody Wood', 'Adam Boyer', 'James D. Stern', 'Ram Bergman', 'Dan Mintz', 'Douglas Hansen', 'Joseph Gordon-Levitt', 'Julie Goldstein', 'Peter Schlessel', 'Rian Johnson', 'Nathan Johnson']"
Hillbilly Elegy,6.7,,"['Action & Adventure', 'Drama']",2020,"['Adaptation', 'Based on Books', 'Drug']",America,Netflix,18+ (R),PT1H57M,"An urgent phone call pulls a Yale Law student back to his Ohio hometown, where he reflects on three generations of family history and his own future.Hillbilly Elegy featuring Gabriel Basso and Amy Adams is streaming with subscription on Netflix. It's an action & adventure and drama movie with a better than average IMDb audience rating of 6.7 (41,326 votes).",Ron Howard,"['Gabriel Basso', 'Amy Adams', 'Glenn Close', 'Haley Bennett', 'Freida Pinto', 'Bo Hopkins', 'Owen Asztalos', 'Jesse C. Boyd', 'Stephen Kunken', 'Keong Sim', 'Morgan Gao', 'Ethan Suess', 'Jono Mitchell', 'Bill Kelly', 'David Dwyer', 'Ethan Levy', 'Caleb Dwayne Tucker', 'Sunny Mabrey', 'Lucy Capri', 'David Alexander', 'Emery Mae Edgeman', 'Brian Grazer', 'Karen Lunder', 'Ron Howard', 'Diana Pokorny', 'J.D. Vance', 'Julie Oh', 'Vanessa Taylor', 'Dave Fleming', 'Hans Zimmer']"
Full Metal Jacket,8.3,,['Drama'],1987,"['War', 'Military', 'Psychology']",United Kingdom,Netflix,18+ (R),PT1H57M,"A pragmatic U.S. Marine observes the dehumanizing effects the U.S.-Vietnam War has on his fellow recruits from their brutal boot camp training to the bloody street fighting in Hue.Full Metal Jacket featuring Matthew Modine and Adam Baldwin is streaming with subscription on Netflix, available for rent or purchase on iTunes, available for rent or purchase on Prime Video, and 2 others. It's a drama movie with a high IMDb audience rating of 8.3 (724,882 votes).",Stanley Kubrick,"['Matthew Modine', 'Adam Baldwin', ""Vincent D'Onofrio"", 'R. Lee Ermey', 'Dorian Harewood', 'Arliss Howard', 'Kevyn Major Howard', ""Ed O'Ross"", 'John Terry', 'Bruce Boa', 'Kieron Jecchinis', 'Jon Stafford', 'Tim Colceri', 'Peter Edmund', 'Kirk Taylor', 'Ian Tyler', 'Gary Landon Mills', 'Sal Lopez', 'Papillon Soo', 'Ngoc Le', 'Tan Hung Francione', 'Stanley Kubrick', 'Jan Harlan', 'Gustav Hasford', 'Michael Herr', 'Stanley Kubrick', 'Vivian Kubrick']"
Into the Wild,8.1,,"['Action & Adventure', 'Drama']",2007,"['Based On True Story', 'Feel-good', 'College']",America,Netflix,18+ (R),PT2H28M,"After graduating from Emory University in 1992, top student and athlete Christopher McCandless abandons his possessions, gives his entire $24,000 savings account to charity, and hitchhikes to Alaska to live in the wilderness.Into the Wild featuring Emile Hirsch and Marcia Gay Harden is streaming with subscription on Netflix, available for rent or purchase on iTunes, available for rent or purchase on Prime Video, and 2 others. It's an action & adventure and drama movie with a high IMDb audience rating of 8.1 (612,469 votes).",Sean Penn,"['Emile Hirsch', 'Marcia Gay Harden', 'William Hurt', 'Jena Malone', 'Brian H. Dierker', 'Catherine Keener', 'Vince Vaughn', 'Kristen Stewart', 'Hal Holbrook', 'Thure Lindhardt', 'Signe Egholm Olsen', 'Jim Gallien', ""James J. O'Neill"", 'Malinda McCollum', 'Paul Knauls', 'Zach Galifianakis', 'Craig Mutsch', 'Jim Beidler', 'John Decker', 'John Hofer', 'Jerry Hofer', 'Art Linson', 'Bill Pohlad', 'Sean Penn', 'David Blocker', 'Frank Hildebrand', 'John J. Kelly', 'Sean Penn', 'Michael Brook']"
42,7.5,,"['Biography', 'Drama']",2013,"['Based On True Story', 'Sports', 'Feel-good']",America,HBO MAX,13+ (PG-13),PT2H8M,"The powerful story of Jackie Robinson, the legendary baseball player who broke Major League Baseball’s color barrier when he joined the roster of the Brooklyn Dodgers. The film follows the innovative Dodgers’ general manager Branch Rickey, the MLB executive who first signed Robinson to the minors and then helped to bring him up to the show.42 featuring Chadwick Boseman and Harrison Ford is streaming with subscription on Netflix, streaming with subscription on HBO MAX, available for rent or purchase on iTunes, and 4 others. It's a biography and drama movie with a better than average IMDb audience rating of 7.5 (93,785 votes).",Brian Helgeland,"['Chadwick Boseman', 'Harrison Ford', 'Nicole Beharie', 'Christopher Meloni', 'Ryan Merriman', 'Lucas Black', 'André Holland', 'Alan Tudyk', 'Hamish Linklater', 'T.R. Knight', 'John C. McGinley', 'Toby Huss', 'Max Gail', 'Brad Beyer', 'James Pickens Jr.', 'Gino Anthony Pesi', 'Brett Cullen', 'Jesse Luken', 'Jamey Holliday', 'Derek Phillips', 'Jamie Ruehling', 'Thomas Tull', 'Dick Cook', 'Jason Clark', 'Jon Jashni', 'Brian Helgeland', 'Mark Isham']"
Army of Thieves,6.4,,"['Mystery', 'Thriller']",2021,"['Zombie', 'Police']",Germany,Netflix,18+ (R),PT2H7M,"A mysterious woman recruits bank teller Ludwig Dieter to lead a group of aspiring thieves on a top-secret heist during the early stages of the zombie apocalypse.Army of Thieves featuring Matthias Schweighöfer and Nathalie Emmanuel is streaming with subscription on Netflix. It's a mystery and thriller movie with an average IMDb audience rating of 6.4 (71,510 votes).",Matthias Schweighöfer,"['Matthias Schweighöfer', 'Nathalie Emmanuel', 'Ruby O. Fee', 'Stuart Martin', 'Guz Khan', 'Jonathan Cohen', 'Noémie Nakai', 'Christian Steyer', 'Dan Bradford', 'Tonya Graves', 'Trent Garrett', 'Barbara Meier', 'Ephraim Goldin', 'Melanie Rada', 'Oleg Kim', 'Samira Mekibes Meza', 'Charlie McGuire', 'Trish Osmond', 'Pavel Gajdoš', 'Hana Frejková', 'Peter Hosking', 'Dan Maag', 'Deborah Snyder', 'Matthias Schweighöfer', 'Misha Bukowski', 'Wesley Coller', 'Zack Snyder', 'Christian Angermayer', 'Frank Kusche', 'Klemens Hallmann', 'Shay Hatten', 'Hans Zimmer', 'Steve Mazzaro']"
The Weekend Away,5.6,,"['Crime', 'Drama']",2022,"['Adaptation', 'Based on Books']",United Kingdom,Netflix,,PT1H29M,"When her best friend vanishes during a girls' trip to Croatia, Beth races to figure out what happened. But each clue yields another unsettling deception.The Weekend Away featuring Leighton Meester and Christina Wolfe is streaming with subscription on Netflix. It's a crime and drama movie with an average IMDb audience rating of 5.6 (20,701 votes).",Kim Farrant,"['Leighton Meester', 'Christina Wolfe', 'Ziad Bakri', 'Luke Norris', 'Amar Bukvić', 'Iva Mihalić', 'Adrian Pezdirc', 'Parth Thakerar', 'Ben Pugh', 'Charlie Morrison', 'Erica Steinberg', 'Andrew Noble', 'Kari Hatfield', 'Sarah Alderson', 'Sarah Alderson', 'Daniel Wohl']"
How It Ends,5,,"['Action & Adventure', 'Mystery']",2018,"['Disaster', 'Apocalypse']",Canada,Netflix,18+ (R),PT1H53M,"A desperate father tries to return home to his pregnant wife after a mysterious apocalyptic event turns everything to chaos.How It Ends featuring Theo James and Forest Whitaker is streaming with subscription on Netflix. It's an action & adventure and mystery movie with a less than average IMDb audience rating of 5.0 (52,343 votes) and was disliked by critics.",David M. Rosenthal,"['Theo James', 'Forest Whitaker', 'Kat Graham', 'Kerry Bishé', 'Grace Dove', ""Mark O'Brien"", 'Nicole Ari Parker', 'Nancy Sorel', 'Anett Rumanoczky', 'Cheryl Gensiorek', 'Lanie McAuley', 'Aaron Hughes', 'Josh Cruddas', 'Aidan Ritchie', 'Rick Skene', 'Charis Ann Wiens', 'David Lewis', 'Haig Sutherland', 'Cory Chetyrbok', 'Connor Peterson', 'Kelly McCormick', 'Patrick Newall', 'Paul Schiff', 'Tai Duncan', 'Brooks McLaren', 'Daniel Bekerman', 'Ian Dimerman', 'Marc Schaberg', 'Nick Meyer', 'Brooks McLaren', 'Atli Örvarsson']"
Outlaws,6.9,,"['Thriller', 'Action & Adventure']",2021,"['Adaptation', 'Based on Books']",Spain,Netflix,18+ (R),PT2H5M,"Introverted Girona student Nacho meets two delinquents from the city's Chinatown and gets caught up in a summer onslaught of burglaries and hold ups that will change his life.Outlaws featuring Marcos Ruiz and Begona Vargas is streaming with subscription on Netflix. It's an action & adventure and thriller movie with a better than average IMDb audience rating of 6.9 (3,758 votes).",Daniel Monzón,"['Marcos Ruiz', 'Begona Vargas', 'Chechu Salgado', 'Pep Tosar', 'Xavier Martín', 'Daniel Ibáñez', 'Guillermo Lasheras', 'Cintia García', 'Jorge Aparicio', 'Víctor Manuel Pajares', 'Carlos Oviedo', 'Catalina Sopelana', 'Xavi Sáez', 'Carlos Serrano', 'Santiago Molero', 'Ainhoa Santamaría', 'Elísabet Casanovas', 'Pep Cruz', 'Estefanía de los Santos', 'Mabel del Pozo', 'Nina Pomodoro', 'Ignacio Salazar-Simpson', 'Ricardo Marco Budé', 'Daniel Monzón', 'Javier Cercas', 'Jorge Guerricaechevarría']"
The Guilty,6.3,,"['Drama', 'Thriller']",2021,"['Suspense', 'Police']",America,Netflix,18+ (R),PT1H30M,"A demoted police officer assigned to a call dispatch desk is conflicted when he receives an emergency phone call from a kidnapped woman.The Guilty featuring Jake Gyllenhaal and Riley Keough is streaming with subscription on Netflix. It's a drama and thriller movie with an average IMDb audience rating of 6.3 (114,195 votes).",Antoine Fuqua,"['Jake Gyllenhaal', 'Riley Keough', 'Ethan Hawke', 'Peter Sarsgaard', 'Paul Dano', 'Bill Burr', 'Gillian Zinser', 'Vivien Lyra Blair', ""Da'Vine Joy Randolph"", 'Edi Patterson', 'Beau Knapp', 'Byron Bowers', 'David Castañeda', 'Christina Vidal', 'Adrian Martinez', 'Eli Goree', 'Maurice Webster', 'Bret Porter', 'Sal Lucio', 'Christiana Montoya', 'Becky Wu', 'Antoine Fuqua', 'David Haring', 'David Litvak', 'Gary Michael Walters', 'Jake Gyllenhaal', 'Kat Samick', 'Michel Litvak', 'Riva Marker', 'Scott D. Greenberg', 'Svetlana Metkina', 'Annie Marter', 'Christian Mercuri', 'Eric Greenfeld', 'Gustav Möller', 'Jonathan Oakes', 'Justin Bursch', 'Lina Flint', 'Nic Pizzolatto', 'Nic Pizzolatto', 'Marcelo Zarvos']"
Mehandi Circus,7.3,,['Drama'],2019,[],India,Netflix,,PT2H15M,"A music shop owner falls in love with a girl from a circus troupe that visits his village, but caste and class stand in the way.Mehandi Circus featuring Madhampatty Rangaraj and Shweta Tripathi is streaming with subscription on Netflix, and available for rent or purchase on Prime Video. It's a drama movie with a better than average IMDb audience rating of 7.3 (548 votes).",Raju Saravanan,"['Madhampatty Rangaraj', 'Shweta Tripathi', 'Vignesh', 'Vela Ramamoorthy', 'G. Marimuthu', 'Ankur Vikal', 'Sunny Charles', 'K. E. Gnanavelraja', 'Mugesh Sharma', 'Raju Saravanan', 'Sean Roldan']"
