Title,IMDB_Rating,Reelgood_Rating,Genres,Year,Tags,Country,Source,Rated,Duration,Description,Director,Employees
"Rob Schneider: Asian Momma, Mexican Kids",5.5,,['Comedy'],2020,[],America,Netflix,18+ (R),PT44M,"Former ""Saturday Night Live"" star Rob Schneider returns to the stage and shares his take on life, love and dinosaur dreams in this stand-up special. Ending with a surprise duet performance with his daughter, singer-songwriter Elle King, Rob talks about potty training his young daughters and his own pig potential.Rob Schneider: Asian Momma, Mexican Kids featuring Rob Schneider and Elle King is streaming with subscription on Netflix. It's a comedy movie with an average IMDb audience rating of 5.5 (759 votes).",Tyler Spindel,"['Rob Schneider', 'Elle King', 'Rob Schneider']"
The Unmarried Wife,5.9,,"['Romance', 'Drama']",2016,['War'],Philippines,Netflix,,PT2H10M,"A woman is torn between trying to save her failing marriage or pursuing the possibility of a new love.The Unmarried Wife featuring Angelica Panganiban and Dingdong Dantes is streaming with subscription on Netflix, and available for rent or purchase on Prime Video. It's a drama and romance movie with an average IMDb audience rating of 5.9 (189 votes).",Maryo J. de los Reyes,"['Angelica Panganiban', 'Dingdong Dantes', 'Paulo Avelino', 'Maricar Reyes', 'Denise Laurel', 'Dimples Romana', 'Justin Cuyugan', 'Martin Escudero', 'Pamu Pamorada', 'Lei Navarro', 'Irma Adlawan', 'Marina Benipayo', 'Loren Burgos', 'Joan Falisoc', 'Jace Flores', 'Anne Feo', 'Bing Pimentel', 'Joaquin Manansala', 'Cathy Remperas', 'Celio Aquino', 'Xyruz Cruz', 'Vanessa Valdez']"
The Swarm,5.3,,"['Drama', 'Fantasy']",2020,[],France,Netflix,,PT1H41M,"To save her farm from bankruptcy, a single mother begins a business of breeding edible grasshoppers. Soon she develops a strange, obsessive relationship with them.The Swarm featuring Suliane Brahim and Sofian Khammes is streaming with subscription on Netflix. It's a drama and fantasy movie with a less than average IMDb audience rating of 5.3 (6,778 votes) and was well received by critics.",Just Philippot,"['Suliane Brahim', 'Sofian Khammes', 'Marie Narbonne', 'Raphael Romand', 'Nathalie Boyer', 'Victor Bonnel', 'Christian Bouillette', 'Manuel Chiche', 'Thierry Lounas', 'Franck Victor', 'Jérôme Genevray', 'Vincent Cahay']"
Myriam Fares: The Journey,2.3,,['Documentary'],2021,[],,Netflix,,,Myriam Fares: The Journey is streaming with subscription on Netflix. It's a documentary movie with a very low IMDb audience rating of 2.3 (153 votes).,,[]
Love O2O,6.4,,"['Drama', 'Romance']",2016,[],China,Netflix,16+,PT1H45M,"What is it that makes a man fall in love with a woman at first sight? Appearance? Aura? Wealth? NO, when campus prince and gaming expert, student Xiao Nai first saw Bei Wei Wei, what made him fall in love was not her extraordinary beauty, but her slim and slender fingers that were flying across the keyboard and her calm and composed manner!!! Embarrassing, no? At the same time, gaming expert Bei Wei Wei, at this time and place is on the computer, methodically commanding a guild war, and won a perfect and glorious victory despite being at a disadvantage, and was completely unaware that cupid is nearby. Soon after basketball player, swimmer, all-around excellent student, and game company president, Xiao Nai, uses both tactics on and off-line to take this beauty’s heart. Therefore this romance slowly bloomed. ~~ Movie adapted from the novel by Gu Man.Love O2O featuring AngelaBaby and Jing Boran is streaming with subscription on Netflix. It's a drama and romance movie with an average IMDb audience rating of 6.4 (1,032 votes).",Zhao Tianyu,"['AngelaBaby', 'Jing Boran', 'Li Qin', 'Bai Yu', 'Liuxun Zimo', 'Tan Songyun', 'Wang Zixuan', 'Li Xian', 'Yao Kaichen', 'Gu Man']"
Blood and Bone,6.7,,"['Action & Adventure', 'Drama']",2009,"['Martial Arts', 'Prison', 'Fighting']",America,Netflix,18+ (R),PT1H33M,"In Los Angeles, an ex-con takes the underground fighting world by storm in his quest to fulfill a promise to a dead friend.Blood and Bone featuring Michael Jai White and Julian Sands is streaming with subscription on Netflix, available for rent or purchase on iTunes, available for rent or purchase on Prime Video, and 2 others. It's an action & adventure and drama movie with a better than average IMDb audience rating of 6.7 (33,398 votes).",Ben Ramsey,"['Michael Jai White', 'Julian Sands', 'Eamonn Walker', 'Dante Basco', 'Nona Gaye', 'Gina Carano', 'Michelle Belegrin', 'Bob Sapp', 'Dick Anthony Williams', 'Ron Yuan', 'Kimbo Slice', 'Maurice Smith', 'Kevin Phillips', 'Ernest Miller', 'Francis Capra', 'Sala Baker', 'Matt Mullins', 'David Chan Cordeiro', 'Arnold Chon', 'Sam Hargrave', 'Khristian Lupo', 'Matthew Binns', 'Michael Mailer', 'Michael Andrews', 'Nicholas Pike']"
The Frozen Ground,6.4,,"['Crime', 'Thriller']",2013,"['Kidnapping', 'Police', 'Hunting']",America,Netflix,18+ (R),PT1H45M,"An Alaska State Trooper partners with a young woman who escaped the clutches of serial killer Robert Hansen to bring the murderer to justice. Based on actual events.The Frozen Ground featuring Nicolas Cage and Vanessa Hudgens is streaming with subscription on Netflix, available for rent or purchase on iTunes, available for rent or purchase on Google Play, and 3 others. It's a crime and drama movie with an average IMDb audience rating of 6.4 (62,667 votes).",Scott Walker,"['Nicolas Cage', 'Vanessa Hudgens', 'John Cusack', 'Radha Mitchell', ""Jodi Lyn O'Keefe"", 'Katherine LaNasa', 'Dean Norris', '50 Cent', 'Gia Mantegna', 'Kevin Dunn', 'Kurt Fuller', 'Matt Gerald', 'Brad William Henke', 'Michael McGrady', ""Ryan O'Nan"", 'Brett Baker', 'Hillarie Putnam', 'Robert Forgit', 'Lydia Hull', 'Princess Lucaj', 'Connor Rockom', '50 Cent', 'Jane Fleming', 'Jeff Rice', 'Mark Ordesky', 'Randall Emmett', 'Remington Chase', 'Barry Brooker', 'Brandt Andersen', 'Brett Granstaff', 'Corey Large', 'Daniel Wagner', 'Elisa Salinas', 'Fredrik Malmberg', 'George Furla', 'Kevin Scott Frakes', 'Mark Stewart', 'Martin Blencowe', 'Olga Valentina', 'Stan Wertlieb', 'Stepan Martirosyan', 'Ted Fox', 'Scott Walker', 'Lorne Balfe']"
The Occupant,6.4,,"['Drama', 'Thriller']",2020,[],Spain,Netflix,18+ (R),PT1H43M,"An unemployed executive is forced to sell his apartment. When he discovers that he still has the keys, he becomes obsessed with the family that now lives there and decides to recover the life he has lost, at any price.The Occupant featuring Javier Gutiérrez and Mario Casas is streaming with subscription on Netflix. It's a drama and thriller movie with an average IMDb audience rating of 6.4 (17,210 votes) and was met with mixed reviews by critics.",Àlex Pastor,"['David Pastor', 'Javier Gutiérrez', 'Mario Casas', 'Bruna Cusí', 'Ruth Díaz', 'Iris Vallés Torres', 'Cristian Muñoz', 'David Ramírez', 'David Selvas', 'David Verdaguer', 'Vicky Luengo', 'Raül Ferre', 'Ernesto Collado', 'Yaneys Cabrera', 'Eli Iranzo', 'Júlia Molins', 'Frederic Llobregat', 'Adrian Grösser', 'Aleida Torrent', 'Mireia Gubianas', 'Natalia García', 'Toni Ruiz', 'Adrián Guerra', 'Marta Sánchez de Miguel', 'Núria Valls', 'Àlex Pastor', 'David Pastor']"
Thiago Ventura: POKAS,6.4,,"['Stand-up & Talk', 'Comedy']",2020,[],Brazil,Netflix,18+ (R),PT1H22M,"In a rollicking special, Thiago Ventura jokes about life in the hood, politics and more, explaining how actions speak louder then words.Thiago Ventura: POKAS featuring Thiago Ventura is streaming with subscription on Netflix. It's a Comedy and Stand up & Talk movie with an average IMDb audience rating of 6.4 (191 votes).",Fabio Ock,"['Joana Mazzuchelli', 'Thiago Ventura', 'Thiago Ventura']"
Varane Avashyamund,6.9,,"['Comedy', 'Family']",2020,[],India,Netflix,,PT2H25M,"A divorced woman trying to get hired as a French tutor and teaching classical dance, and she has a daughter. Her brother Manuel also resides in a flat in Chennai. Their next door neighbours are Unnikrishnan, a retired Major who has a pet dog, Prabhakaran and Bibeesh who lives with a serial-actress aunt (not related by blood) and his young school going brother. The story revolves around the divorced mother and daughter finding happiness of love in their own ways. The film explores commonality of romantic love in different stages of life.Varane Avashyamund featuring Suresh Gopi and Shobana is streaming with subscription on Netflix. It's a comedy and family movie with a better than average IMDb audience rating of 6.9 (2,750 votes).",Anoop Sathyan,"['Suresh Gopi', 'Shobana', 'Dulquer Salmaan', 'Kalyani Priyadarshan', 'Urvashi', 'KPAC Lalitha', 'Lalu Alex', 'Sarvajith Santosh Sivan', 'Major Ravi', 'Johny Antony', 'Siju Wilson', 'Rahul Rajasekharan', 'Meera Krishnan', 'Wafa Khadeeja Rahman', 'Lal Jose', 'Sreeja Ravi', 'Naslen Gafoor', 'Dulquer Salmaan', 'Anoop Sathyan']"
Christina P: Mother Inferior,6.4,,"['Stand-up & Talk', 'Comedy']",2017,['Science'],America,Netflix,,PT59M,"Christina Pazsitzky hits Seattle with a biting dose of reality, telling truths about her childhood, getting older and the horrors of giving birth.Christina P: Mother Inferior featuring Christina Pazsitzky is streaming with subscription on Netflix. It's a Comedy and Stand up & Talk movie with an average IMDb audience rating of 6.4 (987 votes).",Jay Karas,['Christina Pazsitzky']
Unfriended,5.6,,"['Horror', 'Mystery']",2015,"['Supernatural', 'Technology', 'Teen']",America,Netflix,18+ (R),PT1H22M,"While video chatting one night, six high school friends receive a Skype message from a classmate who killed herself exactly one year ago. At first they think it's a prank, but when the girl starts revealing the friends' darkest secrets, they realize they are dealing with something out of this world, something that wants them dead.Unfriended featuring Shelley Hennig and Heather Sossaman is streaming with subscription on Netflix, available for rent or purchase on iTunes, available for rent or purchase on Prime Video, and 2 others. It's a horror and mystery movie with an average IMDb audience rating of 5.6 (74,722 votes).",Levan Gabriadze,"['Shelley Hennig', 'Heather Sossaman', 'Renee Olstead', 'Matthew Bohrer', 'Moses Storm', 'William Peltz', 'Jacob Wysocki', 'Courtney Halverson', 'Mickey River', 'Cal Barnes', 'Christa Hartsock', 'Konstantin Khabenskiy', 'Nelson Greaves', 'Timur Bekmambetov', 'Jason Blum', 'Nelson Greaves']"
My Girl,6.9,,"['Romance', 'Comedy']",1991,"['Teen', 'Friendship', 'Doctor']",America,Netflix,7+ (PG),PT1H43M,"Vada Sultenfuss is obsessed with death. Her mother is dead, and her father runs a funeral parlor. She is also in love with her English teacher, and joins a poetry class over the summer just to impress him. Thomas J., her best friend, is ""allergic to everything"", and sticks with Vada despite her hangups. When Vada's father hires Shelly, and begins to fall for her, things take a turn to the worse...My Girl featuring Anna Chlumsky and Macaulay Culkin is streaming with subscription on Netflix, available for rent or purchase on iTunes, available for rent or purchase on Prime Video, and 2 others. It's a comedy and drama movie with a better than average IMDb audience rating of 6.9 (80,034 votes).",Howard Zieff,"['Anna Chlumsky', 'Macaulay Culkin', 'Dan Aykroyd', 'Jamie Lee Curtis', 'Richard Masur', 'Griffin Dunne', 'Ann Nelson', 'Peter Michael Goetz', 'Jane Hallaren', 'Anthony R. Jones', 'Tom Villard', 'Lara Steinick', 'Kristian Truelsen', 'David Caprita', 'Jody Wilson', 'Linda Perri', 'Nancy L. Chlumsky', 'Glenda Chism', 'Bill Cordell', 'Ray Buktenica', 'Shane Obedzinski', 'Brian Grazer', 'Hannah Gold', 'David T. Friendly', 'Joseph M. Caracciolo Jr.', 'Laurice Elehwany', 'James Newton Howard']"
Teenage Mutant Ninja Turtles II: The Secret of the Ooze,6,,"['Family', 'Action & Adventure']",1991,"['Superhero', 'Animal', 'Martial Arts']",Hong Kong,HBO MAX,7+ (PG),PT1H28M,"The Turtles and the Shredder battle once again, this time for the last cannister of the ooze that created the Turtles, which Shredder wants to create an army of new mutants.Teenage Mutant Ninja Turtles II: The Secret of the Ooze featuring Paige Turco and David Warner is streaming with subscription on Netflix, streaming with subscription on HBO MAX, available for rent or purchase on iTunes, and 4 others. It's an action & adventure and family movie with an average IMDb audience rating of 6.0 (55,647 votes).",Michael Pressman,"['Paige Turco', 'David Warner', 'Michelan Sisti', 'Leif Tilden', 'Kenn Scott', 'Mark Caso', 'Kevin Clash', 'Ernie Reyes, Jr.', 'François Chau', 'Toshishiro Obata', 'Raymond Serra', 'Mark Ginther', 'Kurt Bryant', 'Kevin Nash', 'Joseph Amodei', 'Susie Essman', 'Vanilla Ice', 'Robbie Rist', 'Brian Tochi', 'Laurie Faso', 'Adam Carl', 'David Chan', 'Kim Dawson', 'Thomas K. Gray', 'Raymond Chow', 'Todd W. Langen', 'John Du Prez']"
Ricky Gervais: Humanity,7.9,,"['Stand-up & Talk', 'Comedy']",2018,[],United Kingdom,Netflix,18+ (R),PT1H19M,"In his first special in seven years, Ricky Gervais slings his trademark snark at celebrity, mortality and a society that takes everything personally.Ricky Gervais: Humanity featuring Ricky Gervais is streaming with subscription on Netflix. It's a Comedy and Stand up & Talk movie with a high IMDb audience rating of 7.9 (18,655 votes) and was met with mixed reviews by critics.",John L. Spencer,"['Ricky Gervais', 'Charlie Hanson', 'Lisa Nishimura', 'Ricky Gervais', 'Robbie Praw', 'Ricky Gervais']"
Jackass Presents: Bad Grandpa .5,6.2,,['Comedy'],2014,[],America,Netflix,13+ (PG-13),PT1H26M,"Bad Grandpa .5 gives you a whole new perspective on the world of Irving Zisman with bonus scenes and pranks also featuring Spike Jonze as ""Gloria"" and Catherine Keener as Irving's wife ""Ellie"", plus a look at the evolution of Johnny Knoxville's naughty alter-ego, the makeup effects, and a behind-the-scenes peek at the idiocy it takes to make a hidden camera movie in public.Jackass Presents: Bad Grandpa .5 featuring Johnny Knoxville and Spike Jonze is streaming with subscription on Netflix, available for purchase on iTunes, available for purchase on Prime Video, and 2 others. It's a comedy movie with an average IMDb audience rating of 6.2 (5,254 votes).",Jeff Tremaine,"['Johnny Knoxville', 'Spike Jonze', 'Jackson Nicoll', 'Catherine Keener', 'Georgina Cates', 'Zia Harris', 'Jeff Tremaine', 'Trip Taylor', 'Dimitry Elyashkevich', 'J.P. Blackmon', 'Rick Kosick', 'Jack Polick', 'Derek Freda', 'Jeff Tremaine', 'Johnny Knoxville', 'Spike Jonze', 'Jeff Tremaine', 'Johnny Knoxville', 'Spike Jonze']"
The Danish Girl,7.1,,"['LGBTQ', 'Drama']",2015,"['Doctor', 'Based on Books']",Belgium,Netflix,18+ (R),PT1H59M,"When Gerda Wegener asks her husband Einar to fill in as a portrait model, Einar discovers the person she's meant to be and begins living her life as Lili Elbe. Having realized her true self and with Gerda's love and support, Lili embarks on a groundbreaking journey as a transgender pioneer.The Danish Girl featuring Eddie Redmayne and Alicia Vikander is streaming with subscription on Netflix, available for rent or purchase on iTunes, available for rent or purchase on Prime Video, and 2 others. It's a drama and LGBTQ movie with a better than average IMDb audience rating of 7.1 (182,024 votes).",Tom Hooper,"['Eddie Redmayne', 'Alicia Vikander', 'Matthias Schoenaerts', 'Ben Whishaw', 'Sebastian Koch', 'Pip Torrens', 'Nicholas Woodeson', 'Amber Heard', 'Emerald Fennell', 'Adrian Schiller', 'Henry Pettigrew', 'Sophie Kennedy Clark', 'Miltos Yerolemou', 'Jake Graf', 'Tusse Silberg', 'Claus Bue', 'Peter Krag', 'Angela Curran', 'Pixie', 'Richard Dixon', 'Paul Bigley', 'Anne Harrison', 'Eric Fellner', 'Gail Mutrux', 'Tim Bevan', 'Tom Hooper', 'Kathy Morgan', 'Linda Reisman', 'Liza Chasin', 'Ulf Israel', 'David Ebershoff', 'Lucinda Coxon', 'Alexandre Desplat']"
Shimla Mirchi,4.6,,"['Romance', 'Comedy']",2020,[],India,Netflix,,PT2H9M,"While on holiday, Avi meets Naina and falls in love with her. Smitten, he decides to stay and work in her cafe. He confesses his love in a letter, however it's Naina's mother who mistakenly reads it.Shimla Mirchi featuring Rajkummar Rao and Hema Malini is streaming with subscription on Netflix. It's a comedy and romance movie with a less than average IMDb audience rating of 4.6 (1,512 votes).",Ramesh Sippy,"['Rajkummar Rao', 'Hema Malini', 'Shakti Kapoor', 'Rakul Preet Singh', 'Kanwaljit Singh', 'Kamlesh Gill', 'Kiran Juneja', 'Zoya Zayed Khan', 'Dharmendra']"
The Shack,6.2,,"['Fantasy', 'Drama']",2017,"['Religion', 'Based on Books']",America,HBO,13+ (PG-13),PT2H12M,"After suffering a family tragedy, Mack Phillips spirals into a deep depression causing him to question his innermost beliefs. Facing a crisis of faith, he receives a mysterious letter urging him to an abandoned shack deep in the Oregon wilderness. Despite his doubts, Mack journeys to the shack and encounters an enigmatic trio of strangers led by a woman named Papa. Through this meeting, Mack finds important truths that will transform his understanding of his tragedy and change his life forever.The Shack featuring Sam Worthington and Octavia Spencer is streaming with subscription on Netflix, streaming with subscription on HBO, available for rent or purchase on iTunes, and 3 others. It's a drama and fantasy movie with an average IMDb audience rating of 6.2 (35,457 votes).",Stuart Hazeldine,"['Sam Worthington', 'Octavia Spencer', 'Tim McGraw', 'Aviv Alush', 'Sumire Matsubara', 'Radha Mitchell', 'Graham Greene', 'Gage Munroe', 'Megan Charpentier', 'Lane Edwards', 'Alice Braga', 'Ryan Robbins', 'Emily Holmes', 'Amélie Eve', 'Jordyn Ashley Olson', 'Laura MacKillop', 'Derek Hamilton', 'Tanya Hubbard', 'Carson Reaume', 'David Mackay', 'Christopher Britton', 'Brad Cummings', 'Gil Netter', 'Mike Drake', 'Qiuyun Long', 'Ray Scalice', 'Andrew Lanham', 'Brad Cummings', 'Destin Daniel Cretton', 'John Fusco', 'Wayne Jacobsen', 'William Paul Young', 'Aaron Zigman']"
The Present,7.6,,"['Animation', 'Drama']",2020,['Religion'],Palestine,Kanopy,13+ (PG-13),PT24M,"On his wedding anniversary, Yusef and his young daughter set out in the West Bank to buy his wife a gift. Between soldiers, segregated roads and checkpoints, how easy would it be to go shopping?The Present featuring Saleh Bakri and Mariam Kanj is streaming with subscription on Netflix, streaming with subscription on Prime Video, streaming with subscription on Kanopy, and 3 others. It's an animation and drama movie with a high IMDb audience rating of 7.6 (3,134 votes).",Farah Nabulsi,"['Saleh Bakri', 'Mariam Kanj', 'Ossama Bawardi', 'Farah Nabulsi', 'Hind Shoufani']"
Lowriders,5.6,,"['Action & Adventure', 'Drama']",2017,['Car'],America,Netflix,13+ (PG-13),PT1H39M,"A young street artist in East Los Angeles is caught between his father's obsession with lowrider car culture, his ex-felon brother and his need for self-expression.Lowriders featuring Demián Bichir and Gabriel Chavarria is streaming with subscription on Netflix, available for rent or purchase on iTunes, available for rent or purchase on Google Play, and 3 others. It's an action & adventure and drama movie with an average IMDb audience rating of 5.6 (2,525 votes).",Ricardo de Montreuil,"['Demián Bichir', 'Gabriel Chavarria', 'Theo Rossi', 'Melissa Benoist', 'Eva Longoria', 'Tony Revolori', 'Yvette Monreal', 'Cress Williams', 'Pandie Suicide', 'Montse Hernandez', 'Brian Grazer', 'Jason Blum', 'Joshua Beirne-Golden', 'Justin Tipping']"
High End Yaariyaan,5.4,,"['Comedy', 'Family']",2019,[],India,Netflix,,PT2H20M,"High End Yaariyaan is a tale of 3 friends Ranjit Bawa, Jassie Gill, and Ninja who lives abroad. The story narrates how their friendship has evolved over a period of time and the struggles they each go through while living away from their homeland.High End Yaariyaan featuring Jassie Gill and Ranjit Bawa is streaming with subscription on Netflix. It's a comedy and family movie with a less than average IMDb audience rating of 5.4 (1,521 votes).",Pankaj Batra,"['Jassie Gill', 'Ranjit Bawa', 'Ninja', 'Gurnam Bhullar', 'Navneet Kaur Dhillon', 'Sammy Jonas Heaney', 'Musskan Sethi', 'Aarushi Sharma', 'Neet Mahal', 'Mahabir Bhullar', 'Ravinder Mand', 'Hobby Dhaliwal', 'Harpal Singh Pali', 'Honey Mattu', 'Gurjeet Singh']"
Chhota Bheem In Dholakpur to Kathmandu,7.8,,['Animation'],2012,[],,Netflix,All (G),PT1H10M,"Bheem and his friends are invited to spend their vacations in Kathmandu.Their trip is not without mishap, as a young ape is separated from its father. Bheem defeats the jaguars, and unites the ape with its father.Chhota Bheem In Dholakpur to Kathmandu is streaming with subscription on Netflix, and available for rent or purchase on Google Play. It's an animation movie with a high IMDb audience rating of 7.8 (47 votes).",,[]
Dearest Boy,6,,"['Drama', 'Comedy']",2021,[],Saudi Arabia,Netflix,,PT1H30M,"A gang kidnapped Five children and demanding a hefty ransom, while parents turn to the police, grandmothers set a mission to save them themselves.Dearest Boy featuring Dalal Abdelaziz and Mervat Amin is streaming with subscription on Netflix. It's a comedy and drama movie with an average IMDb audience rating of 6.0 (253 votes).",Sarah Noah,"['Dalal Abdelaziz', 'Mervat Amin', 'Sherine', 'Inam Salusah', 'Reham Abdelghafour', 'Amina Khalil', 'Mona Zaki', 'Samy Maghawry', 'Amr Salama', 'Amr Youssef', 'Arwa Gouda', 'Mohamed Shahin', 'Tamer Habib', 'Ali Quandil', 'Mahmoud Ellithy', 'Ragaa Al-Giddawy', 'Injy Al Moqaddem', 'George Azmi', 'Sherif Nagib']"
LEGO Marvel Super Heroes: Maximum Overload,6.4,,"['Action & Adventure', 'Animation']",2013,[],America,Netflix,7+ (PG),PT22M,"Spider-Man and Marvel's Super Heroes take on a mischievous Loki and a team of super villains in an all-new LEGO adventureLEGO Marvel Super Heroes: Maximum Overload is streaming with subscription on Netflix, and free on Tubi. It's an action & adventure and animation movie with an average IMDb audience rating of 6.4 (1,355 votes).",Greg Richardson,['Matt Wayne']
LA Originals,7.2,,['Documentary'],2020,[],,Netflix,,PT1H32M,"Photographer Estevan Oriol and artist Mister Cartoon turned their Chicano roots into gritty art, impacting street culture, hip hop and beyond.LA Originals featuring Estevan Oriol and Mister Cartoon is streaming with subscription on Netflix. It's a documentary movie with a better than average IMDb audience rating of 7.2 (1,806 votes).",Estevan Oriol,"['Estevan Oriol', 'Mister Cartoon', 'Snoop Dogg', 'Eminem', 'Mark Hoppus', 'Travis Barker', 'Terry Crews', 'Kobe Bryant', '50 Cent', 'Clifton Collins Jr.', 'David Choe', 'Brian Maya', 'Estevan Oriol', 'Mister Cartoon', 'Sebastián Ortega', 'Brian Maya', 'Omar Quiroga']"
Deck the Halls,5,,"['Family', 'Comedy']",2006,"['Christmas', 'Holiday']",America,Netflix,7+ (PG),PT1H33M,"Determined to unseat Steve Finch's reign as the town's holiday season king, Buddy Hall plasters his house with so many decorative lights that it'll be visible from space! When their wives bond, and their kids follow suit, the two men only escalate their rivalry - and their decorating.Deck the Halls featuring Danny DeVito and Matthew Broderick is streaming with subscription on Netflix, available for rent or purchase on iTunes, available for rent or purchase on Prime Video, and 2 others. It's a comedy and family movie with a less than average IMDb audience rating of 5.0 (27,853 votes).",John Whitesell,"['Danny DeVito', 'Matthew Broderick', 'Kristin Davis', 'Kristin Chenoweth', 'Alia Shawkat', 'Dylan Blue', 'Kelly Aldridge', 'Sabrina Aldridge', 'Jorge Garcia', 'Fred Armisen', 'Gillian Vigman', 'Ryan Devlin', ""Sean O'Bryan"", 'Su-chin Pak', 'Jackie Burroughs', 'Garry Chalk', 'Nicola Peltz', 'Zak Santiago', 'David Lewis', 'Daniel Bacon', 'Ken Kramer', 'Arnon Milchan', 'John Whitesell', 'Michael Costigan', 'Jeremiah Samuels', 'Chris Ord', 'Don Rhymer', 'Matt Corman', 'George S. Clinton']"
Canvas,6.4,,"['Family', 'Animation']",2020,['Short'],America,Netflix,All (G),PT9M,"After a heartbreaking loss, a grandfather struggling to reclaim his passion for painting finds the inspiration to create again.Canvas is streaming with subscription on Netflix. It's an animation and family movie with an average IMDb audience rating of 6.4 (2,642 votes).",Frank E. Abney III,"['Paige Johnstone', 'Harrison Barnes', 'Jamaal Bradley', 'John Maeda', 'Frank E. Abney III', 'Jermaine Stegall']"
A Go! Go! Cory Carson Christmas,6.3,,"['Animation', 'Family']",2020,[],,Netflix,All (G),PT21M,"When a familiar-looking stranger crashes in without a memory, cory helps him remember the magic of Christmas to save the holiday for everyoneA Go! Go! Cory Carson Christmas featuring Alan C. Lim and Taron C. Hensley is streaming with subscription on Netflix. It's an animation and family movie with an average IMDb audience rating of 6.3 (49 votes).",Alex Woo,"['Stanley Moore', 'Alan C. Lim', 'Taron C. Hensley', 'Maisie Benson', 'Kerry Gudjohnsen', 'Paul Killam', 'Smith Foreman', 'Ann Kendrick', 'Ella Joy Ballesteros', 'Neena-Sinaii Simpo', 'Eli Morse', 'David Ochs', 'Stanley Moore', 'Tone Thyne', 'Vincent Lau', 'Ying Hsuan Chen']"
The Lost Husband,6.1,,"['Romance', 'Drama']",2020,['Sports'],America,Hoopla,13+ (PG-13),PT1H49M,"Trying to put her life back together after the death of her husband, Libby and her children move to her estranged Aunt's goat farm in central Texas.The Lost Husband featuring Leslie Bibb and Josh Duhamel is streaming with subscription on Netflix, streaming with subscription on Hoopla, available for rent or purchase on iTunes, and 2 others. It's a drama and romance movie with an average IMDb audience rating of 6.1 (4,679 votes).",Vicky Wight,"['Leslie Bibb', 'Josh Duhamel', 'Nora Dunn', 'Herizen F. Guardiola', 'Kevin Alejandro', 'Isiah Whitlock Jr.', 'Sharon Lawrence', 'Georgia King', 'Carly Pope', 'Callie Haverda', 'Bridget Stokes', 'Leslie Bibb', 'Vicky Wight', 'Coerte Voorhees', 'Matt Ballesteros', 'Katherine Center', 'Vicky Wight', 'Sherri Chung']"
