Title,IMDB_Rating,Reelgood_Rating,Genres,Year,Tags,Country,Source,Rated,Duration,Description,Director,Employees
Dangerous Lies,5.3,,"['Thriller', 'Drama']",2020,"['Doctor', 'Suspense']",America,Netflix,16+,PT1H36M,"After losing her waitressing job, Katie Franklin takes a job as a caretaker to a wealthy elderly man in his sprawling, empty Chicago estate. The two grow close, but when he unexpectedly passes away and names Katie as his sole heir, she and her husband Adam are pulled into a complex web of lies, deception, and murder. If she's going to survive, Katie will have to question everyone's motives — even the people she loves.Dangerous Lies featuring Camila Mendes and Jessie T. Usher is streaming with subscription on Netflix. It's a drama and thriller movie with a less than average IMDb audience rating of 5.3 (16,814 votes).",Michael Scott,"['Camila Mendes', 'Jessie T. Usher', 'Jamie Chung', 'Cam Gigandet', 'Sasha Alexander', 'Elliott Gould', 'Michael P. Northey', 'Sean O. Roberts', 'Trevor Lerner', 'Joe Costa', 'Garfield Wilson', 'Stefania Indelicato', 'France Perras', 'Briana Skye', 'Nick Purcha', 'Emma Pedersen', 'Radhesh Aria', 'Margret H. Huddleston', 'Stephanie Slack', 'Harvey Kahn', 'Michael Scott', 'David Golden']"
Arango y Sanint: Ríase el show,4,,['Comedy'],2018,[],,Netflix,,PT1H2M,"Colombian stand-up comedians Antonio Sanint and Julián Arango impersonate an Argentine visitor and a cabbie, and a pair of dirty old men at the opera.Arango y Sanint: Ríase el show is streaming with subscription on Netflix. It's a comedy movie with a low IMDb audience rating of 4.0 (42 votes).",,[]
Rose Island,7,,"['Comedy', 'Drama']",2020,"['Based On True Story', 'Political', 'Adaptation']",Italy,Netflix,,PT1H30M,"In 1968, engineer Giorgio Rosa established the independent state called ""The Isle of Roses"" off the coast of Rimini, built on a platform outside the territorial waters, with Esperanto as the official language. The Italian authorities did not take it well because the micronation was seen as an expedient to not pay taxes on the revenues obtained thanks to the arrival of numerous tourists and curious people.Rose Island featuring Elio Germano and Matilda De Angelis is streaming with subscription on Netflix. It's a comedy and drama movie with a better than average IMDb audience rating of 7.0 (20,173 votes).",Sydney Sibilia,"['Elio Germano', 'Matilda De Angelis', 'Fabrizio Bentivoglio', 'François Cluzet', 'Tom Wlaschiha', 'Luca Zingaretti', 'Leonardo Lidi', 'Fabrizio Rongione', 'Marco Pancrazi', 'Andrea Pennacchi', 'Alberto Astorri', 'Violetta Zironi', 'Christian Ginepro', 'Frank Gerrish', 'Christian Stamm', 'Ascanio Balbo', 'Giulio Farnese', 'Luca Della Bianca', 'Marco Sincini', 'Vincent Frost', 'Riccardo Marzi', 'Matteo Rovere', 'Teresa Moneo', 'Paolo Lucarini', 'Francesca Manieri', 'Sydney Sibilia']"
21 Bridges,6.6,,"['Thriller', 'Drama']",2019,"['Suspense', 'Police']",America,Netflix,18+ (R),PT1H39M,"An embattled NYPD detective, is thrust into a citywide manhunt for a pair of cop killers after uncovering a massive and unexpected conspiracy. As the night unfolds, lines become blurred on who he is pursuing, and who is in pursuit of him.21 Bridges featuring Chadwick Boseman and Sienna Miller is streaming with subscription on Netflix, available for purchase on iTunes, available for rent or purchase on Google Play, and 3 others. It's a drama and thriller movie with an average IMDb audience rating of 6.6 (64,527 votes).",Brian Kirk,"['Chadwick Boseman', 'Sienna Miller', 'J.K. Simmons', 'Stephan James', 'Taylor Kitsch', 'Keith David', 'Alexander Siddig', 'Louis Cancelmi', 'Victoria Cartagena', 'Gary Carr', 'Morocco Omari', 'Chris Ghaffari', 'Dale Pavinski', 'Christian Isaiah', 'Sarah Ellen Stephens', 'Jamie Neumann', 'Peter Patrikios', 'Jayson Ward Williams', 'Suzette Gunn', 'Khalil McMillan', 'John Douglas Thompson', 'Anthony Russo', 'Chadwick Boseman', 'Gigi Pritzker', 'Joe Russo', 'Logan Coles', 'Mike Larocca', 'Robert Simonds', 'Adam Fogelson', 'Adrian Alperovich', 'Felice Bee', 'Mark Kamine', 'Rachel Shane', 'Todd Makurath', 'Wang Zhongjun', 'Wang Zhonglei', 'Adam Mervis', 'Matthew Michael Carnahan', 'Alex Belcher', 'Henry Jackman']"
Dragons: Rescue Riders: Huttsgalor Holiday,5.2,,"['Family', 'Animation']",2020,['Animal'],America,Netflix,All (G),PT46M,Snowfall marks the start of Odinyule — the Viking holiday of giving! But crazy weather might cancel the tradition unless the Rescue Riders can swoop in.Dragons: Rescue Riders: Huttsgalor Holiday featuring Noah Kaye Bentley and Brennley Brown is streaming with subscription on Netflix. It's an animation and family movie with a less than average IMDb audience rating of 5.2 (121 votes).,Greg Rankin,"['T.J. Sullivan', 'Noah Kaye Bentley', 'Brennley Brown', 'Zach Callison', 'Skai Jackson', 'Marsai Martin', 'Andre Robinson', 'Carlos Alazraqui', 'Roshon Fegan', 'Brad Grusnick', 'Sam Lavagnino', 'Laura Bowes']"
Angela's Christmas Wish,7,,"['Action & Adventure', 'Animation']",2020,[],Ireland,Netflix,,PT47M,"A determined Angela makes a wish to reunite her family in time for Christmas, then launches a plan to find her way from Ireland to Australia.Angela's Christmas Wish featuring Lucy O'Connell and Ruth Negga is streaming with subscription on Netflix. It's an action & adventure and animation movie with a better than average IMDb audience rating of 7.0 (1,442 votes).",Damien O'Connor,"[""Lucy O'Connell"", 'Ruth Negga', 'Moe Dunford', 'Pat Kinevane', 'Jared Harris', 'Caitriona Balfe', ""Damien O'Connor"", 'Frank McCourt']"
Ari Eldjárn: Pardon My Icelandic,7.8,,"['Stand-up & Talk', 'Comedy']",2020,['Science'],Iceland,Netflix,18+ (R),PT54M,"Comedian Ari Eldjárn pokes fun at Nordic rivalries, Hollywood’s take on Thor, the whims of toddlers and more.Ari Eldjárn: Pardon My Icelandic featuring Ari Eldjárn is streaming with subscription on Netflix. It's a Comedy and Stand up & Talk movie with a high IMDb audience rating of 7.8 (1,513 votes).",August Jakobsson,"['Ari Eldjárn', 'August Jakobsson']"
Dogwashers,5.8,,"['Drama', 'Comedy']",2020,[],Argentina,Netflix,,PT1H47M,"When a narco past his prime refuses to pay a debt to an upstart, only a secret stash of money can save his men. But guess what the gardener just found?Dogwashers featuring Christian Tappán and Anderson Ballesteros is streaming with subscription on Netflix. It's a comedy and drama movie with an average IMDb audience rating of 5.8 (598 votes).",Carlos Moreno,"['Christian Tappán', 'Anderson Ballesteros', 'John Álex Toro', 'Antonio García Ángel', 'Pilar Quintana']"
Felix Lobrecht: Hype,5.9,,"['Stand-up & Talk', 'Comedy']",2020,['Dark Comedy'],Germany,Netflix,,PT59M,"Felix Lobrecht aims his dark humor at overly polite culture, weird laughter, the sheer awkwardness of a walking baby and more in this stand-up special.Felix Lobrecht: Hype featuring Felix Lobrecht is streaming with subscription on Netflix. It's a Comedy and Stand up & Talk movie with an average IMDb audience rating of 5.9 (255 votes).",Jan-Peter Horns,"['Felix Lobrecht', 'Felix Lobrecht', 'Godehard Wolpers', 'Felix Lobrecht']"
Bobbleheads: The Movie,2.3,,"['Action & Adventure', 'Animation']",2020,[],America,Netflix,7+ (PG),PT1H22M,"Get ready for a big shake-up when misfit bobbleheads take on trashy humans and a slobbery dog who crash their home with plans to swap a new baseball player bobblehead for a valuable one of them. With some guidance from Bobblehead Cher, they find the courage to bobble-up for an outrageous battle of wits and wobble.Bobbleheads: The Movie featuring Karen Fukuhara and Khary Payton is streaming with subscription on Netflix, available for rent or purchase on iTunes, available for rent or purchase on Google Play, and 3 others. It's an action & adventure and animation movie with a very low IMDb audience rating of 2.3 (360 votes).",Kirk Wise,"['Karen Fukuhara', 'Khary Payton', 'Julian Sands', 'Brenda Song', 'Cher', 'Jennifer Coolidge', 'Luke Wilson', 'Anthony De Stefanis', 'Hala Finley', 'Grey DeLisle', 'Charlie Adler', 'Kelly D. Ward', 'Lawrence Kasanoff', 'Jimmy Ienner', 'Rich Thorne', 'Karl Geurs', ""Greg O'Connor""]"
Full Out 2: You Got This!,4.6,,['Family'],2020,[],America,Netflix,,PT1H30M,"When the University of Oklahoma Sooners lose their star gymnast, Brenna Dowell, the rest of the team have to find a way to believe in themselves in order to win their second National Gymnastics Championship. With the help of Riley, a local breakdancing phenomenon, Chayse and her OU teammates learn to incorporate intricate breakdance techniques into their gymnastics routines in order to find a competitive edge. At the end of it all, they realize what matters most is finding the confidence to believe in yourself.Full Out 2: You Got This! featuring Logan Edra and Sydney Cope is streaming with subscription on Netflix, available for rent or purchase on iTunes, available for rent or purchase on Google Play, and 3 others. It's a family movie with a less than average IMDb audience rating of 4.6 (512 votes).",Jeff Deverett,"['Logan Edra', 'Sydney Cope', 'Braedyn Bruner', 'Liza Wilk', 'Billie D. Merritt', 'Jessica Johnson', 'Julia Self', 'Andy Chan', 'Jeff Deverett']"
Uma Maheswara Ugra Roopasya,7.7,,"['Drama', 'Comedy']",2020,[],India,Netflix,,PT2H16M,"Defeated and humiliated in a fight while trying to defuse a conflict among his fellow villagers, a photographer vows revenge on his attacker.Uma Maheswara Ugra Roopasya featuring Satyadev Kancharana and Hari Chandana is streaming with subscription on Netflix, available for rent or purchase on iTunes, and available for rent or purchase on Google Play. It's a comedy and drama movie with a high IMDb audience rating of 7.7 (1,651 votes).",Venkatesh Maha,"['Satyadev Kancharana', 'Hari Chandana', 'Naresh', 'Roopa Koduvayur', 'Suhas', 'Ravindra Vijay', 'Jabardasth Ram Prasad', 'Raghavan', 'Thummala Narasimha Reddy', 'Karuna Kumar', 'Venkatesh Maha', 'Venkatesh Maha', 'Bijibal']"
Elf Pets: Santa's Reindeer Rescue,5.1,,"['Animation', 'Family']",2020,[],,Netflix,,PT26M,"It's almost Christmas and Santa's test flights have run into trouble. Can The Elf on the Shelf, a crew of adorable Elf Pets Reindeer and Santa's gang of trusted Scout Elf friends help him find the answer before it's too late? Join Santa's cast of whimsical characters in this animated Christmas Special full of toe-tapping humor and heart, as they work together to save the holiday season and discover the power of love.Elf Pets: Santa's Reindeer Rescue featuring Brad Hyland and Joe Peery is streaming with subscription on Netflix, available for purchase on iTunes, available for purchase on Google Play, and 1 other. It's an animation and family movie with a less than average IMDb audience rating of 5.1 (83 votes).",Chanda Bell,"['Brad Hyland', 'Joe Peery', 'Leslie Bellair', 'Trevor Goble', 'Kristyl Dawn Tift', 'Lowrey Brown', 'Chanda Bell']"
Friendsgiving,4.4,,"['Comedy', 'Drama']",2020,"['Holiday', 'Female Director']",America,Netflix,18+ (R),PT1H35M,"Newly-divorced actress Molly, her recently-dumped lesbian best friend Abby and Molly’s mother Helen host a dysfunctional, comical and chaotic Thanksgiving dinner for their motley crew of close friends and strange acquaintances.Friendsgiving featuring Malin Åkerman and Kat Dennings is streaming with subscription on Netflix, available for rent or purchase on iTunes, available for rent or purchase on Google Play, and 3 others. It's a comedy and drama movie with a less than average IMDb audience rating of 4.4 (2,809 votes).",Nicol Paone,"['Malin Åkerman', 'Kat Dennings', 'Jane Seymour', 'Aisha Tyler', 'Deon Cole', 'Ryan Hansen', 'Chelsea Peretti', 'Christine Taylor', 'Wanda Sykes', 'Margaret Cho', 'Rhea Butcher', 'Fortune Feimster', 'Andrew Santino', 'Dana DeLorenzo', 'Jack Donnelly', 'Ben Stiller', 'Haroon Saleem', 'Malin Åkerman', 'Nicholas Weinstock', 'Nicol Paone']"
Russell Howard: Recalibrate,7.4,,['Comedy'],2017,['Political'],United Kingdom,Netflix,18+ (R),PT1H9M,"Self-deprecating comic Russell Howard plows ahead through politics, porn, social media and his own shortcomings. Yet he somehow keeps it positive.Russell Howard: Recalibrate featuring Russell Howard is streaming with subscription on Netflix. It's a comedy movie with a better than average IMDb audience rating of 7.4 (1,611 votes).",Peter Orton,"['Russell Howard', 'Russell Howard']"
The Professor and the Madman,7.2,,"['Mystery', 'Drama']",2019,"['Doctor', 'Adaptation', 'Based on Books']",France,Kanopy,,PT2H4M,"Professor James Murray begins work compiling words for the first edition of the Oxford English Dictionary in the mid 19th century, and receives over 10,000 entries from a patient at Broadmoor Criminal Lunatic Asylum, Dr. William Minor.The Professor and the Madman featuring Mel Gibson and Sean Penn is streaming with subscription on Netflix, streaming with subscription on Hoopla, streaming with subscription on Kanopy, and 4 others. It's a drama and mystery movie with a better than average IMDb audience rating of 7.2 (44,702 votes).",Farhad Safinia,"['Mel Gibson', 'Sean Penn', 'Eddie Marsan', 'Natalie Dormer', 'Ioan Gruffudd', 'Steve Coogan', 'Jeremy Irvine', 'Brendan Patricks', 'Adam Fergus', 'Jennifer Ehle', 'Brian Fortune', 'Aidan McArdle', 'David Crowley', ""Kieran O'Reilly"", 'Bryan Murray', 'Oengus MacNamara', 'Christopher Maleki', 'Sean Duggan', 'Bryan Quinn', 'Steve Gunn', 'Malcolm Freeman', 'Bruce Davey', 'Gastón Pavlovich', 'Mel Gibson', 'Farhad Safinia', 'John Boorman', 'Todd Komarnicki']"
9to5: The Story of a Movement,7.4,,['Documentary'],2020,[],America,Netflix,,PT1H29M,"In the early 1970s, a group of secretaries in Boston decided that they had suffered in silence long enough. They started fighting back, creating a movement to force changes in their workplaces. This movement became national, and is a largely forgotten story of U.S. twentieth century history. It encapsulates a unique intersection of the women’s movement with the labor movement. The awareness these secretaries brought to bear on women’s work reverberates even today. Clericals were the low-wage workers of their era. America now confronts the growing reality of deep income inequality. The stories and strategies of these bold, creative women resonates in contemporary America.9to5: The Story of a Movement featuring Jane Fonda and Karen Nussbaum is streaming with subscription on Netflix. It's a documentary movie with a better than average IMDb audience rating of 7.4 (233 votes).",Julia Reichert,"['Steven Bognar', 'Jane Fonda', 'Karen Nussbaum', 'Julia Reichert', 'Steven Bognar']"
Feel the Beat,6.3,,"['Family', 'Drama']",2020,['Dance'],Canada,Netflix,All (G),PT1H47M,"After failing to make it on Broadway, April returns to her hometown and reluctantly begins training a misfit group of young dancers for a competition.Feel the Beat featuring Sofia Carson and Wolfgang Novogratz is streaming with subscription on Netflix. It's a drama and family movie with an average IMDb audience rating of 6.3 (10,804 votes).",Elissa Down,"['Sofia Carson', 'Wolfgang Novogratz', 'Donna Lynne Champlin', 'Enrico Colantoni', 'Dennis Andres', 'Rex Lee', 'Brandon Kyle Goodman', 'Eva Hauge', 'Lidya Jewett', 'Sadie Lapidus', 'Johanna Colón', 'Shaylee Mansfield', 'Shiloh Nelson', 'Justin Caruso Allan', 'Carina Battrick', 'Kai Zen', 'Marissa Jaret Winokur', 'Robinne Fanfair', 'Pamela MacDonald', 'Marcia Bennett', 'Drew Davis', 'Susan Cartsonis', 'Aaron Barnett', 'Brent Emery', 'Suzanne McNeill Farwell', 'Michael Armbruster', 'Shawn Ku']"
Four Brothers,6.8,,"['Crime', 'Action & Adventure']",2005,['Revenge'],America,BET+,18+ (R),PT1H49M,"Four adopted brothers return to their Detroit hometown when their mother is murdered and vow to exact revenge on the killers.Four Brothers featuring Mark Wahlberg and Tyrese Gibson is streaming with subscription on Netflix, streaming with subscription on BET+, available for rent or purchase on iTunes, and 4 others. It's an action & adventure and crime movie with a better than average IMDb audience rating of 6.8 (145,021 votes).",John Singleton,"['Mark Wahlberg', 'Tyrese Gibson', 'André Benjamin', 'Garrett Hedlund', 'Terrence Howard', 'Josh Charles', 'Sofía Vergara', 'Fionnula Flanagan', 'Chiwetel Ejiofor', 'Taraji P. Henson', 'Barry Shabaka Henley', 'Jernard Burks', 'Kenneth Welsh', 'Tony Nappo', 'Shawn Singleton', 'Lyriq Bent', 'Shomari Downer', 'Mpho Koaho', 'Costin Manu', 'Kevin Duhaney', 'Victor A. Young', 'Lorenzo Di Bonaventura', 'Erik Howsam', 'Ric Kidney', 'David Elliot', 'Paul Lovett', 'David Arnold']"
The Most Dangerous Man in Europe,6.8,,"['History', 'Documentary']",2020,"['Spy', 'War', 'Military']",Spain,Netflix,,PT1H8M,"Waffen-SS officer Otto Skorzeny (1908-75) became famous for his participation in daring military actions during World War II. In 1947 he was judged and imprisoned, but he escaped less than a year later and found a safe haven in Spain, ruled with an iron hand by General Francisco Franco. What did he do during the many years he spent there?The Most Dangerous Man in Europe featuring Paloma Navarro and Luis María Pardo is streaming with subscription on Netflix. It's a documentary and history movie with a better than average IMDb audience rating of 6.8 (209 votes).",Pablo Azorín,"['Pedro de Echave', 'Paloma Navarro', 'Luis María Pardo', 'José Luis Blanco Corredoira', 'Ralph P. Ganis', 'Almudena Grandes', 'Stuart Smith', 'Joan Buades', 'Javier Juárez', 'David Solar', 'Jacinto Antón', 'Waltraut Riess', 'Efraim Zuroff', 'Óscar González', 'Jaume Poma', 'Alexandra Jones', 'Yossi Melman', 'Otto Skorzeny', 'Ilse Lüthje', 'Francisco Franco', 'Víctor de la Serna', 'Adolf Hitler', 'Andrés Luque', 'Nacho Tejedor', 'Pablo Azorín', 'Pedro de Echave', 'Francisco Albéniz']"
The Blind Christ,5.8,,"['Comedy', 'Drama']",2016,['Religion'],Chile,Netflix,,PT1H35M,Michael is an inhabitant of a remote village in the Chilean desert. But not any inhabitant. He is Christ.The Blind Christ featuring Michael Silva and Pedro Godoy is streaming with subscription on Netflix. It's a comedy and drama movie with an average IMDb audience rating of 5.8 (273 votes).,Christopher Murray,"['Michael Silva', 'Pedro Godoy', 'Ana María Henríquez', 'Mauricio Pinto', 'Bastian Inostroza', 'Christopher Murray']"
TMNT,6.2,,"['Children', 'Comedy']",2007,"['Cartoon', 'Superhero', 'Animal']",Hong Kong,HBO MAX,7+ (PG),PT1H27M,"After the defeat of their old arch nemesis, The Shredder, the Turtles have grown apart as a family. Struggling to keep them together, their rat sensei, Splinter, becomes worried when strange things begin to brew in New York City.TMNT featuring James Arnold Taylor and Mitchell Whitfield is streaming with subscription on Netflix, streaming with subscription on HBO MAX, available for rent or purchase on iTunes, and 3 others. It's an action & adventure and children movie with an average IMDb audience rating of 6.2 (64,189 votes).",Kevin Munroe,"['James Arnold Taylor', 'Mitchell Whitfield', 'Nolan North', 'Mikey Kelley', 'Sarah Michelle Gellar', 'Chris Evans', 'Mako', 'Patrick Stewart', 'Kevin Smith', 'Laurence Fishburne', 'Zhang Ziyi', 'John DiMaggio', 'Paula Mattioli', 'Kevin Michael Richardson', 'Fred Tatasciore', 'Dee Bradley Baker', 'Greg Baldwin', 'Jeff Bennett', 'Jim Cummings', 'Grey DeLisle', 'Chris Edgerly', 'Galen Walker', 'Kyle Clark', 'Paul Wang', 'Thomas K. Gray', 'Tom Gray Thomas Gray', 'Francis Kao', 'Frederick U. Fierst', 'Gary Richardson', 'Peter Laird', 'Kevin Munroe', 'Klaus Badelt']"
Here Comes the Rain,6.3,,['Drama'],2011,[],Lebanon,Netflix,,PT1H40M,"Abducted during the Lebanese Civil War and now in his 50s, Ramez is finally a free man. But he returns to society deeply traumatized by the past.Here Comes the Rain featuring Hassan Mrad and Julia Kassar is streaming with subscription on Netflix. It's a drama movie with an average IMDb audience rating of 6.3 (63 votes).",Bahij Hojeij,"['Hassan Mrad', 'Julia Kassar', 'Carmen Lebbos', 'Bernadette Hodeib', 'Elie Mitri', 'Diamand Abou Abboud', 'Bahij Hojeij', 'Paul Baboudjian']"
The Lost Cafe,6.6,,"['Drama', 'Comedy']",2018,[],Nigeria,Netflix,,PT1H16M,"This film, the first ever Nigerian-Norwegian co-production, tells the story of Ose, a young Nigerian woman who decides to pursue her dream career as a filmmaker in Norway. Torn between two worlds, with family issues at home and problems settling in, Ose meets the strange, half-blind owner of a quaint coffee shop that serves the best coffee in the world and begins to find the most unexpected answers to her problems.The Lost Cafe featuring Tunde Aladese and Jenny Bonden is streaming with subscription on Netflix. It's a comedy and drama movie with an average IMDb audience rating of 6.6 (25 votes).",Kenneth Gyang,"['Tunde Aladese', 'Jenny Bonden', 'Tayo Citadel', 'Anita Daniels', 'Silje Drengsrud', 'Belinda Effah', 'Regina Idu Udalor', 'Udalor Akor', 'Ifesinachi Okoli-Okpagu', 'Regina Idu Udalor']"
One Day We'll Talk About Today,7.4,,"['Drama', 'Family']",2020,[],Indonesia,Netflix,All (G),PT2H0M,"Harboring a deep secret, a seemingly happy family confronts the trauma of years past as a clash between generations threatens to separate them.One Day We'll Talk About Today featuring Rachel Amanda and Alleyra Fakhira Kurniawan is streaming with subscription on Netflix. It's a drama and family movie with a better than average IMDb audience rating of 7.4 (1,128 votes).",Angga Dwimas Sasongko,"['Rachel Amanda', 'Alleyra Fakhira Kurniawan', 'Gween Natusha Ellvania', 'Rio Dewanto', 'Sinyo Riza', 'M. Adhiyat', 'Sheila Dara Aisha', 'Nayla D Purnama', 'Syaqilla Afiffah Putri', 'Donny Damara', 'Oka Antara', 'Susan Bachtiar', 'Niken Anjani', 'Ardhito Pramono', 'Agla Artalidia', 'Umay Shahab', 'Sivia Azizah', 'Isyana Sarasvati', 'Chicco Jerikho', 'Joe P Project', 'Arswendi Nasution', 'Anggia Kharisma', 'Ajeng Parameswari', 'Angga Dwimas Sasongko', 'Anggia Kharisma', 'Kusumo Martanto', 'Michael Y. Chow', 'William Utomo', 'Winston Utomo', 'Angga Dwimas Sasongko', 'Jenny Jusuf']"
Kambili: The Whole 30 Yards,6.6,,"['Romance', 'Comedy']",2021,[],,Netflix,,PT2H20M,"Kambili Maduka, is an irresponsible, spoiled, spendthrift 28-year-old woman who is turning 29 in a few days. The only thing on her mind is to get married before she turns 30. However, after getting suspended from work due to her incessant lateness, she goes on a date with her boyfriend and he breaks up with her, dashing her hopes of getting married before 30. She decides that what she needs to do is prove to her boyfriend that she can be everything he wants her to be which is; responsible, driven, focused, and wife material.Kambili: The Whole 30 Yards featuring Nancy Isime and Mawuli Gavor is streaming with subscription on Netflix. It's a comedy and romance movie with an average IMDb audience rating of 6.6 (37 votes).",Kayode Kasum,"['Nancy Isime', 'Mawuli Gavor', 'Jide Kene Achufusi']"
Bert Kreischer: Hey Big Boy,7,,"['Stand-up & Talk', 'Comedy']",2020,['Science'],America,Netflix,,PT1H2M,"Still the ultimate comedy party animal, Bert Kreischer tells more stories about parenthood and family life in a stand-up special from Cleveland.Bert Kreischer: Hey Big Boy featuring Bert Kreischer is streaming with subscription on Netflix. It's a Comedy and Stand up & Talk movie with a better than average IMDb audience rating of 7.0 (1,935 votes).",Jeff Tomsic,"['Bert Kreischer', 'Bert Kreischer']"
Leyla Everlasting,3.7,,['Comedy'],2020,[],Turkey,Netflix,18+ (R),PT1H52M,"A resilient housewife, her husband and their marriage therapist become mired in a toxic love triangle and a plot to obtain an antique manuscript.Leyla Everlasting featuring Demet Akbağ and Haluk Bilginer is streaming with subscription on Netflix. It's a comedy movie with a low IMDb audience rating of 3.7 (7,474 votes).",Ezel Akay,"['Demet Akbağ', 'Haluk Bilginer', 'Elçin Sangu', 'Alican Yücesoy', 'Hakan Eke', 'Emre Kıvılcım', 'İhsan Ceylan', 'Fırat Tanış', 'Figen Ermek Özçorlu', 'Umut Özçorlu', 'Adnan Yildirim', 'Ozlem Lale', 'Ugur Saatci', 'Ender Akay']"
Ala Vaikunthapurramuloo,7.3,,"['Action & Adventure', 'Drama']",2020,['Doctor'],India,Netflix,13+ (PG-13),PT2H45M,"Fate plays a vital role in connecting the life of Bantu, a son who seeks validation from his cold-hearted father with the life of Raj, whose millionaire father wishes that he was more assertive.Ala Vaikunthapurramuloo featuring Allu Arjun and Pooja Hegde is streaming with subscription on Netflix. It's an action & adventure and drama movie with a better than average IMDb audience rating of 7.3 (16,310 votes).",Trivikram Srinivas,"['Allu Arjun', 'Pooja Hegde', 'Murli Sharma', 'Jayaram', 'Sushanth', 'Nivetha Pethuraj', 'Samuthirakani', 'Tabu', 'Navdeep', 'Sunil Varma', 'Rajendra Prasad', 'Rahul Ramakrishna', 'Brahmaji', 'Harshavardhan', 'Sachin Khedekar', 'Vennela Kishore', 'Brahmanandam', 'Ajay', 'Tanikella Bharani', 'Rohini', 'Govind Padmasoorya', 'Allu Aravind', 'S. Radha Krishna', 'PDV Prasad', 'Trivikram Srinivas', 'S. Thaman']"
London Hughes: To Catch A D*ck,4.7,,['Comedy'],2020,[],America,Netflix,,PT1H0M,"London Hughes, the sauciest comedian to come out of the UK, takes us on a brilliant and bold tour of her d*ck catching history.London Hughes: To Catch A D*ck featuring London Hughes is streaming with subscription on Netflix. It's a comedy movie with a less than average IMDb audience rating of 4.7 (322 votes).",Kristian Mercado Figueroa,"['London Hughes', 'Kevin Hart', 'London Hughes']"
Maz Jobrani: Immigrant,6.7,,"['Documentary', 'Comedy']",2017,[],America,Netflix,,PT1H7M,"Iranian American comic Maz Jobrani lights up the Kennedy Center with riffs on immigrant life in the Trump era, modern parenting pitfalls and more.Maz Jobrani: Immigrant featuring Maz Jobrani is streaming with subscription on Netflix. It's a comedy and documentary movie with a better than average IMDb audience rating of 6.7 (845 votes).",Maz Jobrani,['Maz Jobrani']
