Title,IMDB_Rating,Reelgood_Rating,Genres,Year,Tags,Country,Source,Rated,Duration,Description,Director,Employees
Jiu Jitsu,2.9,,"['Action & Adventure', 'Science-Fiction']",2020,[],Cyprus,Netflix,18+ (R),PT1H42M,"Every six years, an ancient order of jiu-jitsu fighters joins forces to battle a vicious race of alien invaders. But when a celebrated war hero goes down in defeat, the fate of the planet and mankind hangs in the balance.Jiu Jitsu featuring Nicolas Cage and Alain Moussi is streaming with subscription on Netflix, available for rent or purchase on iTunes, available for rent or purchase on Google Play, and 3 others. It's an Action & Adventure and Science Fiction movie with a very low IMDb audience rating of 2.9 (8,526 votes).",Dimitri Logothetis,"['Nicolas Cage', 'Alain Moussi', 'Frank Grillo', '托尼·贾', 'JuJu Chan', 'Marie Avgeropoulos', 'Rick Yune', 'Eddie Steeples', 'Dan Rizzuto', 'Ryan Tarran', 'John D. Hickman', 'Tommy Walker', 'Jack Kingsley', 'Marrese Crump', 'Rigan Machado', 'June Sasitorn', 'Dimitri Logothetis', 'Euthymios Logothetis', 'Martin J. Barab', 'Gary Wood', 'Shaun S. Sanghani', 'Dimitri Logothetis', 'Jim McGrath']"
Night in Paradise,6.7,,"['Crime', 'Drama']",2020,"['Gangster', 'Revenge']",South Korea,Netflix,16+,PT2H11M,"A gangster tries to clean up his life to care for his sick sister and nephew. But someone targeting him accidentally kills them instead. In shock, he decides to take revenge.Night in Paradise featuring Uhm Tae-goo and Jeon Yeo-been is streaming with subscription on Netflix. It's a crime and drama movie with a better than average IMDb audience rating of 6.7 (6,533 votes).",Park Hoon-jung,"['Uhm Tae-goo', 'Jeon Yeo-been', 'Cha Seung-won', 'Lee Ki-young', 'Park Ho-san', 'Hyun Bong-sik', 'Cho Dong-in', 'Cha Soon-bae', 'Ahn Se-bin', 'Jang Young-nam', 'Lee Mun-sik', 'Son Byung-ho', 'Kim Yeong-seon', 'Park Hoon-jung', 'Shin Min-kyung', 'Yeon Young-sik', 'Kim Woo-taek', 'Park Hoon-jung', 'Mowg']"
A Whisker Away,6.7,,"['Drama', 'Anime']",2020,[],Japan,Netflix,7+ (PG),PT1H44M,"Miyo ""Muge"" Sasaki is a peculiar second-year junior high student who has fallen in love with her classmate Kento Hinode. Muge resolutely pursues Kento every day, but he takes no notice of her. Nevertheless, while carrying a secret she can tell no one, Muge continues to pursue Kento. Muge discovers a magic mask that allows her to transform into a cat named Tarō. The magic lets Muge get close to Kento, but eventually it may also make her unable to transform back to a human.A Whisker Away featuring Mirai Shida and Natsuki Hanae is streaming with subscription on Netflix. It's an anime and drama movie with a better than average IMDb audience rating of 6.7 (9,419 votes) and was very well received by critics.",Junichi Sato,"['Tomotaka Shibayama', 'Mirai Shida', 'Natsuki Hanae', 'Kouichi Yamadera', 'Hiroaki Ogi', 'Minako Kotobuki', 'Kensho Ono', 'Susumu Chiba', 'Ayako Kawasumi', 'Sayaka Ohara', 'Daisuke Namikawa', 'Eri Kitamura', 'Shin-ichiro Miki', 'Rei Sakuma', 'Oolongta Yoshida', 'Fukushi Ochiai', 'Saki Yonemoto', 'Mari Okada', 'Mina Kubota']"
Kannum Kannum Kollaiyadithaal,7.7,,"['Drama', 'Thriller']",2020,[],India,Netflix,,PT2H42M,"Siddarth falls head-over-heels in love with Meera but things take a risky turn when they get into a messy situation with a dangerous man.Kannum Kannum Kollaiyadithaal featuring Dulquer Salmaan and Ritu Varma is streaming with subscription on Netflix, available for rent or purchase on iTunes, and available for rent or purchase on Google Play. It's a drama and thriller movie with a high IMDb audience rating of 7.7 (6,766 votes).",Desingh Periyasamy,"['Dulquer Salmaan', 'Ritu Varma', 'Rakshan', 'Niranjani Ahathian', 'Gautham Vasudev Menon', 'Munishkanth', 'Johnny Lever', 'Paresh Rawal', 'Mohit Raina', 'Kovai Sarala', 'Saurabh Shukla', 'Anto Joseph', 'Niroop Pinto', 'Desingh Periyasamy', 'Harshavardhan Rameshwar', 'Masala Coffee']"
The Old Ways,5.4,,"['Drama', 'Thriller']",2020,[],America,Netflix,18+ (R),PT1H30M,"Cristina, a journalist of Mexican origin, travels to her ancestral home in Veracruz to investigate a story of sorcery and healing. There, she is kidnapped by a group of locals who claim she's the devil incarnated.The Old Ways featuring Brigitte Kali Canales and Andrea Cortés is streaming with subscription on Netflix, available for rent or purchase on iTunes, available for rent or purchase on Google Play, and 3 others. It's a drama and thriller movie with a less than average IMDb audience rating of 5.4 (5,794 votes).",Christopher Alender,"['Brigitte Kali Canales', 'Andrea Cortés', 'Julian Lerma', 'Sal Lopez', 'Julia Vera', 'AJ Bowen', 'Christa Boarini', 'David Grove Churchill Viste', 'T. Justin Ross', 'Christopher Alender', 'David A. Smith', 'Marcos Gabriel', 'Scott G. Carr', 'Marcos Gabriel', 'Ben Lovett']"
Vampires vs. the Bronx,5.6,,"['Horror', 'Comedy']",2020,"['Supernatural', 'Vampire', 'New York']",America,Netflix,13+ (PG-13),PT1H26M,"Three gutsy kids from a rapidly gentrifying Bronx neighborhood stumble upon a sinister plot to suck all the life from their beloved community.Vampires vs. the Bronx featuring Jaden Michael and Gerald W. Jones III is streaming with subscription on Netflix. It's a comedy and horror movie with an average IMDb audience rating of 5.6 (9,773 votes).",Osmany Rodriguez,"['Jaden Michael', 'Gerald W. Jones III', 'Gregory Diaz IV', 'Sarah Gadon', 'Method Man', 'Shea Whigham', 'Coco Jones', 'The Kid Mero', 'Chris Redd', 'Vladimir Caamano', 'Jeremie Harris', 'Adam David Thompson', 'Judy Marte', 'Richard Bekins', 'Zoe Saldana', 'Socorro Santiago', 'Germar Terrell Gardner', 'Josiah Nolan', 'Anthony Mecca', 'Imani Lewis', 'Toree Alexandre', 'Erin David', 'Lorne Michaels', 'Bert Hamelinck', 'Michael Sagol', 'Blaise Hemingway', 'Osmany Rodriguez', 'Brooke Blair', 'Will Blair']"
Disclosure,8.2,,"['Documentary', 'LGBTQ']",2020,[],America,Fandor,18+ (R),PT1H48M,"An investigation of how Hollywood's fabled stories have deeply influenced how Americans feel about transgender people, and how transgender people have been taught to feel about themselves.Disclosure featuring Laverne Cox and Bianca Leigh is streaming with subscription on Netflix, streaming with subscription on Fandor (Via Prime Video), free on Tubi, and 4 others. It's a documentary and LGBTQ movie with a high IMDb audience rating of 8.2 (5,330 votes).",Sam Feder,"['Laverne Cox', 'Bianca Leigh', 'Jen Richards', 'Alexandra Billings', 'Susan Stryker', 'Yance Ford', 'Lilly Wachowski', 'Brian Michael Smith', 'Tiq Milan', 'Nick Adams', 'Zeke Smith', 'Rain Valdez', 'Elliot Fletcher', 'Marquise Vilson', 'Jazzmun', 'Leo Sheng', 'Trace Lysette', 'Alexandra Grey', 'Candis Cayne', 'Jamie Clayton', 'Michael D. Cohen', 'Amy Scholder', 'Sam Feder', 'Abigail Disney', 'Charlotte Cook', 'Laverne Cox', 'Lynda Weinman', 'Matthew Perniciaro', 'Michael Sherman', 'Francesco Le Metre']"
If Anything Happens I Love You,7.8,,"['Family', 'Animation']",2020,['Short'],America,Netflix,7+ (PG),PT12M,"Grieving parents journey through an emotional void as they mourn the loss of a child in the aftermath of a tragic school shooting.If Anything Happens I Love You is streaming with subscription on Netflix. It's an animation and family movie with a high IMDb audience rating of 7.8 (15,839 votes).",Michael Govier,"['Will McCormack', 'Gary Gilbert', 'Gerald Chamales', 'Maryann Garger', 'Michael Govier', 'Jayme Lemons', 'Jeremy Ross', 'Laura Dern', 'Peter Morgan', 'Robyn Klein', 'Sydney Holland', 'Will McCormack', 'Michael Govier', 'Will McCormack', 'Lindsay Marcus']"
Hating Peter Tatchell,7.6,,"['Documentary', 'LGBTQ']",2020,[],Australia,Netflix,,PT1H32M,"The powerful and inspiring true story of the controversial human rights campaigner whose provocative acts of civil disobedience rocked the British establishment, revolutionised attitudes to homosexuality and exposed world tyrants. As social attitudes change and history vindicates Peter's stance on gay rights, his David versus Goliath battles gradually win him status as a national treasure. The film follows Peter as he embarks on his riskiest crusade yet by seeking to disrupt the FIFA World Cup in Moscow to draw attention to the persecution of LGBT+ people in Russia and Chechnya.Hating Peter Tatchell featuring Peter Tatchell and Ian McKellen is streaming with subscription on Netflix. It's a documentary and LGBTQ movie with a high IMDb audience rating of 7.6 (770 votes).",Christopher Amos,"['Peter Tatchell', 'Ian McKellen', 'Stephen Fry', 'Tom Robinson', 'Angela Mason', 'Chris Smith', 'George Carey', 'Elton John', 'Dena Curtis', 'Lee Matthews', 'Veronica Fury', 'Christopher Amos']"
The Life Ahead,6.8,,"['Comedy', 'Drama']",2020,"['Survival', 'Adaptation', 'Based on Books']",Italy,Netflix,13+ (PG-13),PT1H34M,"In seaside Italy, a Holocaust survivor with a daycare business takes in a 12-year-old street kid who recently robbed her.The Life Ahead featuring Sophia Loren and Ibrahima Gueye is streaming with subscription on Netflix. It's a comedy and drama movie with a better than average IMDb audience rating of 6.8 (14,063 votes) and was very well received by critics.",Edoardo Ponti,"['Sophia Loren', 'Ibrahima Gueye', 'Renato Carpentieri', 'Diego Iosif Pirvu', 'Massimiliano Rossi', 'Abril Zamora', 'Babak Karimi', 'Malich Cissé', 'Simone Surico', 'Nicola Valenzano', 'Francesco Cassano', 'Carlo Degli Esposti', 'Lynda Weinman', 'Nicola Serra', 'Regina K. Scully', 'David Paradice', 'Edoardo Ponti', 'Esmeralda Swartz', 'Geralyn White Dreyfous', 'Guendalina Ponti', 'Jamie Wolf', 'Patrizia Massa', 'Edoardo Ponti', 'Fabio Natale', 'Romain Gary', 'Ugo Chiti']"
Stand by Me Doraemon 2,7.5,,"['Animation', 'Fantasy']",2020,[],Japan,Netflix,,PT1H36M,"She and her beloved Shizuka are finally married! Nobita's childhood dream was supposed to come true on his wedding day, but for some reason, Nobita doesn't show up... One of the most popular episodes from the original story transcends time and space, and leads to Nobita's future. Doraemon and Nobita's great adventure begins in order to fulfill his grandmother's wish to see his bride at first sight. This is a story of tears and bonds, set in the past, present and future.Stand by Me Doraemon 2 featuring Wasabi Mizuta and Megumi Oohara is streaming with subscription on Netflix. It's an animation and fantasy movie with a better than average IMDb audience rating of 7.5 (3,671 votes).",Ryuichi Yagi,"['Takashi Yamazaki', 'Wasabi Mizuta', 'Megumi Oohara', 'Yumi Kakazu', 'Subaru Kimura', 'Tomokazu Seki', 'Bakarhythm', 'Shinichi Hatori', 'Nobuko Miyamoto', 'Vanilla Yamazaki', 'Takashi Yamazaki']"
Marc Maron: End Times Fun,6.8,,"['Comedy', 'Documentary']",2020,[],America,Netflix,,PT1H11M,"Marc Maron wades through a swamp of vitamin hustlers, evangelicals and grown male nerd children, culminating in a gleefully filthy end-times fantasy.Marc Maron: End Times Fun featuring Marc Maron is streaming with subscription on Netflix. It's a comedy and documentary movie with a better than average IMDb audience rating of 6.8 (1,920 votes) and was well received by critics.",Lynn Shelton,"['Marc Maron', 'Marc Maron']"
Coffee & Kareem,5.1,,"['Action & Adventure', 'Comedy']",2020,[],America,Netflix,18+ (R),PT1H28M,"A Detroit cop reluctantly teams with his girlfriend's 11-year-old son to clear his name and take down the city's most ruthless criminal.Coffee & Kareem featuring Ed Helms and Terrence Little Gardenhigh is streaming with subscription on Netflix. It's an action & adventure and comedy movie with a less than average IMDb audience rating of 5.1 (13,497 votes).",Michael Dowse,"['Ed Helms', 'Terrence Little Gardenhigh', 'Taraji P. Henson', 'Betty Gilpin', 'RonReaco Lee', 'Andrew Bachelor', 'David Alan Grier', 'Chance Hurstfield', ""William 'Big Sleeps' Stewart"", 'Serge Houde', 'Eduard Witzke', 'Diana Bang', 'Samantha Cole', 'Erik McNamee', 'Terry Chen', 'Garfield Wilson', 'Arielle Tuliao', 'Jag Bal', 'Sonia Sunger', 'Steve Chang', 'Dan Clarke', 'Ed Helms', 'Jordon Foss', 'Mike Falbo', 'Sanford Nelson', 'Don Foss', 'Shane Mack', 'Joseph Trapanese']"
Lingua Franca,6.5,,"['Drama', 'LGBTQ']",2020,"['Female Director', 'New York']",Philippines,Netflix,,PT1H35M,"Olivia, an undocumented Filipina immigrant paranoid about deportation works as a caregiver to a Russian-Jewish grandmother in Brighton Beach, Brooklyn, NY. When the man she’s secretly paying for a green card marriage backs out, she becomes involved with a slaughterhouse worker who is unaware that she’s a trans woman.Lingua Franca featuring Isabel Sandoval and Lynn Cohen is streaming with subscription on Netflix, and free on Tubi. It's a drama and LGBTQ movie with an average IMDb audience rating of 6.5 (690 votes).",Isabel Sandoval,"['Isabel Sandoval', 'Lynn Cohen', 'Eamon Farren', 'Ivory Aquino', 'Lev Gorn', 'P.J. Boudousqué', 'Andrea Leigh', 'Leif Steinert', 'Jake Soister', 'Roman Blat', 'Megan Channell', 'Shiloh Verrico', 'Mark Nelson', 'Daniel Danielson', 'Bryan Webster', 'Dean Temple', 'Ari Barkan', 'Deema Aitken', 'Christine Spang', 'Ian Harmon', 'Matthew James Ballinger', 'Carlo Velayo', 'Darlene Malimas', 'Isabel Sandoval', 'Jerome Kerkman', 'Jhett Tolentino', 'E.A. Rocha', 'Fernando Ortigas', 'Gigi Dement', 'Nicole Cosgrove', 'Romulo Aromin Jr.', 'R.S. Francisco', 'Samuel S. Verzosa', 'Sarah Brennan Kolb', 'Vincent R. Nebrida', 'Isabel Sandoval', 'Teresa Barrozo']"
I Am Woman,6.5,,"['Drama', 'LGBTQ']",2020,['Music'],Australia,Hoopla,18+ (R),PT1H56M,"The story of Helen Reddy, who, in 1966, landed in New York with her three-year-old daughter, a suitcase, and $230 in her pocket. Within weeks, she was broke. Within months, she was in love. Within five years, she was one of the biggest superstars of her time and an icon of the 1970s feminist movement who wrote a song which galvanized a generation of women to fight for change.I Am Woman featuring Tilda Cobham-Hervey and Danielle Macdonald is streaming with subscription on Netflix, streaming with subscription on Hoopla, available for rent or purchase on iTunes, and 4 others. It's a drama and LGBTQ movie with an average IMDb audience rating of 6.5 (2,259 votes).",Unjoo Moon,"['Tilda Cobham-Hervey', 'Danielle Macdonald', 'Evan Peters', 'Damien Strouthos', 'Matthew Cardarople', 'Dusty Sorg', 'Toks James', 'Gus Murray', 'Rita Rani Ahuja', 'Chris Parnell', 'Jordan Raskopoulos', 'Molly Broadstock', 'Rosemary Blight', 'Unjoo Moon', 'Ben Grant', ""Cass O'Connor"", 'Kylie du Fresne', 'Marcus Bolton', 'Maya Amsellem', 'Sharon Harel', 'Tracey Mair', 'Emma Jensen', 'Rafael May']"
Not Another Teen Movie,5.7,,"['Thriller', 'Comedy']",2001,"['Parody', 'Teen', 'Dating']",America,Netflix,16+,PT1H29M,"On a bet, a gridiron hero at John Hughes High School sets out to turn a bespectacled plain Jane into a beautiful and popular prom queen in this outrageous send-up of the teen movies of the 1980s and '90s.Not Another Teen Movie featuring Chyler Leigh and Chris Evans is streaming with subscription on Netflix, free on PlutoTV, available for rent or purchase on iTunes, and 5 others. It's a comedy and thriller movie with an average IMDb audience rating of 5.7 (104,792 votes).",Joel Gallen,"['Chyler Leigh', 'Chris Evans', 'Jaime Pressly', 'Eric Christian Olsen', 'Mia Kirshner', 'Lacey Chabert', 'Samaire Armstrong', 'Cerina Vincent', 'Mr. T', 'Molly Ringwald', 'Heather Brown', 'Nectar Rose', 'Michael Ensign', 'Kyle Cease', 'Eric Jungmann', 'Desi Lydic', 'Deon Richmond', 'Ron Lester', 'Cody McMains', 'Sam Huntington', 'JoAnna Garcia', 'Neal H. Moritz', 'Brad Luff', 'Michael I. Rachmil', 'Adam Jay Epstein', 'Andrew Jacobson', 'Buddy Johnson', 'Mike Bender', 'Phil Beauman', 'Theodore Shapiro']"
Hard Kill,3.3,,"['Action & Adventure', 'Mystery']",2020,[],America,Netflix,18+ (R),PT1H38M,"The work of billionaire tech CEO Donovan Chalmers is so valuable that he hires mercenaries to protect it, and a terrorist group kidnaps his daughter just to get it.Hard Kill featuring Bruce Willis and Jesse Metcalfe is streaming with subscription on Netflix, available for rent or purchase on iTunes, available for rent or purchase on Google Play, and 3 others. It's an action & adventure and mystery movie with a low IMDb audience rating of 3.3 (19,790 votes).",Matt Eskandari,"['Bruce Willis', 'Jesse Metcalfe', 'Natalie Nelson', 'Lala Kent', 'Texas Battle', 'Swen Temmel', 'Sergio Rizzuto', 'Tyler Jon Olson', 'Jon Galanis', 'Leslee Emmett', 'Nicholas Petron', 'Abigail Esmena Froehle', 'Jacquie Nguyen', 'Katie Groneman', 'Adam Huel Potter', 'Chris Petty', 'Timothy C. Sullivan', 'Alexander Eckert', 'Alexander Eckert', 'George Furla', 'Mark Stewart', 'Randall Emmett', 'Shaun S. Sanghani', 'Timothy C. Sullivan', 'Chris LaMont', 'Joe Russo']"
Ghosts of War,5.5,,"['Mystery', 'Thriller']",2020,"['Ghost', 'Supernatural', 'War']",United Kingdom,Netflix,18+ (R),PT1H34M,"A group of World War II American soldiers encounter a supernatural enemy as they occupy a French castle previously under Nazi control.Ghosts of War featuring Brenton Thwaites and Theo Rossi is streaming with subscription on Netflix, available for rent or purchase on iTunes, available for rent or purchase on Google Play, and 2 others. It's a mystery and thriller movie with an average IMDb audience rating of 5.5 (9,751 votes).",Eric Bress,"['Brenton Thwaites', 'Theo Rossi', 'Skylar Astin', 'Kyle Gallner', 'Alan Ritchson', 'Billy Zane', 'Shaun Toub', 'Matthew Reese', 'Laila Banki', 'Shannon McKain', 'Nathan Cooper', 'Alexander Behrang Keshtkar', 'Yanitsa Mihailova', 'Rebecca Flinn-White', 'Kaloyan Hristov', 'Amber Townsend', 'Alexandra Spasova', 'D. Todd Shepherd', 'Joe Simpson', 'Shelley Madison', 'Billy Zane', 'Eric Bress']"
The Vanished,5.7,,"['Mystery', 'Thriller']",2020,"['Drug', 'Police']",America,Netflix,18+ (R),PT1H55M,"A family vacation takes a terrifying turn when parents Paul and Wendy discover their young daughter has vanished without a trace. Stopping at nothing to find her, the search for the truth leads to a shocking revelation.The Vanished featuring Anne Heche and Thomas Jane is streaming with subscription on Netflix, available for rent or purchase on iTunes, available for rent or purchase on Google Play, and 3 others. It's a mystery and thriller movie with an average IMDb audience rating of 5.7 (10,066 votes).",Peter Facinelli,"['Anne Heche', 'Thomas Jane', 'Jason Patric', 'John D. Hickman', 'Peter Facinelli', 'Alex Haydon', 'Aleksei Archer', 'Kristopher Wente', 'Rebecca Lines', 'Lily Anne Harrison', 'Lucas Bentley', 'Dean Shortland', 'Kk Heim', 'Sadie Heim', 'Curtis Nichouls', 'Gregory Harrison', 'Skyler Elyse Philpot', 'Giovanni Capitello', 'Mitchell L. Johnson', 'Jorge Castro-Salinas', 'Andrew Mann', 'Brandon Menchen', 'Jeff Elliott', 'Sasha Yelaun', 'Alastair Burlingham', 'Aleksei Archer', 'Bill Bromiley', ""Brian O'Shea"", 'Chris Mullinax', 'Gary Raskin', 'Giovanna Trischitta', 'Jay Taylor', 'Joe Simpson', 'John Jencks', 'Jonathan Saba', 'Joseph Lanius', 'Nadine Luque', 'Nat McCormick', 'Ness Saban', 'Peter Winther', 'Shanan Becker', 'Shaun S. Sanghani', 'Simon Williams', 'William V. Bromiley', 'Peter Facinelli', 'Sacha Chaban']"
Have a Good Trip: Adventures in Psychedelics,6.8,,"['Documentary', 'Comedy']",2020,['Drug'],America,Netflix,18+ (R),PT1H25M,"Celebrities recall their most mind-bending trips via animations, reenactments and more in this comedic documentary exploring the story of psychedelics.Have a Good Trip: Adventures in Psychedelics featuring Nick Offerman and Sarah Silverman is streaming with subscription on Netflix. It's a comedy and documentary movie with a better than average IMDb audience rating of 6.8 (7,627 votes).",Donick Cary,"['Nick Offerman', 'Sarah Silverman', 'Adam Scott', 'Rosie Perez', 'Adam Horovitz', 'A$AP Rocky', '安东尼·波登', 'Ben Stiller', 'Bill Kreutzmann', 'Carrie Fisher', 'Natasha Lyonne', 'Lewis Black', 'Nick Kroll', 'Paul Scheer', 'Reggie Watts', 'Rob Corddry', 'Shepard Fairey', 'Sting', 'Will Forte', 'Fred Willard', 'Haley Joel Osment', 'Mike Rosenstein', 'Donick Cary']"
The Water Man,5.4,,"['Drama', 'Action & Adventure']",2020,[],America,Hoopla,7+ (PG),PT1H32M,"Hoping to save his sick mother, a boy named Gunner and his friend Jo venture into the remote Wild Horse forest to search for a mythical figure who possesses the secret to immortality. When they go missing, Gunner's father Amos must immerse himself in his son's world to find them.The Water Man featuring David Oyelowo and Amiah Miller is streaming with subscription on Netflix, streaming with subscription on Hoopla, available for rent or purchase on iTunes, and 4 others. It's an action & adventure and drama movie with a less than average IMDb audience rating of 5.4 (3,808 votes).",David Oyelowo,"['David Oyelowo', 'Amiah Miller', 'Lonnie Chavis', 'Rosario Dawson', 'Maria Bello', 'Alfred Molina', 'Aaron Trainor', 'Ted Rooney', 'Jessica Oyelowo', 'John Henry Whitaker', 'Jennifer Lanier', 'Colby Dahlstrom', 'Adam Dunlap', 'Josh Trerise', 'Jack Lanning', 'Brianne Huggins', 'David Oyelowo', 'Oprah Winfrey', 'Emily A. Needell']"
Dance of the 41,6.8,,"['Drama', 'LGBTQ']",2020,"['Based On True Story', 'Adaptation']",Brazil,Netflix,,PT1H30M,"The true story of the infamous transvestite party that scandalized Mexico in 1901.Dance of the 41 featuring Alfonso Herrera and Emiliano Zurita is streaming with subscription on Netflix. It's a drama and LGBTQ movie with a better than average IMDb audience rating of 6.8 (4,306 votes).",David Pablos,"['Alfonso Herrera', 'Emiliano Zurita', 'Fernando Becerril', 'Mabel Cadena', 'Paulina Álvarez Muñoz', 'Rodrigo Virago', 'Fernanda Echevarría', 'Sergio Solís', 'Álvaro Guerrero', 'Roberto Duarte', 'Abraham Juárez', 'Arturo Sampson', 'Marta Núñez Puerto', 'Pablo Cruz', 'Monika Revilla', 'Monika Revilla', 'Carlo Ayhllón']"
Don't Listen,6.1,,"['Horror', 'Thriller']",2020,"['Supernatural', 'Monster']",Spain,Netflix,,PT1H38M,"After the strange death of his young son at their new home, Daniel hears a ghostly plea for help, spurring him to seek out a renowned paranormal expert.Don't Listen featuring Rodolfo Sancho and Ramón Barea is streaming with subscription on Netflix. It's a horror and thriller movie with an average IMDb audience rating of 6.1 (13,641 votes).",Ángel Gómez Hernández,"['Rodolfo Sancho', 'Ramón Barea', 'Nerea Barros', 'Belén Fabra', 'Ana Fernández', 'Lucas Blas', 'Beatriz Arjona', 'Javier Botet', 'Guillermo Sempere', 'Ángel Gómez Hernández', 'Santiago Díaz Cortes']"
The Claus Family,5.5,,"['Comedy', 'Family']",2020,"['Christmas', 'Holiday']",Belgium,Netflix,7+ (PG),PT1H36M,"When his grandfather suddenly falls ill, holiday-hating Jules learns of his family's magical legacy and realizes he's the only hope to save Christmas.The Claus Family featuring Jan Decleir and Mo Bakker is streaming with subscription on Netflix. It's a comedy and family movie with an average IMDb audience rating of 5.5 (2,006 votes).",Matthias Temmermans,"['Jan Decleir', 'Mo Bakker', 'Bracha van Doesburgh', 'Stefaan Degand', 'Eva van der Gucht', 'Josje Huisman', 'Janne Desmet', 'Pommelien Thijs', 'Wim Willaert', 'Matthias Temmermans', 'Ruben Vandenborre']"
Nobody Sleeps in the Woods Tonight,4.9,,"['Mystery', 'Thriller']",2020,"['Space', 'Science', 'Survival']",Poland,Netflix,18+ (R),PT1H42M,"Addicted to technology, a group of teens attends a rehabilitation camp in the forest, but a sinister force there intends to take them offline forever.Nobody Sleeps in the Woods Tonight featuring Julia Wieniawa-Narkiewicz and Wiktoria Gąsiewska is streaming with subscription on Netflix. It's a mystery and thriller movie with a less than average IMDb audience rating of 4.9 (11,347 votes) and was well received by critics.",Bartosz M. Kowalski,"['Julia Wieniawa-Narkiewicz', 'Wiktoria Gąsiewska', 'Stanisław Cywka', 'Sebastian Dela', 'Michał Lupa', 'Gabriela Muskała', 'Mirosław Zbrojewicz', 'Michal Zbroja', 'Piotr Cyrwus', 'Małgorzata Szczerbowska', 'Olaf Lubaszenko', 'Wojciech Mecwaldowski', 'Jakub Góralczuk', 'Filip Góralczuk', 'Izabela Dąbrowska', 'Robert Wabich', 'Sebastian Stankiewicz', 'Agnieszka Czekańska', 'Jarosław Golec', 'Julia Kostow', 'Jan Kwieciński', 'Bartosz M. Kowalski', 'Jan Kwieciński', 'Mirella Zaradkiewicz']"
Making the Witcher,6.8,,"['Animation', 'Documentary']",2020,"['Adaptation', 'Based on Books']",America,Netflix,,PT32M,"Journey into the extraordinary world of ""The Witcher"" — from casting the roles to Jaskier's catchy song — in this behind-the-scenes look at the series. Go behind the monsters, the ballads and every bit of magic that went into bringing The Witcher's Continent to life.Making the Witcher featuring Henry Cavill and Joey Batey is streaming with subscription on Netflix. It's an animation and documentary movie with a better than average IMDb audience rating of 6.8 (448 votes).",Nathan Wiley,"['Henry Cavill', 'Joey Batey', 'Anya Chalotra', 'Freya Allan', 'Lauren Schmidt', 'Tomek Baginski', 'Eamon Farren', 'Adam Levy', 'Mimi Ndiweni', 'MyAnna Buring', 'Sneha Koorse', 'Declan De Barra', 'Beau DeMayo', 'Andrew Laws', 'Simon Emanuel', 'Iván Pohárnok', 'Tim Aslam', 'Charlotte Brändström', 'Jodhi May', 'Emma Appleton', 'Anna Shaffer', 'Charlotte Pidington', 'Nathan Wiley', 'Sean Hill', 'Tony Samuels']"
Tom Segura: Ball Hog,7.3,,"['Stand-up & Talk', 'Comedy']",2020,[],America,Netflix,18+ (R),PT1H10M,"Tom Segura scores laughs with uncomfortably candid stories about mothers, fathers, following your dreams — and other things you'd rather not think about.Tom Segura: Ball Hog featuring Tom Segura is streaming with subscription on Netflix. It's a Comedy and Stand up & Talk movie with a better than average IMDb audience rating of 7.3 (2,889 votes).",Rami Hachache,"['Tom Segura', 'Brady Nasfell', 'Tom Segura', 'Anthony Giordano', 'Josh Lieberman', 'Jud Franklin', 'Tom Segura']"
