Title,IMDB_Rating,Reelgood_Rating,Genres,Year,Tags,Country,Source,Rated,Duration,Description,Director,Employees
Tamika & Tammie,6.8,,['Drama'],2018,[],,Free Services,,,"When ski masks and a gun brings two strangers together Tamika and Tammie becomes friends with a common goal getting to that bag.Tamika & Tammie is free on Tubi, and available for rent on Prime Video. It's a drama movie with a better than average IMDb audience rating of 6.8 (5 votes).",,[]
False Alarm,7,,['Documentary'],2021,[],,Free Services,,PT53M,"The surreal, traumatic, and revelatory fallout from the morning when everyone on Hawai'i thought a nuclear missile was imminent.False Alarm is free on Tubi, and available for rent or purchase on Prime Video. It's a documentary movie with a better than average IMDb audience rating of 7.0 (6 votes).",,[]
Please Come With Me,4.7,,"['Drama', 'Romance']",2018,[],,Free Services,,PT1H32M,"In this exploration of love, commitment, and trust, a long-time couple is forced to navigate the delicate waters of their relationship and the life-changing events they experience over the course of a year.Please Come With Me featuring Brock Kelly and Sara Lindsey is free on Tubi, free on PlutoTV, free on The Roku Channel, and 1 other. It's a drama and romance movie with a less than average IMDb audience rating of 4.7 (184 votes).",Michael Ciulla,"['Brock Kelly', 'Sara Lindsey']"
Craters of the Moon,5.6,,"['Drama', 'Horror']",2013,[],,,18+ (R),PT1H17M,"A young couple on a cross-country road trip lose their way in a blizzard and wind up stranded in the middle of nowhere. As the days pass, their relationship slowly deteriorates, leading to the film's chilling climax.Craters of the Moon is available for rent or purchase on Prime Video. It's a drama and horror movie with an average IMDb audience rating of 5.6 (220 votes).",,[]
Christmas by Chance,6,,"['Romance', 'Comedy']",2021,"['Christmas', 'Holiday']",Canada,,All (G),PT1H24M,"A wealthy and popular entrepreneur hires Chance Hazelton, owner of a struggling shop called Gifts by Chance, to help him organize a perfect proposal for his girlfriend.Christmas by Chance featuring Winny Clarke and Jacob Blair is available for rent or purchase on Prime Video. It's a comedy and romance movie with an average IMDb audience rating of 6.0 (255 votes).",Andrew Cymek,"['Winny Clarke', 'Jacob Blair', 'Neil Whitley', 'Alys Crocker', 'Celeste Desjardins', 'Celine Tsai', 'Sharjil Rasool', 'Latoya Webb', 'Bérangère Rochet', 'Brigitte Kingsley', 'Patrick McBrearty', 'Andrew Cymek', 'Brigitte Kingsley', 'Patrick McBrearty', 'Brigitte Kingsley']"
Adventures in Christmasing,6.5,,['Drama'],2021,[],,,,PT1H27M,"Parker Baldwin finds her Christmas plans upended when her network persuades her to spend three days in the wild with survivalist Finn Holt for a holiday television event.Adventures in Christmasing featuring Kim Fields and Adrian Holmes is available for rent or purchase on iTunes, available for rent or purchase on Google Play, available for purchase on Prime Video, and 2 others. It's a drama movie with an average IMDb audience rating of 6.5 (77 votes).",Troy Scott,"['Kim Fields', 'Adrian Holmes', 'Kel Mitchell', 'Jonathan Silverman', 'Art Rutter', 'Kim Fields', 'Rhonda Baraka']"
Labyrinthus: The Way of Not Being,5.1,,['Drama'],2021,[],,,,PT2H25M,"Labyrinthus ""THE WAY OF NON-BEING Deductions 1) This is a film that was born and developed in the spirit and in the perspective of not paying duty to any genre, understood as a cliché, but we can say that recognizing in its plot a sort of sacrificial plant could approach (derivatively) the classic genre of tragedy (Euripides in particular, which shares a certain impiety, in addition to the marked philosophical warping). Closer to home, because of its sacrificial (tragic) structure, I would liken it as a ""genre"" to ""The Seventh Seal"" or ""Meet Joe Black"", in which death is, respectively, externalized and internalized, but still acts with the aim of obtaining the sacrifice due to it. 2) In our intentions it would be the first step of a dialectical trilogy (that's what I think we'll call it in the end), through which we represent the external life/death splitting. This would be followed by the inner splitting (""we are and we are not what we were before""), set in the era of COVID, and finally by a kermis in four distinct episodes (two realistic and two surreal), coagulated around the idea of a spectator unaware of the fact that he is, himself, an element of the ""show"" he is witnessing, and this last step would be understood as that of reunification, determined by a sort of aesthetic self-motion (the three films, precisely). 3) The film opens with a passage from Parmedides (from the ""Poem on Nature""), and this is the source of its title. In our intentions, the film is also an open disavowal of Parmenides himself, in the sense that non-being (death, appearance) can at least be represented by drawing on an internal apperception. The sentence pronounced at the end of Riccardo's character ("" If the living and the dead could meet, no one would believe in the existence of God"") is not to be understood as a trivial hypothesis of denial of God himself (who can affirm or deny with certainty the existence? ) but it is nothing more than the transposition, in synthesis, of the synesthesia proposed by the film: that is, the contextual perception of life and death interacting with each other; and therefore should be understood in the sense that, if we admit to perceive and share a synesthetic reality (made of real plus unreal) it would no longer make sense to search for a unity external to thought. 4) The ""Way of non-being"" is the beginning of simultaneous perception (life/death, reality/appearance) or the synaesthetic way. It is also the way of critical consciousness that came out of Kantian irremediable dualism and landed in Hegel. On this path, it is possible to draw knowledge. On the other hand, understood in its aspect of ""visual art"", the film exhibits that imponderable which, not by chance, in impressionistic painting was externalized by light (the material source of cinema itself) and is now drawn within and represented as a gap in consciousness. 5) The structure of the film is at the same time a labyrinth and a red thread to get out of it (synesthesia also in this). The unknown of the sense is the enigma to be unveiled (the minotuar to be killed) and the labyrinthine structure is the result of a montage remade four times, always in a different way until the final one; the montage itself is the solution of the enigma, as a sort of its dialectical solution. In order to better understand it, we can compare the film to other works such as ""The Cube"" or ""Saw-The Riddler"", in which the labyrinth is all externalized, and the solution of the enigma is entrusted to the characters (most of whom succumb), with the difference that we have overturned exactly those scenic devices: the labyrinth is all interior, perceptive, or rather it is in the sole perception of the spectator or of the addressee, and not of the characters, because it is the spectator who is dispersed in rivulets and accesses that include images, dialogues and memories, all included in that ball that, as the narration proceeds, unravels little by little until the final solution, and the characters simply undergo that inexorable (tragic) unfolding. In other words: the film is a labyrinth that places at its center an enigma, its ""minotaur"", and the enigma is revealed as the ball of memory is unraveled. The title of the film was in fact ""The final color of the soul"", intended as the memory (the final color) that remains in the dead (hence the final reading of the passage from Plato's ""Republic"", and more precisely from the account of the myth of Er) but which is then diluted by drinking the water of the river Amelete to erase it and reincarnate. The editing of our film is the unraveling of that ball of yarn and thus resolves the labyrinthine enigma, that is, it erects the sense of the story, which is a search for the sense of death.Labyrinthus: The Way of Not Being is available for rent or purchase on Prime Video. It's a drama movie with a less than average IMDb audience rating of 5.1 (34 votes).",,[]
Hranica,7.5,,"['Drama', 'Documentary']",2011,[],,fuboTV,,PT1H12M,"A documentary about a village that was during one night in 1947 separated by force into a Soviet and a Czechoslovak part in a way, that the border runs through the middle of the village, separating properties and families.Hranica is streaming with subscription on fuboTV. It's a documentary and drama movie with a better than average IMDb audience rating of 7.5 (53 votes).",,[]
A Christmoose Story,6.2,,"['Action & Adventure', 'Drama']",2013,"['Christmas', 'Holiday']",Netherlands,Hoopla,,PT1H20M,"Based on the best-selling novel, A CHRISTMOOSE STORY brings to life the tale of an unlikely friendship between a young boy and a large, talking moose. Young Max has low expectations for his first Christmas after his parents’ divorce, when suddenly a large moose crashes through the roof of his garage. And if that isn’t strange enough, the moose claims to have fallen from Santa’s sleigh! But being friends with a moose isn’t all that simple. Especially since Max’s grumpy neighbor has no interest in hanging stockings for Christmas but would love to hang up a pair of moose antlers, and Santa is out there somewhere looking to get his sleigh back!A Christmoose Story featuring Derek de Lint and Jelka van Houten is streaming with subscription on Hoopla, available for rent or purchase on iTunes, available for rent or purchase on Prime Video, and 1 other. It's an action & adventure and drama movie with an average IMDb audience rating of 6.2 (308 votes).",Lourens Blok,"['Derek de Lint', 'Jelka van Houten', 'Jeroen van Koningsbrugge', 'Arjan Ederveen', 'Dana Goldberg', 'Carla Hardy', 'Carla Hardy', 'Dennis Reinsma', 'Joost de Vries', 'Clea de Koning']"
4/20,7.7,,"['Drama', 'Comedy']",2020,['Drug'],America,Free Services,13+ (PG-13),PT1H29M,"As 4/20 begins, a dispensary owner launches into a day of haphazard activities he hopes will spark new business and keep his struggling store afloat. His biggest threat is a wide-eyed drug dealer hoping to reclaim the local cannabis business. Meanwhile, a trio of soon-to-be high school graduates try to scheme their way in to buy enough weed to properly toast their long-lasting friendship. And as two potential lovers struggle to align their views on pot, an elderly woman strikes up an odd friendship with a young immigrant with a secret. All the while, an edibles chef strives to impress her disapproving family with her burgeoning food truck. On this glorious holiday, people across life's spectrum will find they have more in common than just a love of herb.4/20 featuring K.C. Clyde and Nanrisa Lee is free on Tubi, and available for rent or purchase on Prime Video. It's a comedy and drama movie with a high IMDb audience rating of 7.7 (23 votes).",Noah Applebaum,"['Teri Fruichantie', 'K.C. Clyde', 'Nanrisa Lee', 'Koala Puffs', 'Audrey Whitby', 'Suraj Partha', 'Vivian Lamolli', 'Marlo Bernier', 'Kassim Osgood', 'Raury Rolander', 'Iman Crosson', 'Natasha Hall', 'Stephen Peace', 'Noah Applebaum', 'Blake Boyd', 'Scott Parkin', 'Joey Bragg', 'Bradford Downs', 'Brad T. Gottfred', 'Corey Moss', 'Jason Wiles', 'Kevin Bloom', 'Stephen Peace', 'Abraham Nseir', 'Andy Bailey', 'Michael Masukawa', 'Milan Chakraborty', 'Noah Applebaum', 'Sahil Lavingia', 'Seth Laderman', 'Andy Bailey']"
Reality Bites,6.6,,"['Romance', 'Comedy']",1994,"['Feel-good', 'College', 'Friendship']",America,Free Services,13+ (PG-13),PT1H39M,"A small circle of friends suffering from post-collegiate blues must confront the hard truth about life, love and the pursuit of gainful employment. As they struggle to map out survival guides for the future, the Gen-X quartet soon begins to realize that reality isn't all it's cracked up to be.Reality Bites featuring Winona Ryder and Ethan Hawke is free on Tubi, available for rent or purchase on iTunes, available for rent or purchase on Prime Video, and 2 others. It's a comedy and drama movie with an average IMDb audience rating of 6.6 (49,390 votes).",Ben Stiller,"['Winona Ryder', 'Ethan Hawke', 'Janeane Garofalo', 'Steve Zahn', 'Ben Stiller', 'Swoosie Kurtz', ""Harry O'Reilly"", 'Susan Norfleet', 'Joe Don Baker', 'Renée Zellweger', 'James Rothenberg', 'John Mahoney', 'Eric Morgan Stuart', 'Barry Del Sherman', 'Chelsea Lagos', 'Bill Bolender', 'Helen Childress', 'David Pirner', 'Andy Dick', 'Keith David', 'Anne Meara', 'Danny DeVito', 'Michael Shamberg', 'Stacey Sher', 'Wm. Barclay Malcolm', 'Helen Childress']"
Moonlight,7.4,,"['LGBTQ', 'Drama']",2016,"['Coming of Age', 'Drug', 'High School']",United Kingdom,Hoopla,18+ (R),PT1H51M,"The tender, heartbreaking story of a young man’s struggle to find himself, told across three defining chapters in his life as he experiences the ecstasy, pain, and beauty of falling in love, while grappling with his own sexuality.Moonlight featuring Trevante Rhodes and André Holland is streaming with subscription on fuboTV, streaming on Showtime, streaming with subscription on Hoopla, and 5 others. It's a drama and LGBTQ movie with a better than average IMDb audience rating of 7.4 (300,948 votes).",Barry Jenkins,"['Trevante Rhodes', 'André Holland', 'Janelle Monáe', 'Ashton Sanders', 'Jharrel Jerome', 'Alex Hibbert', 'Jaden Piner', 'Naomie Harris', 'Mahershala Ali', 'Shariff Earp', 'Duan Sanderson', ""Herman 'Caheej' McGloun"", 'Kamal Ani-Bellow', 'Keomi Givens', 'Eddie Blanchard', 'Rudi Goblen', 'Edson Jean', 'Patrick Decile', 'Herveline Moncion', 'Fransley Hyppolite', 'Jesus Mitchell', 'Adele Romanski', 'Dede Gardner', 'Jeremy Kleiner', 'Brad Pitt', 'Sarah Esberg', 'Tarell Alvin McCraney', 'Barry Jenkins', 'Nicholas Britell']"
Amityville Horror House,6.3,,['Documentary'],2021,[],,Discovery+,16+,PT1H24M,"A horrific crime. A hellish evil. The story of the Amityville Horror house rocked the world. Real footage from within its blood-soaked walls and never-before-seen interviews reveal frightening new secrets about one of America's most enthralling haunts.Amityville Horror House featuring Jeff Belanger and Anthony D. Call is streaming with subscription on fuboTV, and streaming with subscription on Discovery+. It's a documentary movie with an average IMDb audience rating of 6.3 (136 votes).",Jeff Belanger,"['Anthony D. Call', 'Ronald DeFeo', 'Laura DiDio', 'Jason Hawes', 'Mary Pascarella', 'Alberta Riley', 'Rikki Rockett', 'Jerry Solfvin', 'Sandor Stern', 'Eric Walter', 'TIm Yancey', 'Kenneth Jones']"
The Long Night,3.5,,['Horror'],2022,[],America,Hoopla,18+ (R),PT1H31M,"A devoted couple's quiet weekend takes a bizarre turn when a nightmarish cult and their maniacal leader come to fulfill an apocalyptic prophesy.The Long Night featuring Scout Taylor-Compton and Nolan Gerard Funk is streaming with subscription on Hoopla, available for rent or purchase on iTunes, available for rent or purchase on Prime Video, and 2 others. It's a horror movie with a low IMDb audience rating of 3.5 (1,105 votes).",Rich Ragsdale,"['Scout Taylor-Compton', 'Nolan Gerard Funk', 'Deborah Kara Unger', 'Jeff Fahey', 'Kevin Ragsdale', 'King Orba', 'Erika Stasiuleviciute', 'Juniper Ghazi', 'Rocco Bovo', 'Daemon Hillin', 'Martin Sprock', 'Ryan R. Johnson', 'Vasily Bernhardt', 'Dave Lugo', 'Dorin Pavelescu', 'Ellen S. Wander', 'Jordan Dykstra', 'Petru Jelihovschi', 'Taras Shydlyk', 'Valentin Opalev', 'Wes Hull', 'Mark Young', 'Robert Sheppe']"
The Unforgivable,7.1,,"['Thriller', 'Drama']",2021,['Religion'],Germany,Netflix,18+ (R),PT1H52M,"A woman is released from prison after serving a sentence for a violent crime and re-enters a society that refuses to forgive her past.The Unforgivable featuring Sandra Bullock and Viola Davis is streaming with subscription on Netflix. It's a drama and thriller movie with a better than average IMDb audience rating of 7.1 (102,728 votes).",Nora Fingscheidt,"['Sandra Bullock', 'Viola Davis', ""Vincent D'Onofrio"", 'Jon Bernthal', 'Richard Thomas', 'Linda Emond', 'Aisling Franciosi', 'Emma Nelson', 'Will Pullen', 'Tom Guiry', 'Jessica McLeod', 'Rob Morgan', 'Andrew Francis', 'W. Earl Brown', 'Orlando Lucas', 'Jude Wilson', 'Paul Moniz de Sa', 'Craig March', 'Alistair Abell', 'Donavon Stinson', 'Patti Kim', 'Graham King', 'Sandra Bullock', 'Veronica Ferres', 'Colin Vaines', 'Nan Morales', 'Nicola Shindler', 'Sally Wainwright', 'Courtenay Miles', 'Hillary Seitz', 'Peter Craig', 'Dave Fleming', 'Hans Zimmer']"
Fortress,3.4,,"['Action & Adventure', 'Thriller']",2021,[],America,Free Services,18+ (R),PT1H40M,"The story revolves around a top-secret resort for retired U.S. intelligence officers. A group of criminals led by Balzary breach the compound, hellbent on revenge on Robert, forcing the retired officer and his son to save the day.Fortress featuring Leslee Emmett and Bruce Willis is free on Tubi, available for rent or purchase on iTunes, available for rent or purchase on Prime Video, and 2 others. It's an action & adventure and thriller movie with a low IMDb audience rating of 3.4 (3,632 votes).",James Cullen Bressack,"['Leslee Emmett', 'Bruce Willis', 'Katalina Viteri', 'Shannen Doherty', 'Chad Michael Murray', 'Kaleina Cordova', 'Kelly Greyson', 'Jesse Metcalfe', 'Natalie Burn', 'Sean Kanan', ""Ser'Darius Blain"", 'James Cullen Bressack', 'Simon Phillips', 'Trae Ireland', 'Michael Sirow', 'Luis Da Silva Jr.', 'Eric West', 'John D. Hickman', 'Canyon Prince', 'Daniel Salinas', 'Chad A. Verdi', 'George Furla', 'Luillo Ruiz', 'Randall Emmett', 'Chad A. Verdi Jr.', 'Danny H. Chan', ""Nick D'Angelo"", 'Tim Sullivan', 'Alan Horsnail']"
Germany from Above,7.1,,['Documentary'],2012,[],Germany,Free Services,7+ (PG),PT1H50M,"This fly-over features Germany filmed from helicopters and small airplanes. Footage was released as a multi-episode tv series over several years and this feature-length movie.Germany from Above featuring Benjamin Völz is free on PlutoTV, free on Freevee (Via Prime Video), streaming with subscription on XiveTV (Via Prime Video), and 1 other. It's a documentary movie with a better than average IMDb audience rating of 7.1 (121 votes).",Freddie Röckenhaus,"['Petra Höfer', 'Benjamin Völz', 'Freddie Röckenhaus', 'Petra Höfer', 'Freddie Röckenhaus', 'Petra Höfer', 'Boris Salchow']"
42,7.5,,"['Biography', 'Drama']",2013,"['Based On True Story', 'Feel-good', 'Sports']",America,HBO MAX,13+ (PG-13),PT2H8M,"The powerful story of Jackie Robinson, the legendary baseball player who broke Major League Baseball’s color barrier when he joined the roster of the Brooklyn Dodgers. The film follows the innovative Dodgers’ general manager Branch Rickey, the MLB executive who first signed Robinson to the minors and then helped to bring him up to the show.42 featuring Chadwick Boseman and Harrison Ford is streaming with subscription on Netflix, streaming with subscription on HBO MAX, available for rent or purchase on iTunes, and 4 others. It's a biography and drama movie with a better than average IMDb audience rating of 7.5 (93,838 votes).",Brian Helgeland,"['Chadwick Boseman', 'Harrison Ford', 'Nicole Beharie', 'Christopher Meloni', 'Ryan Merriman', 'Lucas Black', 'André Holland', 'Alan Tudyk', 'Hamish Linklater', 'T.R. Knight', 'John C. McGinley', 'Toby Huss', 'Max Gail', 'Brad Beyer', 'James Pickens Jr.', 'Gino Anthony Pesi', 'Brett Cullen', 'Jesse Luken', 'Jamey Holliday', 'Derek Phillips', 'Jamie Ruehling', 'Thomas Tull', 'Dick Cook', 'Jason Clark', 'Jon Jashni', 'Brian Helgeland', 'Mark Isham']"
Maze Runner: The Death Cure,6.2,,"['Science-Fiction', 'Thriller']",2018,"['Survival', 'Based on Books', 'Video Games']",America,fuboTV,13+ (PG-13),PT2H23M,"Thomas leads his group of escaped Gladers on their final and most dangerous mission yet. To save their friends, they must break into the legendary Last City, a WCKD-controlled labyrinth that may turn out to be the deadliest maze of all. Anyone who makes it out alive will get answers to the questions the Gladers have been asking since they first arrived in the maze.Maze Runner: The Death Cure featuring Dylan O'Brien and Kaya Scodelario is streaming with subscription on fuboTV, free on Freevee (Via Prime Video), available for rent or purchase on iTunes, and 3 others. It's an Action & Adventure and Science Fiction movie with an average IMDb audience rating of 6.2 (134,084 votes).",Wes Ball,"[""Dylan O'Brien"", 'Kaya Scodelario', 'Thomas Brodie-Sangster', 'Ki Hong Lee', 'Rosa Salazar', 'Giancarlo Esposito', 'Will Poulter', 'Jacob Lofland', 'Patricia Clarkson', 'Aidan Gillen', 'Walton Goggins', 'Dexter Darden', 'Katherine McNamara', 'Nathalie Emmanuel', 'Barry Pepper', 'Dylan Smith', 'Jake Curran', 'Dylan Kriek', 'Scot Cooper', 'Kazi Maubert', 'Bart Fouche', 'Ellen Goldsmith-Vein', 'Joe Hartwick Jr.', 'Lee Stollman', 'Marty Bowen', 'Wes Ball', 'Wyck Godfrey', 'Lorenzo Di Bonaventura', 'James Dashner', 'T.S. Nowlin', 'John Paesano']"
The Virgin Suicides,7.2,,"['Romance', 'Drama']",1999,"['Teen', 'Adaptation', 'Female Director']",America,fuboTV,18+ (R),PT1H37M,"A group of male friends become obsessed with five mysterious sisters who are sheltered by their strict, religious parents.The Virgin Suicides featuring Kirsten Dunst and James Woods is streaming with subscription on Prime Video, streaming on Paramount+, streaming with subscription on fuboTV, and 5 others. It's a drama and romance movie with a better than average IMDb audience rating of 7.2 (153,000 votes).",Sofia Coppola,"['Kirsten Dunst', 'James Woods', 'Kathleen Turner', 'Josh Hartnett', 'A.J. Cook', 'Leslie Hayman', 'Hanna Hall', 'Jonathan Tucker', 'Hayden Christensen', 'Danny DeVito', 'Scott Glenn', 'Chelse Swain', 'Michael Paré', 'Joe Dinicol', 'Noah ""40"" Shebib', 'Anthony DeSimone', 'Lee Kagan', 'Robert Schwartzman', 'Kristin Fairlie', 'Giovanni Ribisi', 'Andrew Gillies', 'Chris Hanley', 'Dan Halsted', 'Francis Ford Coppola', 'Julie Costanzo', 'Fred Fuchs', 'Willi Bär', 'Jeffrey Eugenides', 'Sofia Coppola', 'Air']"
Heart of Arizona,6.5,,['Romance'],1938,[],America,Free Services,,PT1H8M,"Belle Starr has returned from time in prison only to face a hail of bullets, along with rescue by Hoppy and the Bar 20 gang.Heart of Arizona featuring William Boyd and George 'Gabby' Hayes is free on Tubi. It's a romance movie with an average IMDb audience rating of 6.5 (193 votes).",Lesley Selander,"['William Boyd', ""George 'Gabby' Hayes"", 'Russell Hayden', 'John Elliott', 'Billy King', 'Natalie Moorhead', 'Dorothy Short', 'Stephen Chase', 'John Beach', 'Lane Chandler', 'Leo J. McMahon', 'Robert McKenzie', 'Lee Phelps', 'Wen Wright', 'Norman Houston']"
Inquiring Nuns,7.5,,['Documentary'],1968,[],,Fandor,,PT1H0M,"Two nuns travel across Chicago asking people the question, ""Are you happy?""Inquiring Nuns is streaming on Fandor. It's a documentary movie with a better than average IMDb audience rating of 7.5 (42 votes).",Gerald Temaner,"['Gordon Quinn', 'Philip Glass']"
Until We Meet Again,4.6,,"['Drama', 'Romance']",2022,[],America,,,PT1H31M,"A woman finds her new house is haunted by the ghost of a young pianist.Until We Meet Again featuring Jackson Rathbone and Janel Parrish is available for rent or purchase on iTunes, available for rent or purchase on Google Play, available for rent or purchase on Prime Video, and 2 others. It's a drama and romance movie with a less than average IMDb audience rating of 4.6 (185 votes).",Pece Dingo,"['Jackson Rathbone', 'Janel Parrish', 'Michael Madsen', 'Leslie Jordan', 'LeToya Luckett', 'Antonio Fargas', 'Justin Gaston', 'Jennifer Bassey']"
The Daughter,4.5,,"['Drama', 'Thriller']",2013,[],,Free Services,,PT1H26M,"In this gripping suspense-thriller, the daughter of a wealthy mayoral candidate and her friends are held for ransom by a group of daring criminals. Soon, as tempers flare and tension mounts, secrets rise to the surface revealing that these kidnappers are after much more than money.The Daughter featuring Marian Sorensen and Kevin McCorkle is free on Tubi, free on The Roku Channel, and available for rent or purchase on VUDU. It's a drama and thriller movie with a less than average IMDb audience rating of 4.5 (191 votes).",Jonathan M. Levine,"['Marian Sorensen', 'Kevin McCorkle', 'Drew Howerton', 'Michael Teh', 'Brianna Michelle Parcel', 'Joe Sofranko', 'Ray Chase', 'Jonathan M. Levine']"
Sausage Party,6.1,,"['Animation', 'Comedy']",2016,"['Feel-good', 'Parody', 'Cartoon']",Canada,fuboTV,16+,PT1H29M,"Frank leads a group of supermarket products on a quest to discover the truth about their existence and what really happens when they become chosen to leave the grocery store.Sausage Party featuring Seth Rogen and Kristen Wiig is streaming with subscription on fuboTV, available for rent or purchase on iTunes, available for purchase on Google Play, and 3 others. It's an animation and comedy movie with an average IMDb audience rating of 6.1 (191,027 votes).",Conrad Vernon,"['Greg Tiernan', 'Seth Rogen', 'Kristen Wiig', 'Jonah Hill', 'Bill Hader', 'Michael Cera', 'James Franco', 'Danny McBride', 'Craig Robinson', 'Paul Rudd', 'Nick Kroll', 'David Krumholtz', 'Edward Norton', 'Salma Hayek', 'Anders Holm', 'Scott Underwood', 'Sugar Lyn Beard', 'Conrad Vernon', 'Ian James Corlett', 'Michael Daingerfield', 'Jason Simpson', 'Vincent Tong', 'Conrad Vernon', 'Evan Goldberg', 'Megan Ellison', 'Seth Rogen', 'Ariel Shaffir', 'David Distenfeld', 'James Weaver', 'Jonah Hill', 'Kyle Hunter', 'Ariel Shaffir', 'Evan Goldberg', 'Kyle Hunter', 'Seth Rogen', 'Alan Menken', 'Christopher Lennertz']"
