Title,IMDB_Rating,Reelgood_Rating,Genres,Year,Tags,Country,Source,Rated,Duration,Description,Director,Employees
Another Round,7.7,,"['Comedy', 'Drama']",2020,"['Science', 'Friendship', 'Teacher']",Denmark,Kanopy,18+ (R),PT1H57M,"Four high school teachers launch a drinking experiment: upholding a constant low level of intoxication.Another Round featuring Mads Mikkelsen and Thomas Bo Larsen is streaming with subscription on Hulu, streaming with subscription on Hoopla, streaming with subscription on Kanopy, and 5 others. It's a comedy and drama movie with a high IMDb audience rating of 7.7 (143,976 votes).",Thomas Vinterberg,"['Mads Mikkelsen', 'Thomas Bo Larsen', 'Lars Ranthe', 'Magnus Millang', 'Maria Bonnevie', 'Susse Wold', 'Helene Reingaard Neumann', 'Diêm Camille G.', 'Martin Greis', 'Albert Rudbeck Lindhardt', 'Frederik Winther Rasmussen', 'Morten Thunbo', 'Dorte Højsted', 'Michael Asmussen', 'Cassius Aasav Browning', 'Christiane Gjellerup Koch', 'Magnus Sjørup', 'Silas Cornelius Van', 'Aksel Vedsegaard', 'Aya Grann', 'Gustav Sigurth Jeppesen', 'Kasper Dissing', 'Sisse Graum Jørgensen', 'Thomas Vinterberg', 'Tobias Lindholm']"
Making Time,5.6,,"['Romance', 'Action & Adventure']",2020,[],,Free Services,,PT1H30M,"After traveling back in time, a divorced workaholic must repeat his past footsteps in order to return to an unaltered present, but struggles when it means re-proposing to his ex-wife.Making Time is free on Tubi, free on The Roku Channel, and available for rent or purchase on Prime Video. It's an action & adventure and romance movie with an average IMDb audience rating of 5.6 (179 votes).",,[]
The Diamond Wizard,5.6,,"['Thriller', 'Drama']",1954,['Police'],United Kingdom,,,PT1H23M,"While in London trying to nab several fugitives who stole a million dollars from a U.S. Treasury vault, American federal agent Dennison (Dennis O'Keefe) assists Scotland Yard Insp. McClaren (Philip Friend) in his search for a missing atomic scientist (Paul Hardtmuth). The detective duo discovers that the key to solving both cases may rest with the scientist's daughter (Margaret Sheridan) and her fascinating diamond.The Diamond Wizard featuring Dennis O'Keefe and Margaret Sheridan is available for rent or purchase on Prime Video. It's a drama and thriller movie with an average IMDb audience rating of 5.6 (138 votes).",Dennis O'Keefe,"['Montgomery Tully', ""Dennis O'Keefe"", 'Margaret Sheridan', 'Philip Friend', 'Alan Wheatley', 'Francis de Wolff', 'Eric Berry', 'Gudrun Ure', 'John C. Higgins']"
The Great Diamond Robbery,5.9,,"['Comedy', 'Crime']",1954,[],America,,,PT1H10M,"Ambrose C. Park, left on a park bench as an infant with an impulsive need to find his parents, is an assistant to a diamond cutter. Shyster lawyer Remlick, in a strategy to get a fabulous uncut diamond through Ambrose, arranges for Emily Drummon, Duke Fargoh and Maggie Drummon to pose as Ambrose's long-lost parents and sister. The diamond, through many comic situations, is acquired and the gang is going to have Ambrose cut the diamond, and relieve him of the two stones and his parental illusions at the same time. But Maggie, who has no taste for the deception, tips Ambrose off and a wild chase ensues. At the end, Ambrose is very happy as he can now marry his ""sister.""The Great Diamond Robbery featuring Red Skelton and Cara Williams is available for rent or purchase on Prime Video. It's a comedy and crime movie with an average IMDb audience rating of 5.9 (245 votes).",Robert Z. Leonard,"['Red Skelton', 'Cara Williams', 'James Whitmore', 'Kurt Kasznar', 'Dorothy Stickney', 'George Mathews', 'Reginald Owen', 'Harry Bellaver', 'Connie Gilchrist', 'Steven Geray', 'Sig Arno', 'G. Pat Collins', 'Jean Fenwick', 'Ed Fury', 'William Haade', 'Jack Kruschen', 'Anna Q. Nilsson', 'Stuart Randall', 'Olan Soule', 'Robert Stevenson', 'Max Wagner', 'László Vadnay', 'Martin Rackin']"
Braaap 13: Buried,7.1,,"['Mystery', 'Thriller']",2013,[],,Free Services,18+ (R),PT54M,"This year, Braaap Films takes a look into a new kind of back country adventure, ""The Snowbike"". With huge drops, neck deep powder, and some insane lines, the Timbersled Mountain Kit will be performing some maneuvers never before thought possible on snow. Braaap 13: Buried, will please every type of back country enthusiast. From the deep mountain slopes of BC, you can witness some of the year's deepest snow and death-defying avalanches, to Alaska, where you can see some new faces throwing down ""AK style"". We head to Aspen, the stomping grounds of the X-Games riders, with Daniel Bodin and Levi Lavallee, and feature a special tribute to Caleb and Colten Moore. Many more locations and exciting adventures await! Join us in the steep and deep, the high and dry, and get....BURIED!!!Braaap 13: Buried featuring Reagan Sieg and Caleb Moore is free on Tubi, free on Plex, free on VUDU, and 2 others. It's a mystery and thriller movie with a better than average IMDb audience rating of 7.1.",Jaya Lange,"['Reagan Sieg', 'Caleb Moore', 'Colten Moore', 'Wes Sandoval', 'Daniel Bodin']"
"Chiapas, El Corazón del Café",4.1,,"['Drama', 'Romance']",2012,[],,Free Services,,PT1H40M,"In 1824, John McGee, an English adventurer, arrived in the Soconusco area of Chiapas with his young wife. There, they sought to fulfill their dream of prosperity and become the first producers of coffee. Upon reaching Chiapas, they discovered that the state had seceded from the rule of Guatemala, plunging into an interim and anarchic government that lasted for 18 years. During this time, John saw his dream frustrated and was forced to seek refuge at his own farm under the protection of the clergy. The dowry of his daughter Isabel becomes his last chance to make his dream come true, as he negotiates with Geronimo and Julian, sellers of coffee plants and slaves, respectively. In the midst of the beauty and hostility of the jungle, a story of love and betrayal emerges, framing the arrival of coffee to Chiapas.Chiapas, El Corazón del Café featuring Hugo Speer and Jaime Camil is free on Tubi. It's a drama and romance movie with a low IMDb audience rating of 4.1 (121 votes).",Alejandro González Padilla,"['Hugo Speer', 'Jaime Camil', 'Carmen Aub', 'Juan Ignacio Aranda', 'Sammy Samir', 'Mónica Huarte', 'Manuel Balbi', 'Bárbaro Marín', 'Isabella Roch', 'Maria de la Fuente', 'Myriam Bravo', 'Horacio García Rojas', 'Alejandro González Padilla']"
The Sheepdogs Have at It,7.5,,['Documentary'],2013,[],Canada,,,PT1H30M,Canadian band The Sheepdogs attempt to follow their sudden rise from obscurity with a worthy second album.The Sheepdogs Have at It is available for rent or purchase on Google Play. It's a documentary movie with a better than average IMDb audience rating of 7.5 (31 votes).,John Barnard,[]
Turnabout,6.2,,"['Fantasy', 'Comedy']",1940,[],America,Philo,,PT1H23M,Bickering husband and wife Tim and Sally Willows mutter a few angry words to a statue of Buddha and wind up living each other's life.Turnabout featuring Adolphe Menjou and Carole Landis is streaming with subscription on Philo. It's a comedy and fantasy movie with an average IMDb audience rating of 6.2 (720 votes).,Hal Roach,"['Adolphe Menjou', 'Carole Landis', 'John Hubbard', 'William Gargan', 'Verree Teasdale', 'Mary Astor', 'Donald Meek', 'Joyce Compton', 'Inez Courtney', 'Franklin Pangborn', 'Marjorie Main', 'Berton Churchill', 'Margaret Roach', 'Ray Turner', 'Norman Budd', 'Polly Ann Young', 'Eleanor Riley', 'Murray Alper', 'Miki Morita', 'Yolande Donlan', 'Georges Renavent', 'Berne Giler', 'John McClain', 'Mickell Novack']"
Alleged Gangster,4.7,,['Crime'],2013,[],,,,PT1H20M,Mobster Rudy Wright rises to the top of the Los Angeles underworld.Alleged Gangster is available for rent or purchase on Prime Video. It's a crime movie with a less than average IMDb audience rating of 4.7 (11 votes).,,[]
Agnus Dei,4.9,,"['Drama', 'Family']",2012,[],,Free Services,,PT1H51M,"Based on a true story, Agnus Dei is a kind of Oedipus of our days. Peter must find his way to redemption. But the past will make itself known and fate sparingly gives mercy. Can he save himself, or even be saved at all?Agnus Dei featuring Dafina Berisha and Astrit Alihajdaraj is free on Tubi, and free on The Roku Channel. It's a drama and family movie with a less than average IMDb audience rating of 4.9 (196 votes).",Agim Sopi,"['Dafina Berisha', 'Astrit Alihajdaraj', 'Zhaklina Oshtir', 'Enver Petrovci', 'Çun Lajçi', 'Lumnie Sopi', 'Agron Shala', 'Aurita Agushi', 'Blerim Gjoci', 'Bajrush Mjaku', 'Agim Sopi']"
Criminal Behavior,7,,['Drama'],2013,[],,,18+ (R),PT1H30M,"A young couple, Nathan and Jewel, are enduring financial and emotional hardship, when past criminal friends re-emerge into their lives and force Nathan to partake in a robbery. Now, he must find a way to stop his past from destroying his future. Written and directed by Warren PembertonCriminal Behavior featuring Usman Sharif and Verina Banks is available for rent or purchase on Prime Video. It's a drama movie with a better than average IMDb audience rating of 7.0 (11 votes).",Warren Pemberton,"['Usman Sharif', 'Verina Banks', 'Sharrieff Pugh', 'Bryant Pearson', 'Kibwe Miller', 'Clifton Powell', 'Mike ""Killer Mike"" Render', 'Courtney Charles', 'Tyrese Felder', 'Nicole Slaughter', 'Courtney Carreras', 'Mel City', 'Billy Allrich', 'Ekow Yankey', 'Usman Sharif', 'Warren Pemberton', 'Michael Teoli']"
Open Cam,4.3,,"['Comedy', 'Drama']",2005,[],America,Free Services,,PT1H39M,"Gay serial killer in Washington, DC uses dating web site to stalk victims.Open Cam featuring Andreau Thomas and Amir Darvish is free on Tubi, and available for rent or purchase on Wolfe. It's a comedy and drama movie with a low IMDb audience rating of 4.3 (368 votes).",Robert Gaston,"['Andreau Thomas', 'Amir Darvish', 'Ben Green', 'Christian Jones', 'Matt Cannon', 'Ryan Thrasher', 'Steven Faurak', 'Vincent Bradberry']"
Chasing Two Hares,8,,"['Musical', 'Comedy']",1961,['Adaptation'],Ukraine,,,PT1H17M,"Based on the Ukrainian vaudeville by Mykhaylo Staritsky, the famous Ukrainian writer. The leading character, Svirid Petrovich Golokhvosty had his own barbershop in town and a reputation of a dandy. Once, after losing everything he had at cards, he decided to remedy his financial situation by a profitable marriage. A rich but ugly girl named Pronya Sirko fell for the illustrious suitor’s courtship...Chasing Two Hares featuring Oleg Borisov and Margarita Krinitsyna is available for rent or purchase on Prime Video. It's a comedy and musical movie with a high IMDb audience rating of 8.0 (970 votes).",Viktor Ivanov,"['Oleg Borisov', 'Margarita Krinitsyna', 'Nikolay Yakovchenko', 'Anna Kushnirenko', 'Nonna Koperzhinskaya', 'Nataliya Naum', 'Anatoliy Yurchenko', 'Konstantin Ershov', 'Taisiya Litvinenko (I)', 'Vyacheslav Voronin', 'Lyudmila Alfimova', 'Mikhail Staritskiy', 'Viktor Ivanov']"
Constraint,6.8,,"['Drama', 'Crime']",2019,[],America,Free Services,,PT1H59M,"While on a redemptive journey to find a missing 6 year old boy, a female grad student crosses path with ruthless human traffickers.Constraint featuring Omar Abbas and Brooklyn Sabino Smith is free on Tubi, free on Freevee (Via Prime Video), free on The Roku Channel, and 1 other. It's a crime and drama movie with a better than average IMDb audience rating of 6.8 (21 votes).",Richard A. Nelson,"['Omar Abbas', 'Brooklyn Sabino Smith', 'Aaron Geib', 'Mason Pryor', 'Maya Sayre', 'Ralph Scott', 'Richard A. Nelson', 'Richard A. Nelson']"
Love You Zindagi,5.6,,['Family'],2019,[],,,,PT2H2M,"Anirudh hates the fact that he is growing old and wants to have fun and enjoy his life to the fullest. He sets out on a quest to explore what he missed in his youth. His life changes, when he meets Riya - a Zumba dance trainer, and her energetic gang. He befriends them to experience the thrill in life and does not care about what the society has to say of his new avatar. However, anything in access can lead to problems. Will Anirudh be able mend his ways, before it's too late?Love You Zindagi featuring Prarthana Behere and Omkar Joshi is available for rent or purchase on Prime Video. It's a family movie with an average IMDb audience rating of 5.6 (22 votes).",Prarthana Behere,"['Omkar Joshi', 'Kavita Lad Medhekar', 'Sachin Pilgaonkar']"
The Legend of Gobi,5.6,,['Action & Adventure'],2018,[],,Free Services,,PT2H38M,"The ruffles king forbids music for his kingdom and gets cursed for it. The king's right hand secretly wishes to take the throne and tries to kill the king, but the cursed king just would not die. Later when the king's right hand figures out how to kill the king and takes over the kingdom. The left-for-dead king gets local's support whom secretly kept practicing the art of music aids the king for the final battle to get the kingdom back from murderous king's right hand.The Legend of Gobi is free on Tubi, free on Freevee (Via Prime Video), and available for rent or purchase on Prime Video. It's an action & adventure movie with an average IMDb audience rating of 5.6 (2,968 votes).",,[]
Silent Country,6.9,,"['Drama', 'Comedy']",1992,[],Germany,Kanopy,,PT1H35M,"A young, naive and enthusiastic theater director named Kai comes to a grim provincial town to put on Beckett's Waiting for Godot. Although the lethargic theater company shows no interest in the play, his spirit remains undaunted.Meanwhile, it is fall 1989. The world is changing and somewhere, far away in the capital, a revolution is taking place and it seems that wishes might come true. Great hopes emerge in the little town and unexpected events overtake Kai's mutating production.Silent Country featuring Thorsten Merten and Jeannette Arndt is streaming with subscription on Kanopy. It's a comedy and drama movie with a better than average IMDb audience rating of 6.9 (118 votes).",Andreas Dresen,"['Thorsten Merten', 'Jeannette Arndt', 'Kurt Böwe', 'Petra Kelling', 'Horst Westphal', 'Katrin Martin', 'Mathias Noack', 'Asad Schwarz', 'Hans-Uwe Bauer', 'Burkhard Heyl', 'Heinz Lyschik', 'Ernst Meincke', 'Hans Jochen Röhrig', 'Wolf-Dieter Lingk', 'Roman Silberstein', 'Wolfgang Pfeiffer', 'Andreas Dresen', 'Laila Stieler']"
Carry On Again Doctor,6.2,,"['Drama', 'Comedy']",1969,['Doctor'],United Kingdom,,,PT1H25M,"Dr Nookey is disgraced and sent to a remote island hospital. He is given a secret slimming potion by a member of staff, Gladstone Screwer, and he flies back to England to fame and fortune. But others want to cash in on his good fortunes, and some just want him brought down a peg or two.Carry On Again Doctor featuring Sid James and Kenneth Williams is available for rent on Prime Video. It's a comedy and drama movie with an average IMDb audience rating of 6.2 (2,782 votes).",Gerald Thomas,"['Sid James', 'Kenneth Williams', 'Charles Hawtrey', 'Jim Dale', 'Joan Sims', 'Barbara Windsor', 'Hattie Jacques', 'Patsy Rowlands', 'Peter Butterworth', 'Elizabeth Knight', 'Alexandra Dane', 'Peter Gilmore', 'Pat Coombs', 'Patricia Hayes', 'William Mervyn', 'Lucy Griffiths', 'Harry Locke', 'Gwendolyn Watts', 'Valerie Leon', 'Frank Singuineau', 'Valerie Van Ost', 'Peter Rogers', 'Talbot Rothwell']"
Summer in the Suburbs,6.2,,"['Drama', 'Crime']",2000,[],,Prime Video,,PT1H26M,"After the body of a 14-year-old girl is found in a field, detective Ted Lyle and his wife Sandra are among local parents caught up in a wave of fear and suspicion. Ted's investigations then uncover a shocking suspect.Summer in the Suburbs featuring Aneirin Hughes and Tessa Peake-Jones is streaming with subscription on Prime Video. It's a crime and drama movie with an average IMDb audience rating of 6.2 (64 votes).",David Attwood,"['Aneirin Hughes', 'Tessa Peake-Jones', 'Ann Mitchell', 'Tony Basgallop']"
Minus One,6.6,,['Drama'],2010,[],,,,PT1H22M,"When three soldiers from am Army Reserve unit are called to fight in the Middle East, they must prepare themselves for the possibility of never returning home.Minus One featuring Jon Osbeck and Amanda Howell is available for rent or purchase on Prime Video. It's a drama movie with an average IMDb audience rating of 6.6 (27 votes).",Jon Osbeck,"['Marc Wiskemann', 'Jon Osbeck', 'Amanda Howell', 'Jon Osbeck']"
The Ring,6.1,,"['Comedy', 'Drama']",1952,['Sports'],America,,,PT1H19M,A young Mexican/American learns about life both inside and out of the ring when he takes up boxing.The Ring featuring Gerald Mohr and Rita Moreno is available for rent or purchase on Prime Video. It's a comedy and drama movie with an average IMDb audience rating of 6.1 (740 votes).,Kurt Neumann,"['Gerald Mohr', 'Rita Moreno', 'Lalo Rios', 'Robert Arthur', 'Robert Osterloh', 'Martín Garralaga', 'Art Aragon', 'Jack Elam', 'Peter Brocco', 'Robert Shayne', 'Julia Montoya', 'Lillian Molieri', 'Pepe Hern', 'Victor Millan', 'Tony Martinez', 'Ernie Chavez', 'Edward Sieg', 'Frank King', 'Maurice King', 'Irving Shulman', 'Herschel Burke Gilbert']"
The Novelist,8,,['Comedy'],2017,[],,,,PT1H26M,"Lewis was a good-selling writer once, a mid-list writer, as they call them in the industry, basically one who sells enough books to keep on-board, but not so many he becomes rich out of it. But now that he is older, his books no longer sells, and his girlfriend is tired of being with someone who is always broke. When his publisher takes his next novel without an advance and insists on publishing it as an e-book only, Lewis is forced to take on a creative teaching job at the local community college to make ends meet. He meets a young woman writer filled with talent who begins to take over his mind and his life. At the crossroad of possibilities, Lewis must decide to continue with writing or give it up forever.The Novelist is available for rent or purchase on Prime Video. It's a comedy movie with a high IMDb audience rating of 8.0 (68 votes).",,[]
Havinck,6,,['Drama'],1987,[],,Free Services,,PT1H42M,"When his wife Lydia commits suicide, succesful attorney Robert Havinck is freed from his unhappy marriage. Unfortunately, it turns out she took a complete stranger along with her, and a feeling of guilt and curiosity about her motives lead Havinck to team up with his fifteen-year old daughter to explore Lydia's final days.Havinck featuring Willem Nijholt and Anne Martien Lousberg is free on The Roku Channel. It's a drama movie with an average IMDb audience rating of 6.0 (74 votes).",Frans Weisz,"['Willem Nijholt', 'Anne Martien Lousberg', 'Carolien van den Berg', 'Maarten Wansink', 'Coen Flink', 'Max Croiset', 'Dora van der Groen', 'Kenneth Herdigein', 'Eric van Heyst', 'Ella van Drumpt', 'Lieneke le Roux', 'Lex De Regt', 'Dorijn Curvers', 'Han Kerckhoffs', 'Ger Thijs', 'Raffles Dawson', 'Janine Versluys', 'Ger Thijs', 'Marja Brouwers']"
Terror! Death! Revenge!,5.9,,['Horror'],2018,[],America,Free Services,,PT1H5M,"Bring the feel of the Drive-in home with this Grindhouse anthology. Featuring three tales of horror delivered in a format that's sure to quench the thirst of any fan of the 70's and 80's Drive-in classics.Terror! Death! Revenge! featuring Rene Arnal and Ian J.R. Bryant is free on Tubi, and available for rent or purchase on Prime Video. It's a horror movie with an average IMDb audience rating of 5.9 (89 votes).",Jon Manthei,"['Joseph Thompson', 'Rene Arnal', 'Ian J.R. Bryant', 'Virginia Bryant', 'Kelly Dettmer', 'Jessica Galvan', 'Jackie Hall', 'Dennis Janiske', 'Doug Kolbicz', 'Cyndi Kulman', 'James Arthur Lewis', 'Brian Manthei', 'Jon Manthei', 'Debbie Rozskowski', 'April Treece', 'Jaclyn Wells', 'Alaina Marie Manthei', 'Chris Rosik', 'Jon Manthei', 'Joseph Thompson', 'Robby Melling', 'Jon Manthei', 'Joseph Thompson']"
Untamed Mistress,4.9,,"['Action & Adventure', 'Drama']",1956,"['Animal', 'Jungle']",America,Prime Video,,PT1H10M,"Two men search the jungle for a woman who has been captured by a tribe of murderous gorillas. When they finally find her, they must fight off attacks by the gorillas, who are determined to keep her.Untamed Mistress featuring Jacqueline Fontaine and Allan Nixon is streaming with subscription on Prime Video, and available for rent or purchase on Prime Video. It's an action & adventure and drama movie with a less than average IMDb audience rating of 4.9 (55 votes).",Ron Ormond,"['Jacqueline Fontaine', 'Allan Nixon', 'Cliff Taylor', 'Byron Keith', 'Carol Varga', 'Don C. Harvey', 'Jack Reitzen', 'Nelson Leigh', 'Rick Vallin', 'F.E. Miller', 'James Adamson', 'Johnny Martin', 'Johnny Marlin', 'Paul Leslie Peil', 'Ron Ormond']"
The Way of the Tiger,5.4,,"['Action & Adventure', 'Drama']",1973,['Martial Arts'],Taiwan,Free Services,18+ (R),PT1H25M,The greatest martial arts spectacular of all time!The Way of the Tiger featuring Tong Lung and Hung-Ying Shang-Kuan is free on Tubi. It's an action & adventure and drama movie with a less than average IMDb audience rating of 5.4 (27 votes).,Li Kuan-Chang,"['Tong Lung', 'Hung-Ying Shang-Kuan', 'Shih Chung-Tien', 'Tang Chia-Chuan', 'Chang Fang-Hsia', 'Chang I-Fei', 'Tsao Chien', 'Yang Kuei Yu', 'Li Kuan-Chang', 'Ku Kwan']"
Sick School,6.9,,['Documentary'],2019,[],,,,PT1H30M,The students at Frank P. Long Elementary School have been getting sick.Sick School is available for rent or purchase on Prime Video. It's a documentary movie with a better than average IMDb audience rating of 6.9 (40 votes).,,[]
Double Trouble,5.4,,['Comedy'],2018,[],Czechia,Free Services,,PT1H21M,"Marek lives alternately with two women. He tells them both that he works in another city for part of the week. In reality, he stays in the same and moves from apartment to apartment. This works perfectly until one morning he wakes up in the wrong flat.Double Trouble featuring Jan Plouhar and Veronika Khek Kubařová is free on Freevee (Via Prime Video), and available for rent or purchase on Prime Video. It's a comedy movie with a less than average IMDb audience rating of 5.4 (94 votes).",Jakub Sommer,"['Jan Plouhar', 'Veronika Khek Kubařová', 'Hana Vagnerová', 'Jiří Hána', 'Sabina Rojková', 'Timotej Cervenka', 'Mojmír Maděrič', 'Kamil Švejda', 'Petr Vydra', 'Izabela Kapiasová', 'Matěj Dadák']"
Three of a Kind,6,,"['Romance', 'Comedy']",1936,[],,,,PT1H8M,A truck driver and a gold-digger meet at a swank hotel and both think the other is wealthy. A drama of greed and society.Three of a Kind featuring Chick Chandler and Evalyn Knapp is available for rent or purchase on Prime Video. It's a comedy and romance movie with an average IMDb audience rating of 6.0 (119 votes).,Phil Rosen,"['Chick Chandler', 'Evalyn Knapp', 'Berton Churchill', 'Patricia Farr', 'Richard Carle', 'Bradley Page', 'Lew Kelly', 'Pat West', 'Bryant Washburn', 'Harry C. Bradley', 'John Dilson', 'Billy Gilbert', 'Jack Shutta', 'Jack Gardner', 'Arthur T. Horman']"
The Doctor's Wife,7.2,,"['Biography', 'Documentary']",2012,[],,,,PT1H37M,"A young gay doctor decides to move from the city to the country to further his career. His partner, an ex-actor takes a camera along with them and films their experience.The Doctor's Wife is available for rent or purchase on Prime Video. It's a biography and documentary movie with a better than average IMDb audience rating of 7.2 (26 votes).",,[]
Naan,7.5,,"['Drama', 'Romance']",2012,[],India,,7+ (PG),PT2H15M,"An ex-convict forges signature of a deceased medical student to get enrolled in a medical college. He kills his roommate by accident in a dispute and fears that his identity will be revealed.Naan featuring Vijay Antony and Siddharth Venugopal is available for rent or purchase on Prime Video. It's a drama and romance movie with a better than average IMDb audience rating of 7.5 (1,739 votes).",Jeeva Shankar,"['Vijay Antony', 'Siddharth Venugopal', 'Rupa Manjari', 'Anuya Bhagvath', 'Vijay Victor Jesudoss', 'Vibha Natarajan', 'Krishnamurthy', 'Pramod', 'Charmila', 'Sheela Rajkumar', 'Saravanan', 'Fathima Vijay Antony', 'Jeeva Shankar']"
Made in Mexico,8.5,,"['Comedy', 'Crime']",2022,[],,,,PT1H16M,"When a down-on-his luck father of three has Hollywood buzzing over his screenplay, it's a matter of time before all his dreams come true. However, his dreams are short lived when a pair of shady film makers con him out of the rights and he has no choice but to join forces with an unlikely partner, a drug lord who has plans of his own for this upcoming screenwriter - Famous People want to be Wealthy and Wealthy People want to be Famous. But being rich is where it's really at.Made in Mexico is available for rent or purchase on iTunes, available for rent or purchase on Prime Video, and available for rent or purchase on VUDU. It's a comedy and crime movie with a high IMDb audience rating of 8.5 (7 votes).",,[]
Hooray for Love,6,,"['Musical', 'Comedy']",1935,"['Music', 'Singing']",America,,,PT1H12M,"A wealthy young man falls hard for a beautiful showgirl, and her wily father quickly realizes the naïve boy would make the perfect investor for his daughter's new show. Comedy with music.Hooray for Love featuring Ann Sothern and Gene Raymond is available for rent or purchase on iTunes, and available for rent or purchase on Prime Video. It's a comedy and musical movie with an average IMDb audience rating of 6.0 (176 votes).",Walter Lang,"['Ann Sothern', 'Gene Raymond', 'Thurston Hall', 'Pert Kelton', 'Lionel Stander', 'Bill Robinson', 'Fats Waller', 'Maria Gambarelli', 'Etienne Girardot', 'Jeni Le Gon', 'Georgia Caine', 'Bess Flowers', 'Lucille Ball', 'Lawrence Hazard', 'Ray Harris', 'Alberto Colombo']"
